[
  {
    "trend": "neutral",
    "technical_score": 0,
    "sentiment_score": 0,
    "risk_assessment": "normal",
    "market_alignment": "neutral",
    "movement_prediction": "** 1-day: 0-0.5% movement (50% confidence); 7-day: 1-2% movement (40% confidence); 14-day: 2-3% movement (30% confidence)",
    "options_implications": "** Given the neutral forecast and moderate volatility (ATR of 1.5%), credit spreads with 7-15 DTE are viable. Ideal strike distances would be 2-3% out-of-the-money (OTM) for both calls and puts, aiming for a small premium collection. The low confidence levels suggest a conservative approach, focusing on high probability of profit (HPOP) trades rather than maximizing premium. A straddle or strangle could also be considered given the expectation of moderate movement in either direction.",
    "structured_movement_prediction": {
      "1_day": {
        "magnitude": "0-0.5",
        "direction": "movement",
        "confidence": 50
      },
      "7_day": {
        "magnitude": "1-2",
        "direction": "movement",
        "confidence": 40
      },
      "14_day": {
        "magnitude": "2-3",
        "direction": "movement",
        "confidence": 30
      }
    },
    "summary": "## AAPL Analysis - 2025-03-19\n\n**1. Stock trend:** neutral\n\n**2. Technical Score:** 0\n\n**3.",
    "date": "2025-03-19",
    "price": 0,
    "atr_percent": 0,
    "analysis_type": "daily_1mo",
    "full_analysis": "## AAPL Analysis - 2025-03-19\n\n**1. Stock trend:** neutral\n\n**2. Technical Score:** 0\n\n**3. Sentiment Score:** 0\n\n**4. Risk assessment:** normal\n\n**5. Market Alignment:** neutral\n\n**6. Movement Prediction:** 1-day: 0-0.5% movement (50% confidence); 7-day: 1-2% movement (40% confidence); 14-day: 2-3% movement (30% confidence)\n\n**7. Options Implications:** Given the neutral forecast and moderate volatility (ATR of 1.5%), credit spreads with 7-15 DTE are viable. Ideal strike distances would be 2-3% out-of-the-money (OTM) for both calls and puts, aiming for a small premium collection. The low confidence levels suggest a conservative approach, focusing on high probability of profit (HPOP) trades rather than maximizing premium. A straddle or strangle could also be considered given the expectation of moderate movement in either direction.\n",
    "next_day_prediction": {
      "trend": "neutral",
      "volatility": "steady"
    }
  },
  {
    "accuracy": "high",
    "key_learning": "In highly stable market conditions (low VIX, neutral SPY), prioritizing strategies that profit from minimal movement or avoiding directional trades altogether is crucial.",
    "weight_adjustment": "Increase the weight given to VIX stability and SPY trend when assessing potential price movement. Reduce the weight given to indicators suggesting directional movement in neutral market environments.",
    "quantified_error": "Predicted 0-0.5% movement, actual was 0.00% - Accurate within 0.5%.",
    "credit_spread_strategy_refinement": "In situations with a neutral SPY trend, stable VIX, and a market trend score indicating low conviction, avoid initiating 7-15 DTE credit spreads. Focus on strategies that benefit from sideways price action or consider remaining flat.",
    "accuracy_score": 8,
    "date": "2025-03-20",
    "analysis_type": "reflection_daily",
    "full_reflection": "## Pretraining Reflection - 2025-03-19/20 Analysis\n\nThis analysis reflects on the prediction made on 2025-03-19 for the period ending 2025-03-20. The actual outcome was a completely neutral movement, a scenario I attempted to capture in the lower end of my 1-day prediction.\n\n**1. Trend Prediction Accuracy Assessment:**\n\n*   **1-day Prediction:** My 1-day prediction of 0-0.5% movement was highly accurate. The actual movement was 0.00%. The error margin is essentially zero. I correctly identified the potential for minimal movement.\n*   **7/14-day Predictions:** These predictions are still open, but the initial day\u2019s outcome suggests a high probability of these playing out towards the lower end of the ranges, or even remaining neutral. The lack of any movement on the first day significantly reduces the likelihood of 1-3% movement within the next week or two.\n*   **Reliable Indicators:** Given the neutral outcome, indicators suggesting consolidation (which weren\u2019t explicitly stated in the market context but would be part of a full analysis) would have been more reliable. The VIX stability at 20, while not extremely low, indicated a lack of significant fear, supporting the potential for a calm market.\n\n**2. Volatility Assessment:**\n\n*   I did not accurately *predict* volatility changes, but I didn\u2019t predict significant changes either. The prediction implicitly assumed steady volatility, which proved correct. The 0.00% change in ATR confirms this.\n*   Factors contributing to volatility shifts I may have missed are difficult to pinpoint given the complete lack of movement. However, a deeper dive into news events or earnings reports (not provided in the context) could have revealed potential catalysts for volatility, even if they didn\u2019t materialize. The VIX being stable was the key factor, and I correctly interpreted that as suggesting low volatility.\n\n**3. Technical Analysis Review:**\n\n*   Without access to the specific technical indicators used in the initial prediction, it\u2019s difficult to assess their helpfulness. However, given the neutral outcome, indicators like moving average convergence divergence (MACD) showing no strong trend, or range-bound oscillators (RSI, Stochastic) would have been more relevant.\n*   Support/resistance levels were not tested, so their reliability cannot be assessed.\n*   Price action around EMAs is irrelevant as there was no price action.\n\n**4. Market Alignment Impact:**\n\n*   The broader market (SPY trend: neutral) heavily influenced this stock\u2019s movement. The stock mirrored the SPY\u2019s lack of direction.\n*   The aligned movement to SPY mattered significantly. A neutral SPY strongly suggested a neutral outcome for the individual stock, and that proved to be the case. The market trend score of 10 reinforces this neutral outlook.\n\n**5. Options Implications:**\n\n*   My analysis would *not* have correctly positioned credit spreads for optimal profit. A credit spread strategy would have been a poor choice given the zero movement. The premium collected would likely have been eaten up by trading costs.\n*   Optimal strike selection would have been to avoid initiating any credit spreads. If forced to choose, very wide strikes (far out-of-the-money) would have minimized risk, but also potential reward.\n*   A 7-15 DTE credit spread strategy would have likely resulted in a loss or, at best, a break-even outcome. The lack of movement meant the options would have expired worthless, and the premium received would not have offset the cost of the spread.\n\n\n\n1. Prediction Accuracy: high\n2. Quantified Error: Predicted 0-0.5% movement, actual was 0.00% - Accurate within 0.5%.\n3. Key Learning: In highly stable market conditions (low VIX, neutral SPY), prioritizing strategies that profit from minimal movement or avoiding directional trades altogether is crucial.\n4. Weight Adjustment: Increase the weight given to VIX stability and SPY trend when assessing potential price movement. Reduce the weight given to indicators suggesting directional movement in neutral market environments.\n5. Credit Spread Strategy Refinement: In situations with a neutral SPY trend, stable VIX, and a market trend score indicating low conviction, avoid initiating 7-15 DTE credit spreads. Focus on strategies that benefit from sideways price action or consider remaining flat.\n"
  },
  {
    "trend": "neutral",
    "technical_score": 10,
    "sentiment_score": 0,
    "risk_assessment": "normal",
    "market_alignment": "neutral",
    "movement_prediction": "1-day: 0-0.5% movement (50% confidence); 7-day: 1-2% movement (40% confidence); 14-day: 2-4% movement (30% confidence)",
    "options_implications": "Given the neutral outlook and low confidence, focus on strategies that benefit from sideways movement. Credit spreads with 7-15 DTE are viable, but strike selection is crucial. Given the current price of $100, consider selling a credit spread with strikes around $98/$102, aiming for a small premium. The low confidence suggests a tighter strike distance to manage risk. Avoid directional strategies (calls or puts) due to the lack of strong conviction.",
    "structured_movement_prediction": {
      "1_day": {
        "magnitude": "0-0.5",
        "direction": "movement",
        "confidence": 50
      },
      "7_day": {
        "magnitude": "1-2",
        "direction": "movement",
        "confidence": 40
      },
      "14_day": {
        "magnitude": "2-4",
        "direction": "movement",
        "confidence": 30
      }
    },
    "summary": "## AAPL Analysis - 2025-03-19\n\n**Important Note:** The provided stock data contains an error message and several zero values for key indicators. This severely limits the accuracy of the analysis. The following is based on the limited available information and assumptions where necessary.",
    "date": "2025-03-19",
    "price": 0,
    "atr_percent": 0,
    "analysis_type": "intraday_15m",
    "full_analysis": "## AAPL Analysis - 2025-03-19\n\n**Important Note:** The provided stock data contains an error message and several zero values for key indicators. This severely limits the accuracy of the analysis. The following is based on the limited available information and assumptions where necessary.\n\n1. Stock trend: neutral\n2. Technical Score: 10\n3. Sentiment Score: 0\n4. Risk assessment: normal\n5. Market Alignment: neutral\n6. Movement Prediction: 1-day: 0-0.5% movement (50% confidence); 7-day: 1-2% movement (40% confidence); 14-day: 2-4% movement (30% confidence)\n7. Options Implications: Given the neutral outlook and low confidence, focus on strategies that benefit from sideways movement. Credit spreads with 7-15 DTE are viable, but strike selection is crucial. Given the current price of $100, consider selling a credit spread with strikes around $98/$102, aiming for a small premium. The low confidence suggests a tighter strike distance to manage risk. Avoid directional strategies (calls or puts) due to the lack of strong conviction.\n \n\n**Detailed Analysis:**\n\n**Price Trend Analysis:**\n\n*   **Price vs EMAs:** The current price is $100.00, while both EMA9 and EMA21 are $0.00. This is an anomaly due to the data error. Assuming the price is above both EMAs, it would be a bullish signal (+10 to Technicals).\n*   **RSI:** An RSI of 50.0 indicates a neutral momentum. It's neither overbought nor oversold.\n*   **MACD:** MACD and Signal are both 0.00, providing no directional signal.\n*   **Volume:** Volume is 0 vs an average of 0. This is another data error. Without volume data, it's impossible to confirm trend strength.\n\n**Support/Resistance Analysis:**\n\n*   Without historical data, identifying support and resistance levels is impossible. We can only assume that the current price is neither near a known support or resistance level.\n\n**Volatility Assessment:**\n\n*   ATR is 0.00, representing 1.50% of the price. This suggests moderate volatility (neutral).\n\n**Fundamental Context:**\n\n*   No fundamental data is provided. Sentiment score remains at 0.\n\n**Market Alignment:**\n\n*   The SPY trend is neutral, and the stock trend is also neutral. \n*   Market Alignment: neutral\n",
    "next_day_prediction": {
      "trend": "neutral",
      "volatility": "steady"
    }
  },
  {
    "accuracy": "low",
    "key_learning": "I need to incorporate a higher probability assessment for scenarios of extremely low volatility, especially when the broader market is neutral.",
    "weight_adjustment": "Increase the weight of VIX stability and SPY trend when assessing potential price movement. Decrease the weight of standard technical indicators in neutral market conditions.",
    "quantified_error": "Predicted 0-0.5% movement, actual was 0.00% - Overestimated by 0.00-0.5%.",
    "credit_spread_strategy_refinement": "In extremely neutral market conditions (stable VIX, neutral SPY), avoid credit spread strategies unless strikes are placed extremely close to the current price, prioritizing theta decay over directional profit. Consider alternative strategies like iron condors with very narrow wings.",
    "accuracy_score": 2,
    "error_magnitude": 0.0,
    "date": "2025-03-20",
    "analysis_type": "reflection_intraday",
    "full_reflection": "## Pretraining Reflection - 2025-03-19/20 Analysis\n\nThis analysis reflects on the prediction made on 2025-03-19 for the period ending 2025-03-20. The actual outcome was a completely neutral movement, a scenario I attempted to account for but assigned a relatively low probability to.\n\n**1. Trend Prediction Accuracy Assessment:**\n\n*   **1-day Prediction:** My prediction was for 0-0.5% movement. The actual movement was 0.00%. This is highly accurate, falling squarely within the predicted range. The error margin is 0.00% - 0.5%.\n*   **7-day & 14-day Predictions:** These predictions are still open, but the initial day\u2019s outcome suggests a high probability of remaining within the 1-2% and 2-4% ranges respectively, though leaning towards the lower end.\n*   **Reliable Indicators:** Given the neutral outcome, the most reliable indicator was arguably the market trend score (10), indicating a lack of strong directional bias. The stable VIX (20.0, stable) also supported the expectation of limited movement.\n\n**2. Volatility Assessment:**\n\n*   I did *not* correctly predict volatility changes. I anticipated *some* movement, even within the 0-0.5% range, implying a degree of volatility. The actual outcome was zero change in both price and ATR.\n*   Factors contributing to the missed volatility shift: The market context indicated a 'standard' risk adjustment, which led me to assume a baseline level of volatility. I underestimated the potential for complete stasis, particularly given the neutral SPY trend and stable VIX. I should have considered a scenario of *extremely* low volatility as more probable.\n\n**3. Technical Analysis Review:**\n\n*   **Helpful/Misleading Indicators:** The market context indicators (SPY trend, VIX stability) were the most helpful. Technical indicators (not explicitly detailed in the provided context, but assumed to be part of the initial analysis) likely proved less useful in this scenario, as a lack of directional momentum rendered them less informative.\n*   **Support/Resistance:** Without specific support/resistance levels provided, it's impossible to assess their performance. However, the lack of movement suggests they were not tested or were effectively neutral.\n*   **EMAs:** The correlation between price action and EMAs is unknown without that data. In a flat market, EMAs are less indicative of future movement.\n\n**4. Market Alignment Impact:**\n\n*   The broader market (neutral SPY trend) heavily influenced this stock's movement. The stock mirrored the SPY's lack of direction.\n*   Aligned movement to SPY mattered significantly. The stock\u2019s complete lack of movement reinforces the strong correlation with the broader market in this instance. A contrary movement would have been a significant outlier.\n\n**5. Options Implications:**\n\n*   **Credit Spreads:** My analysis would *not* have correctly positioned credit spreads for this movement. A credit spread strategy would have likely resulted in minimal profit or a small loss due to the lack of price movement.\n*   **Strike Selection:** Optimal strike selection would have been to choose strikes extremely close to the current price, aiming for maximum theta decay. However, the potential profit would have been minimal.\n*   **7-15 DTE Strategy:** A 7-15 DTE credit spread strategy would have been unfavorable. The lack of movement would have resulted in the spread expiring worthless or with minimal profit, making the time decay insufficient to offset the spread cost.\n\n\n\n1. Prediction Accuracy: **moderate**\n2. Quantified Error: Predicted 0-0.5% movement, actual was 0.00% - Overestimated by 0.00-0.5%.\n3. Key Learning: I need to incorporate a higher probability assessment for scenarios of extremely low volatility, especially when the broader market is neutral.\n4. Weight Adjustment: Increase the weight of VIX stability and SPY trend when assessing potential price movement. Decrease the weight of standard technical indicators in neutral market conditions.\n5. Credit Spread Strategy Refinement: In extremely neutral market conditions (stable VIX, neutral SPY), avoid credit spread strategies unless strikes are placed extremely close to the current price, prioritizing theta decay over directional profit. Consider alternative strategies like iron condors with very narrow wings.\n"
  },
  {
    "trend": "neutral",
    "technical_score": 10,
    "sentiment_score": 0,
    "risk_assessment": "normal",
    "market_alignment": "neutral",
    "movement_prediction": "1-day: 0-0.5% movement (50% confidence); 7-day: 0.5-1.5% movement (40% confidence); 14-day: 1-3% movement (30% confidence)",
    "options_implications": "Given the neutral outlook and low confidence, a strategy focusing on minimal directional bias is preferred. Credit spreads with 7-15 DTE could be considered, but with very tight strike distances (at-the-money or slightly out-of-the-money) to capitalize on time decay. The low ATR suggests limited premium, so position sizing should be conservative. Avoid spreads with significant directional exposure.",
    "structured_movement_prediction": {
      "1_day": {
        "magnitude": "0-0.5",
        "direction": "movement",
        "confidence": 50
      },
      "7_day": {
        "magnitude": "0.5-1.5",
        "direction": "movement",
        "confidence": 40
      },
      "14_day": {
        "magnitude": "1-3",
        "direction": "movement",
        "confidence": 30
      }
    },
    "summary": "## AAPL Analysis - 2025-03-20\n\n**Important Disclaimer:** The provided data is severely flawed with an error message and numerous zero values. This analysis is highly speculative and based on limited information, making assumptions where necessary. 1.",
    "date": "2025-03-20",
    "price": 0,
    "atr_percent": 0,
    "analysis_type": "intraday_15m",
    "full_analysis": "## AAPL Analysis - 2025-03-20\n\n**Important Disclaimer:** The provided data is severely flawed with an error message and numerous zero values. This analysis is highly speculative and based on limited information, making assumptions where necessary.\n\n1. Stock trend: neutral\n2. Technical Score: 10\n3. Sentiment Score: 0\n4. Risk assessment: normal\n5. Market Alignment: neutral\n6. Movement Prediction: 1-day: 0-0.5% movement (50% confidence); 7-day: 0.5-1.5% movement (40% confidence); 14-day: 1-3% movement (30% confidence)\n7. Options Implications: Given the neutral outlook and low confidence, a strategy focusing on minimal directional bias is preferred. Credit spreads with 7-15 DTE could be considered, but with very tight strike distances (at-the-money or slightly out-of-the-money) to capitalize on time decay. The low ATR suggests limited premium, so position sizing should be conservative. Avoid spreads with significant directional exposure.\n",
    "next_day_prediction": {
      "trend": "neutral",
      "volatility": "steady"
    }
  },
  {
    "accuracy": "low",
    "key_learning": "I need to more strongly prioritize stable VIX and neutral market conditions as indicators of potentially zero price movement.",
    "weight_adjustment": "Increase the weight of VIX stability and SPY trend alignment, especially when both indicate neutrality. Decrease the weight given to potential for minor fluctuations in stable markets.",
    "quantified_error": "Predicted 0-0.5% movement, actual was 0.00% - Accurate within 0.5%.",
    "credit_spread_strategy_refinement": "In situations with stable VIX and neutral SPY trends, avoid opening 7-15 DTE credit spreads. If a trade is necessary, utilize extremely wide strikes to minimize risk, acknowledging the limited profit potential.",
    "accuracy_score": 2,
    "date": "2025-03-21",
    "analysis_type": "reflection_intraday",
    "full_reflection": "## Pretraining Reflection - 2025-03-20/21 Analysis\n\nThis analysis reflects on the prediction made on 2025-03-20 for the period ending 2025-03-21. The actual outcome was a completely neutral movement, a scenario that highlights the challenges of short-term price prediction.\n\n**1. Trend Prediction Accuracy Assessment:**\n\n*   **1-day Prediction:** My prediction of 0-0.5% movement was highly accurate. The actual movement was 0.00%. The error margin is essentially zero. This is a successful prediction, though predicting *no* movement is often a matter of luck.\n*   **7-day & 14-day Predictions:** These predictions are currently moot as only one day has passed. However, the initial expectation of even slight movement (0.5-1.5% and 1-3% respectively) was incorrect. We need to monitor these over the coming days to assess their validity.\n*   **Reliable Indicators:** Given the lack of movement, it's difficult to identify reliable indicators. The market context (neutral SPY, stable VIX) *suggested* low volatility, which proved correct. However, no specific technical indicator stood out as particularly predictive.\n\n**2. Volatility Assessment:**\n\n*   **Volatility Prediction:** I predicted a potential for volatility (implied by the ranges given for 7 and 14-day movements). This was incorrect. The actual volatility remained steady, as indicated by the unchanged ATR.\n*   **Missed Factors:** The stable VIX (at 20) was a strong signal of expected low volatility, but I didn't fully internalize that into a prediction of *zero* movement. I likely overemphasized the possibility of even minor fluctuations. The market trend score of 10, while indicating neutrality, didn't strongly suggest complete stagnation.\n\n**3. Technical Analysis Review:**\n\n*   **Helpful/Misleading Indicators:** No indicators were particularly helpful in this instance. The lack of price movement renders most technical analysis irrelevant.\n*   **Support/Resistance:** Support and resistance levels were not tested, so their reliability cannot be assessed.\n*   **EMAs:** EMAs were not relevant given the lack of price movement. There was no correlation to analyze.\n\n**4. Market Alignment Impact:**\n\n*   **Broader Market Influence:** The neutral SPY trend strongly influenced the stock's movement. The stock mirrored the broader market's lack of direction.\n*   **SPY Alignment:** The aligned movement with SPY was crucial. The stock didn't deviate from the overall market sentiment. In this case, alignment mattered *significantly* \u2013 a contrary move would have been highly unusual given the stable market conditions.\n\n**5. Options Implications:**\n\n*   **Credit Spread Positioning:** My analysis would *not* have correctly positioned credit spreads for this movement. Any spread would have likely experienced theta decay without significant premium capture.\n*   **Optimal Strike Selection:** Given the actual movement, the optimal strike selection would have been to avoid opening any credit spreads. If forced to trade, extremely wide strikes would have minimized risk, but also potential reward.\n*   **7-15 DTE Strategy:** A 7-15 DTE credit spread strategy would have been unfavorable. The lack of movement would have resulted in minimal profit and a high probability of assignment if near the money.\n\n\n\n1. Prediction Accuracy: **high**\n2. Quantified Error: Predicted 0-0.5% movement, actual was 0.00% - Accurate within 0.5%.\n3. Key Learning: I need to more strongly prioritize stable VIX and neutral market conditions as indicators of potentially zero price movement.\n4. Weight Adjustment: Increase the weight of VIX stability and SPY trend alignment, especially when both indicate neutrality. Decrease the weight given to potential for minor fluctuations in stable markets.\n5. Credit Spread Strategy Refinement: In situations with stable VIX and neutral SPY trends, avoid opening 7-15 DTE credit spreads. If a trade is necessary, utilize extremely wide strikes to minimize risk, acknowledging the limited profit potential.\n"
  },
  {
    "trend": "neutral",
    "technical_score": 10,
    "sentiment_score": 0,
    "risk_assessment": "normal",
    "market_alignment": "neutral",
    "movement_prediction": "1-day: 0-0.5% movement (50% confidence); 7-day: 0.5-1.5% movement (40% confidence); 14-day: 1-3% movement (30% confidence)",
    "options_implications": "Given the neutral outlook and low confidence, a strategy focusing on minimal directional bias is preferred. Credit spreads with 7-15 DTE could be considered, but with very tight strike distances (at-the-money or slightly out-of-the-money) to capitalize on time decay. The low confidence suggests a small position size is prudent. Avoid deep out-of-the-money options due to the limited expected movement.",
    "structured_movement_prediction": {
      "1_day": {
        "magnitude": "0-0.5",
        "direction": "movement",
        "confidence": 50
      },
      "7_day": {
        "magnitude": "0.5-1.5",
        "direction": "movement",
        "confidence": 40
      },
      "14_day": {
        "magnitude": "1-3",
        "direction": "movement",
        "confidence": 30
      }
    },
    "summary": "## AAPL Analysis - 2025-03-21\n\n**Important Disclaimer:** The provided data is severely flawed with an error message and numerous zero values. This analysis is highly speculative and based on limited information, making assumptions where necessary. 1.",
    "date": "2025-03-21",
    "price": 0,
    "atr_percent": 0,
    "analysis_type": "intraday_15m",
    "full_analysis": "## AAPL Analysis - 2025-03-21\n\n**Important Disclaimer:** The provided data is severely flawed with an error message and numerous zero values. This analysis is highly speculative and based on limited information, making assumptions where necessary.\n\n1. Stock trend: neutral\n2. Technical Score: 10\n3. Sentiment Score: 0\n4. Risk assessment: normal\n5. Market Alignment: neutral\n6. Movement Prediction: 1-day: 0-0.5% movement (50% confidence); 7-day: 0.5-1.5% movement (40% confidence); 14-day: 1-3% movement (30% confidence)\n7. Options Implications: Given the neutral outlook and low confidence, a strategy focusing on minimal directional bias is preferred. Credit spreads with 7-15 DTE could be considered, but with very tight strike distances (at-the-money or slightly out-of-the-money) to capitalize on time decay. The low confidence suggests a small position size is prudent. Avoid deep out-of-the-money options due to the limited expected movement.\n\n\n\n**Analysis:**\n\nThe provided data presents significant challenges. The 'error' flag and numerous zero values for key indicators (EMAs, ATR, MACD, Volume) render a robust technical analysis impossible. We must rely heavily on the RSI and the previous day's analysis.\n\n**Price Trend Analysis:**\n\n*   **Price vs EMAs:** With both EMAs at zero, a comparison is impossible.\n*   **RSI:** An RSI of 50 indicates a neutral momentum. Not overbought or oversold.\n*   **MACD:** A MACD of zero with a zero signal line provides no directional signal.\n*   **Volume:** Zero volume compared to an average of zero is inconclusive.\n\n**Support/Resistance Analysis:**\n\nWithout historical data, identifying support and resistance levels is impossible. We cannot assess if the current price is near any significant levels.\n\n**Volatility Assessment:**\n\nAn ATR of 0.00 with an ATR% of 1.50% is contradictory. Assuming the ATR% is relative to the current price of $100, this would imply an ATR of $1.50. This is a very low volatility level, suggesting a stable stock.\n\n**Fundamental Context:**\n\nNo fundamental data is provided. The sentiment score remains at 0.\n\n**Market Alignment:**\n\nThe market trend is neutral, and the stock trend is also neutral. Therefore, the alignment is neutral.\n\n**Multi-Day Forecasting:**\n\nGiven the lack of reliable data, the forecast is a continuation of the previous day's prediction, adjusted slightly downwards in confidence due to the worsening data quality. The neutral RSI and MACD, combined with the stable volatility, suggest limited price movement in the near term.\n",
    "next_day_prediction": {
      "trend": "neutral",
      "volatility": "steady"
    }
  },
  {
    "trend": "neutral",
    "technical_score": 10,
    "sentiment_score": 0,
    "risk_assessment": "normal",
    "market_alignment": "neutral",
    "movement_prediction": "1-day: 0-0.5% movement (50% confidence); 7-day: 0.5-1.5% movement (40% confidence); 14-day: 1-3% movement (30% confidence)",
    "options_implications": "Given the neutral outlook and low confidence, a strategy focusing on time decay would be most appropriate. Credit spreads with 7-15 DTE, utilizing strikes slightly out-of-the-money (2-5% from the current price of $100) could be considered. The low volatility (VIX at 20) suggests relatively stable premiums, making credit spreads attractive. However, due to the data quality issues, caution is advised, and position sizing should be conservative.",
    "structured_movement_prediction": {
      "1_day": {
        "magnitude": "0-0.5",
        "direction": "movement",
        "confidence": 50
      },
      "7_day": {
        "magnitude": "0.5-1.5",
        "direction": "movement",
        "confidence": 40
      },
      "14_day": {
        "magnitude": "1-3",
        "direction": "movement",
        "confidence": 30
      }
    },
    "summary": "## AAPL Analysis - 2025-03-24\n\n**Important Disclaimer:** The provided data is severely flawed with an error message and numerous zero values. This analysis is highly speculative and based on limited information, making assumptions where necessary. 1.",
    "date": "2025-03-24",
    "price": 0,
    "atr_percent": 0,
    "analysis_type": "intraday_15m",
    "full_analysis": "## AAPL Analysis - 2025-03-24\n\n**Important Disclaimer:** The provided data is severely flawed with an error message and numerous zero values. This analysis is highly speculative and based on limited information, making assumptions where necessary.\n\n1. Stock trend: neutral\n2. Technical Score: 10\n3. Sentiment Score: 0\n4. Risk assessment: normal\n5. Market Alignment: neutral\n6. Movement Prediction: 1-day: 0-0.5% movement (50% confidence); 7-day: 0.5-1.5% movement (40% confidence); 14-day: 1-3% movement (30% confidence)\n7. Options Implications: Given the neutral outlook and low confidence, a strategy focusing on time decay would be most appropriate. Credit spreads with 7-15 DTE, utilizing strikes slightly out-of-the-money (2-5% from the current price of $100) could be considered. The low volatility (VIX at 20) suggests relatively stable premiums, making credit spreads attractive. However, due to the data quality issues, caution is advised, and position sizing should be conservative.\n\n\n\n**Analysis Details:**\n\nThe provided data presents significant challenges. The 'error' flag and zero values for key indicators (EMAs, ATR, MACD, Volume) severely limit a robust technical analysis.  We must rely heavily on the RSI and the previous analysis.\n\n**Price Trend Analysis:**\n\n*   **Price vs EMAs:** With EMAs at zero, we cannot assess the price relationship.\n*   **RSI:** An RSI of 50 indicates a neutral momentum. Not overbought or oversold.\n*   **MACD:** A MACD of zero provides no directional signal.\n*   **Volume:** Zero volume compared to an average of zero is uninformative.\n\n**Support/Resistance Analysis:**\n\nWithout historical data, identifying support and resistance levels is impossible.\n\n**Volatility Assessment:**\n\nThe ATR of $0.00 (1.50% of price) suggests extremely low volatility. This is likely a data error, but we must operate under the assumption it's accurate. This would indicate a stable stock.\n\n**Fundamental Context:**\n\nNo fundamental data is provided. Sentiment remains at 0.\n\n**Market Alignment:**\n\nThe SPY trend is neutral. AAPL's trend is also neutral, resulting in a \"neutral\" alignment.\n\n\n\n",
    "next_day_prediction": {
      "trend": "neutral",
      "volatility": "steady"
    }
  }
]