[
  {
    "trend": "neutral",
    "technical_score": 0,
    "sentiment_score": 0,
    "risk_assessment": "normal",
    "market_alignment": "neutral",
    "movement_prediction": "** 1-day: 0-0.5% movement (50% confidence); 7-day: 1-2% movement (40% confidence); 14-day: 2-3% movement (30% confidence)",
    "options_implications": "** Given the neutral forecast and moderate volatility (ATR of 1.5%), credit spreads with 7-15 DTE are viable. Ideal strike distances would be 2-3% out-of-the-money (OTM) on both the call and put sides, aiming for a credit capture of 0.10-0.20 per share. The low confidence levels suggest a smaller position size is prudent. The VIX at 20 indicates relatively normal levels, supporting this strategy.",
    "structured_movement_prediction": {
      "1_day": {
        "magnitude": "0-0.5",
        "direction": "movement",
        "confidence": 50
      },
      "7_day": {
        "magnitude": "1-2",
        "direction": "movement",
        "confidence": 40
      },
      "14_day": {
        "magnitude": "2-3",
        "direction": "movement",
        "confidence": 30
      }
    },
    "summary": "## AAPL Analysis - 2025-03-19\n\n**1. Stock trend:** neutral\n\n**2. Technical Score:** 0\n\n**3.",
    "date": "2025-03-19",
    "price": 0,
    "atr_percent": 0,
    "analysis_type": "daily_1mo",
    "full_analysis": "## AAPL Analysis - 2025-03-19\n\n**1. Stock trend:** neutral\n\n**2. Technical Score:** 0\n\n**3. Sentiment Score:** 0\n\n**4. Risk assessment:** normal\n\n**5. Market Alignment:** neutral\n\n**6. Movement Prediction:** 1-day: 0-0.5% movement (50% confidence); 7-day: 1-2% movement (40% confidence); 14-day: 2-3% movement (30% confidence)\n\n**7. Options Implications:** Given the neutral forecast and moderate volatility (ATR of 1.5%), credit spreads with 7-15 DTE are viable. Ideal strike distances would be 2-3% out-of-the-money (OTM) on both the call and put sides, aiming for a credit capture of 0.10-0.20 per share. The low confidence levels suggest a smaller position size is prudent. The VIX at 20 indicates relatively normal levels, supporting this strategy.\n",
    "next_day_prediction": {
      "trend": "neutral",
      "volatility": "steady"
    }
  },
  {
    "accuracy": "low",
    "key_learning": "I need to prioritize strategies that capitalize on extremely low volatility environments, even if the potential profit is smaller.",
    "weight_adjustment": "Increase the weight given to VIX stability and broader market trend alignment when volatility is already low. Decrease the weight given to potential directional movement when the market is showing signs of consolidation.",
    "quantified_error": "Predicted 0-0.5% movement, actual was 0.00% - Accurate within 0.5%.",
    "credit_spread_strategy_refinement": "In extremely low volatility scenarios, focus on tighter strike selection for 7-15 DTE credit spreads, prioritizing theta decay over directional profit. Consider strategies beyond traditional credit spreads, such as straddles/strangles with narrow strikes, or even naked options with careful risk management.",
    "accuracy_score": 2,
    "date": "2025-03-20",
    "analysis_type": "reflection_daily",
    "full_reflection": "## Pretraining Reflection - 2025-03-19/20 Analysis\n\nThis analysis reflects on the prediction made on 2025-03-19 for the period ending 2025-03-20. The actual outcome was a completely neutral movement, a scenario I attempted to capture in the lower end of my 1-day prediction.\n\n**1. Trend Prediction Accuracy Assessment:**\n\n*   **1-day Prediction:** My 1-day prediction of 0-0.5% movement was highly accurate. The actual movement was 0.00%. The error margin is essentially zero. I correctly identified the potential for minimal movement.\n*   **7/14-day Predictions:** These predictions are still open, but the initial day\u2019s outcome suggests a high probability of these playing out towards the lower end of the ranges, or even remaining neutral. The lack of any movement on the first day significantly reduces the likelihood of 1-3% movement within the next week or two.\n*   **Reliable Indicators:** Given the neutral outcome, indicators suggesting consolidation (which weren\u2019t explicitly stated in the market context but would be part of a full analysis) would have been more reliable. The VIX stability at 20, while not extremely low, indicated a lack of significant fear, supporting the potential for a calm market.\n\n**2. Volatility Assessment:**\n\n*   I did not correctly *predict* volatility changes, but I didn\u2019t predict significant changes either. The prediction implicitly assumed steady volatility, which proved accurate. The 0.00% change in ATR confirms this.\n*   Factors contributing to volatility shifts I may have missed are difficult to pinpoint given the complete lack of movement. However, a deeper dive into news events or earnings reports (not provided in the context) could have revealed potential catalysts for volatility, even if they didn\u2019t materialize. The VIX being stable was the key factor, and I correctly noted that.\n\n**3. Technical Analysis Review:**\n\n*   Without specific technical indicators listed in the market context, it\u2019s difficult to assess their performance. However, a focus on consolidation patterns (flags, rectangles) would have been beneficial.\n*   Support/Resistance levels: No information on these levels was provided, so their performance cannot be evaluated.\n*   EMAs: No information on EMAs was provided, so their correlation cannot be evaluated.\n\n**4. Market Alignment Impact:**\n\n*   The broader market (SPY) being neutral strongly influenced this stock\u2019s movement. The stock mirrored the SPY\u2019s lack of direction.\n*   Aligned movement to SPY mattered significantly. The neutral SPY trend essentially capped potential movement in the stock. A contrary movement in SPY would have been a stronger signal, but the alignment reinforced the expectation of minimal change.\n\n**5. Options Implications:**\n\n*   My analysis would have *not* positioned credit spreads optimally. While avoiding significant loss, it wouldn\u2019t have capitalized on the complete lack of movement. A strategy focused on maximizing time decay would have been preferable.\n*   Optimal strike selection would have been very tight \u2013 extremely close to the current price. A straddle or strangle with very narrow strikes would have been the most profitable, though also the highest risk.\n*   A 7-15 DTE credit spread strategy would have performed poorly. The minimal movement meant theta decay was the primary profit driver, and a wider spread would have captured less of that decay. A very narrow spread, or even selling naked puts/calls (with appropriate risk management) would have been more effective.\n\n\n\n1. Prediction Accuracy: **high**\n2. Quantified Error: Predicted 0-0.5% movement, actual was 0.00% - Accurate within 0.5%.\n3. Key Learning: I need to prioritize strategies that capitalize on extremely low volatility environments, even if the potential profit is smaller.\n4. Weight Adjustment: Increase the weight given to VIX stability and broader market trend alignment when volatility is already low. Decrease the weight given to potential directional movement when the market is showing signs of consolidation.\n5. Credit Spread Strategy Refinement: In extremely low volatility scenarios, focus on tighter strike selection for 7-15 DTE credit spreads, prioritizing theta decay over directional profit. Consider strategies beyond traditional credit spreads, such as straddles/strangles with narrow strikes, or even naked options with careful risk management."
  },
  {
    "trend": "neutral",
    "technical_score": 10,
    "sentiment_score": 0,
    "risk_assessment": "normal",
    "market_alignment": "neutral",
    "movement_prediction": "1-day: 0-0.5% movement (50% confidence); 7-day: 1-2% movement (40% confidence); 14-day: 2-4% movement (30% confidence)",
    "options_implications": "Given the neutral outlook and low confidence, a strategy focusing on time decay would be preferable. Credit spreads with 7-15 DTE, utilizing strikes slightly out-of-the-money (OTM) in both directions, could be considered. Ideal strike distance would be approximately 2-3% from the current price ($100), aiming for a small premium capture. Due to the limited data quality, a smaller position size is recommended.",
    "structured_movement_prediction": {
      "1_day": {
        "magnitude": "0-0.5",
        "direction": "movement",
        "confidence": 50
      },
      "7_day": {
        "magnitude": "1-2",
        "direction": "movement",
        "confidence": 40
      },
      "14_day": {
        "magnitude": "2-4",
        "direction": "movement",
        "confidence": 30
      }
    },
    "summary": "## AAPL Analysis - 2025-03-19\n\n**Important Note:** The provided stock data contains an error message and several zero values for key indicators. This severely limits the accuracy of the analysis. The following is based on the limited available information and assumptions where necessary.",
    "date": "2025-03-19",
    "price": 0,
    "atr_percent": 0,
    "analysis_type": "intraday_15m",
    "full_analysis": "## AAPL Analysis - 2025-03-19\n\n**Important Note:** The provided stock data contains an error message and several zero values for key indicators. This severely limits the accuracy of the analysis. The following is based on the limited available information and assumptions where necessary.\n\n1. Stock trend: neutral\n2. Technical Score: 10\n3. Sentiment Score: 0\n4. Risk assessment: normal\n5. Market Alignment: neutral\n6. Movement Prediction: 1-day: 0-0.5% movement (50% confidence); 7-day: 1-2% movement (40% confidence); 14-day: 2-4% movement (30% confidence)\n7. Options Implications: Given the neutral outlook and low confidence, a strategy focusing on time decay would be preferable. Credit spreads with 7-15 DTE, utilizing strikes slightly out-of-the-money (OTM) in both directions, could be considered. Ideal strike distance would be approximately 2-3% from the current price ($100), aiming for a small premium capture. Due to the limited data quality, a smaller position size is recommended.\n\n**Analysis Details:**\n\n**Price Trend Analysis:**\n\n*   The current price is $100.00. EMAs are both $0.00, making comparison impossible.\n*   RSI is at 50, indicating a neutral momentum. It's neither overbought nor oversold.\n*   MACD is 0.00, with a signal line of 0.00, offering no directional signal.\n*   Volume is 0, and average volume is 0, making volume analysis impossible.\n\n**Support/Resistance Analysis:**\n\n*   Without historical data, identifying support and resistance levels is impossible.\n\n**Volatility Assessment:**\n\n*   ATR is $0.00 (1.50% of price). This suggests moderate volatility, leaning towards stable.\n\n**Fundamental Context:**\n\n*   No fundamental data is provided. Sentiment score remains at 0.\n\n**Market Alignment:**\n\n*   The SPY trend is neutral.\n*   Given the neutral stock trend and neutral market trend, the alignment is neutral.\n\n**Multi-Day Forecasting:**\n\n*   The lack of reliable technical indicators and historical data makes accurate forecasting extremely difficult. The prediction is based on the neutral RSI and stable volatility. A small range of movement is expected over the next 14 days. Confidence levels are low due to the data quality issues.\n",
    "next_day_prediction": {
      "trend": "neutral",
      "volatility": "steady"
    }
  },
  {
    "accuracy": "low",
    "key_learning": "I need to more aggressively prioritize market context (especially SPY trend and VIX stability) over technical indicators when the market context is strongly neutral.",
    "weight_adjustment": "Increase the weight of SPY trend and VIX stability by 20% each. Decrease the weight of individual technical indicators (EMAs, RSI, MACD) by 10% each.",
    "quantified_error": "Predicted 0-0.5% movement, actual was 0.00% - Accurate within the predicted range, but low confidence initially.",
    "credit_spread_strategy_refinement": "In strongly neutral market conditions (SPY neutral, stable VIX), avoid initiating credit spreads unless strikes are extremely far out-of-the-money, accepting minimal profit for high probability of success. Focus on strategies that benefit from time decay *only* when directional movement is highly improbable.",
    "accuracy_score": 2,
    "date": "2025-03-20",
    "analysis_type": "reflection_intraday",
    "full_reflection": "## Pretraining Reflection - 2025-03-19/20 Analysis\n\nThis analysis reflects on the prediction made on 2025-03-19 for the period ending 2025-03-20. The actual outcome was a completely neutral movement, a scenario I attempted to capture in my 1-day prediction, but with limited confidence.\n\n**1. Trend Prediction Accuracy Assessment:**\n\n*   **1-day Prediction:** My 1-day prediction of 0-0.5% movement was highly accurate. The actual movement was 0.00%. The error margin is essentially zero. However, the 50% confidence level indicates I wasn\u2019t strongly convinced of this outcome, which is a point for improvement.\n*   **7-day/14-day Predictions:** These predictions are now invalidated as the 1-day outcome was neutral. Assessing their ongoing accuracy is irrelevant given the lack of movement.\n*   **Reliable Indicators:** Given the lack of movement, no technical indicators proved particularly *reliable* in predicting direction. The fact that I leaned towards a very small range suggests a sensitivity to the neutral market context (SPY trend, VIX stability) was present, but not strongly weighted.\n\n**2. Volatility Assessment:**\n\n*   I did not correctly predict volatility *changes* because I anticipated *some* movement (even within a small range). The actual volatility remained steady, as indicated by the 0.00% change in ATR.\n*   Factors contributing to the lack of volatility shifts were likely the stable VIX (at 20.0) and the neutral SPY trend. I acknowledged these factors in the market context, but didn\u2019t fully translate that into a higher probability of *no* movement. I underestimated the power of a truly neutral market to simply remain static.\n\n**3. Technical Analysis Review:**\n\n*   **Helpful/Misleading Indicators:** In this instance, most indicators were largely unhelpful. EMAs, RSI, MACD \u2013 all would have likely given signals, but in a neutral environment, these signals are noise. I should have placed more emphasis on the overall market context *over* technical signals when the market context was so strongly neutral.\n*   **Support/Resistance:** Support and resistance levels were not tested, so their validity remains unknown.\n*   **EMA Correlation:** Price action around EMAs was irrelevant as there was no significant price action.\n\n**4. Market Alignment Impact:**\n\n*   The broader market (SPY\u2019s neutral trend) heavily influenced this stock\u2019s movement. The stock mirrored the SPY\u2019s lack of direction.\n*   The aligned movement to SPY mattered significantly. In a neutral SPY environment, individual stock movements are often muted. This reinforces the importance of considering macro trends.\n\n**5. Options Implications:**\n\n*   My analysis would *not* have correctly positioned credit spreads for this movement. Any spread would have likely resulted in minimal profit or a small loss due to time decay.\n*   Optimal strike selection would have been to choose strikes as far out-of-the-money as possible, maximizing the probability of the spread expiring worthless. However, the potential profit would have been minimal.\n*   A 7-15 DTE credit spread strategy would have been unfavorable. The lack of movement would have meant relying entirely on theta decay, which is a slow process and carries the risk of being wrong-footed by even a small move.\n\n\n\n1. Prediction Accuracy: **moderate**\n2. Quantified Error: Predicted 0-0.5% movement, actual was 0.00% - Accurate within the predicted range, but low confidence initially.\n3. Key Learning: I need to more aggressively prioritize market context (especially SPY trend and VIX stability) over technical indicators when the market context is strongly neutral.\n4. Weight Adjustment: Increase the weight of SPY trend and VIX stability by 20% each. Decrease the weight of individual technical indicators (EMAs, RSI, MACD) by 10% each.\n5. Credit Spread Strategy Refinement: In strongly neutral market conditions (SPY neutral, stable VIX), avoid initiating credit spreads unless strikes are extremely far out-of-the-money, accepting minimal profit for high probability of success. Focus on strategies that benefit from time decay *only* when directional movement is highly improbable.\n"
  },
  {
    "trend": "neutral",
    "technical_score": 10,
    "sentiment_score": 0,
    "risk_assessment": "normal",
    "market_alignment": "neutral",
    "movement_prediction": "1-day: 0-0.5% movement (50% confidence); 7-day: 0.5-1.5% movement (40% confidence); 14-day: 1-3% movement (30% confidence)",
    "options_implications": "Given the neutral outlook and low confidence, a strategy focusing on minimal directional bias is preferred. Credit spreads with 7-15 DTE could be considered, but with very tight strike distances (at-the-money or slightly out-of-the-money) to capitalize on time decay. The low ATR suggests limited premium, so position sizing should be conservative. Avoid spreads with significant directional exposure.",
    "structured_movement_prediction": {
      "1_day": {
        "magnitude": "0-0.5",
        "direction": "movement",
        "confidence": 50
      },
      "7_day": {
        "magnitude": "0.5-1.5",
        "direction": "movement",
        "confidence": 40
      },
      "14_day": {
        "magnitude": "1-3",
        "direction": "movement",
        "confidence": 30
      }
    },
    "summary": "## AAPL Analysis - 2025-03-20\n\n**Important Disclaimer:** The provided data is severely flawed with an error message and numerous zero values. This analysis is highly speculative and based on limited information, making assumptions where necessary. 1.",
    "date": "2025-03-20",
    "price": 0,
    "atr_percent": 0,
    "analysis_type": "intraday_15m",
    "full_analysis": "## AAPL Analysis - 2025-03-20\n\n**Important Disclaimer:** The provided data is severely flawed with an error message and numerous zero values. This analysis is highly speculative and based on limited information, making assumptions where necessary.\n\n1. Stock trend: neutral\n2. Technical Score: 10\n3. Sentiment Score: 0\n4. Risk assessment: normal\n5. Market Alignment: neutral\n6. Movement Prediction: 1-day: 0-0.5% movement (50% confidence); 7-day: 0.5-1.5% movement (40% confidence); 14-day: 1-3% movement (30% confidence)\n7. Options Implications: Given the neutral outlook and low confidence, a strategy focusing on minimal directional bias is preferred. Credit spreads with 7-15 DTE could be considered, but with very tight strike distances (at-the-money or slightly out-of-the-money) to capitalize on time decay. The low ATR suggests limited premium, so position sizing should be conservative. Avoid spreads with significant directional exposure.\n",
    "next_day_prediction": {
      "trend": "neutral",
      "volatility": "steady"
    }
  },
  {
    "accuracy": "low",
    "key_learning": "I need to prioritize broader market indicators (VIX, SPY trend) and assign higher probability to continued neutrality when these indicators suggest low volatility and a lack of directional bias.",
    "weight_adjustment": "Increase weight on VIX stability and SPY trend; decrease weight on stock-specific technical indicators in neutral market environments.",
    "quantified_error": "Predicted 0-0.5% movement, actual was 0.00% - Accurate within the range, but confidence level was too high.",
    "credit_spread_strategy_refinement": "In situations with stable VIX and neutral SPY, avoid initiating credit spread strategies unless extremely tight strike selection is possible to maximize theta decay, and even then, position size should be significantly reduced.",
    "accuracy_score": 2,
    "date": "2025-03-21",
    "analysis_type": "reflection_intraday",
    "full_reflection": "## Pretraining Reflection - 2025-03-20/21 Analysis\n\nThis analysis reflects on the prediction made on 2025-03-20 for the period ending 2025-03-21. The actual outcome was a completely neutral movement, a scenario I attempted to account for but didn't assign a high enough probability.\n\n**1. Trend Prediction Accuracy Assessment:**\n\n*   **1-day Prediction:** My 1-day prediction was 0-0.5% movement. The actual movement was 0.00%. Therefore, the prediction was accurate within the range, but the lower bound was immediately tested. The error margin is essentially 0%, as the actual outcome fell directly within the predicted range. However, the 50% confidence assigned feels too high given the complete lack of movement.\n*   **7-day & 14-day Predictions:** These predictions are still open, but the initial 1-day outcome suggests a high probability of continued neutrality. Their ongoing accuracy will be assessed in subsequent reflections.\n*   **Reliable Indicators:** Given the lack of movement, no technical indicators proved particularly reliable in *predicting* movement. However, the stable VIX (20.0) and neutral SPY trend were consistent with the outcome, suggesting these broader market indicators were more informative than stock-specific technicals.\n\n**2. Volatility Assessment:**\n\n*   I did not correctly predict volatility changes. I anticipated *some* movement (0.5-1.5% in 7 days, 1-3% in 14 days), which implied a corresponding change in ATR. The actual ATR remained unchanged at 0.00%.\n*   Factors contributing to the missed volatility shift: The stable VIX was a key indicator I should have given more weight to. The neutral SPY trend also suggested limited directional pressure. I likely overestimated the potential for idiosyncratic volatility in the stock, failing to fully appreciate the broader market's dampening effect.\n\n**3. Technical Analysis Review:**\n\n*   **Helpful/Misleading Indicators:** Technical indicators were largely unhelpful in this scenario. EMAs, support/resistance levels (not explicitly mentioned in the initial analysis, but assumed to be considered), and other standard indicators provided no actionable signals due to the absence of price movement. They weren't *misleading* per se, but they were effectively noise.\n*   **Support/Resistance:** Support and resistance levels were not tested, so their reliability couldn't be assessed.\n*   **EMAs:** Price action around EMAs was non-existent, so no correlation could be observed.\n\n**4. Market Alignment Impact:**\n\n*   The broader market (neutral SPY trend, stable VIX) heavily influenced the stock's movement. The stock essentially mirrored the market's lack of direction.\n*   Aligned movement to SPY mattered significantly. The stock's neutrality was directly correlated with the SPY's neutrality. A contrary movement would have been highly unexpected given the market context.\n\n**5. Options Implications:**\n\n*   **Credit Spreads:** My analysis would *not* have correctly positioned credit spreads for this movement. A credit spread strategy would have likely resulted in minimal profit or a small loss due to the lack of price movement.\n*   **Strike Selection:** Optimal strike selection would have been to choose strikes very close to the current price, aiming for maximum theta decay. However, even with optimal strike selection, the profit potential would have been extremely limited.\n*   **7-15 DTE Strategy:** A 7-15 DTE credit spread strategy would have been unfavorable. The lack of movement meant minimal premium collection and a high probability of the spread expiring worthless or incurring a small loss.\n\n\n\n1. Prediction Accuracy: **moderate**\n2. Quantified Error: Predicted 0-0.5% movement, actual was 0.00% - Accurate within the range, but confidence level was too high.\n3. Key Learning: I need to prioritize broader market indicators (VIX, SPY trend) and assign higher probability to continued neutrality when these indicators suggest low volatility and a lack of directional bias.\n4. Weight Adjustment: Increase weight on VIX stability and SPY trend; decrease weight on stock-specific technical indicators in neutral market environments.\n5. Credit Spread Strategy Refinement: In situations with stable VIX and neutral SPY, avoid initiating credit spread strategies unless extremely tight strike selection is possible to maximize theta decay, and even then, position size should be significantly reduced.\n"
  },
  {
    "trend": "neutral",
    "technical_score": 10,
    "sentiment_score": 0,
    "risk_assessment": "normal",
    "market_alignment": "neutral",
    "movement_prediction": "1-day: 0-0.5% movement (50% confidence); 7-day: 0.5-1.5% movement (40% confidence); 14-day: 1-3% movement (30% confidence)",
    "options_implications": "Given the neutral outlook and low confidence, a strategy focusing on minimal directional bias is preferred. Credit spreads with 7-15 DTE could be considered, but with very tight strike distances (at-the-money or slightly out-of-the-money) to capitalize on time decay. The low confidence suggests a small position size is prudent. Avoid deep out-of-the-money options due to the limited expected movement.",
    "structured_movement_prediction": {
      "1_day": {
        "magnitude": "0-0.5",
        "direction": "movement",
        "confidence": 50
      },
      "7_day": {
        "magnitude": "0.5-1.5",
        "direction": "movement",
        "confidence": 40
      },
      "14_day": {
        "magnitude": "1-3",
        "direction": "movement",
        "confidence": 30
      }
    },
    "summary": "## AAPL Analysis - 2025-03-21\n\n**Important Disclaimer:** The provided data is severely flawed with an error message and numerous zero values. This analysis is highly speculative and based on limited information, making assumptions where necessary. 1.",
    "date": "2025-03-21",
    "price": 0,
    "atr_percent": 0,
    "analysis_type": "intraday_15m",
    "full_analysis": "## AAPL Analysis - 2025-03-21\n\n**Important Disclaimer:** The provided data is severely flawed with an error message and numerous zero values. This analysis is highly speculative and based on limited information, making assumptions where necessary.\n\n1. Stock trend: neutral\n2. Technical Score: 10\n3. Sentiment Score: 0\n4. Risk assessment: normal\n5. Market Alignment: neutral\n6. Movement Prediction: 1-day: 0-0.5% movement (50% confidence); 7-day: 0.5-1.5% movement (40% confidence); 14-day: 1-3% movement (30% confidence)\n7. Options Implications: Given the neutral outlook and low confidence, a strategy focusing on minimal directional bias is preferred. Credit spreads with 7-15 DTE could be considered, but with very tight strike distances (at-the-money or slightly out-of-the-money) to capitalize on time decay. The low confidence suggests a small position size is prudent. Avoid deep out-of-the-money options due to the limited expected movement.\n\n\n\n**Analysis:**\n\nThe provided data presents significant challenges. The 'error' flag and numerous zero values for key indicators (EMAs, ATR, MACD, Volume) render a robust technical analysis impossible. We are forced to rely heavily on the RSI and the previous day's analysis.\n\n**Price Trend Analysis:**\n\n*   **Price vs EMAs:** With both EMAs at zero, a comparison is impossible.\n*   **RSI:** An RSI of 50 indicates a neutral momentum. Not overbought or oversold.\n*   **MACD:** With both MACD and Signal at zero, no bullish or bearish crossover can be determined.\n*   **Volume:** Volume is zero, and average volume is zero, making it impossible to assess volume confirmation.\n\n**Support/Resistance Analysis:**\n\nWithout historical data or price context, identifying support and resistance levels is impossible.\n\n**Volatility Assessment:**\n\nThe ATR is reported as 0.00, with an ATR% of 1.50%. Assuming the current price is $100.00, this translates to an ATR of $1.50. This is a very low volatility reading, suggesting a stable stock.\n\n**Fundamental Context:**\n\nNo fundamental data is provided. Sentiment remains at 0.\n\n**Market Alignment:**\n\nThe market trend is neutral (SPY trend score of 10). The stock trend is also neutral. Therefore, the stock is aligned with the market.\n\n**Multi-Day Forecasting:**\n\nGiven the lack of reliable data, the forecast is essentially a continuation of the previous day's prediction. The previous analysis indicated a neutral trend with limited expected movement. The confidence levels remain low due to the data quality issues.\n",
    "next_day_prediction": {
      "trend": "neutral",
      "volatility": "steady"
    }
  },
  {
    "trend": "neutral",
    "technical_score": 10,
    "sentiment_score": 0,
    "risk_assessment": "normal",
    "market_alignment": "neutral",
    "movement_prediction": "1-day: 0-0.5% movement (50% confidence); 7-day: 0.5-1.5% movement (40% confidence); 14-day: 1-3% movement (30% confidence)",
    "options_implications": "Given the neutral outlook and low confidence, a strategy focusing on premium collection is most appropriate. Credit spreads with 7-15 DTE are viable. Given the RSI of 50, strikes should be at-the-money or slightly out-of-the-money (OTM) to maximize premium. A 2-3% OTM put spread or call spread would be appropriate, aiming for a small credit. The low ATR suggests relatively stable price action, making time decay a favorable factor for this strategy.",
    "structured_movement_prediction": {
      "1_day": {
        "magnitude": "0-0.5",
        "direction": "movement",
        "confidence": 50
      },
      "7_day": {
        "magnitude": "0.5-1.5",
        "direction": "movement",
        "confidence": 40
      },
      "14_day": {
        "magnitude": "1-3",
        "direction": "movement",
        "confidence": 30
      }
    },
    "summary": "## AAPL Analysis - 2025-03-24\n\n**Important Disclaimer:** The provided data is severely flawed with an error message and numerous zero values. This analysis is highly speculative and based on limited information, making assumptions where necessary. 1.",
    "date": "2025-03-24",
    "price": 0,
    "atr_percent": 0,
    "analysis_type": "intraday_15m",
    "full_analysis": "## AAPL Analysis - 2025-03-24\n\n**Important Disclaimer:** The provided data is severely flawed with an error message and numerous zero values. This analysis is highly speculative and based on limited information, making assumptions where necessary.\n\n1. Stock trend: neutral\n2. Technical Score: 10\n3. Sentiment Score: 0\n4. Risk assessment: normal\n5. Market Alignment: neutral\n6. Movement Prediction: 1-day: 0-0.5% movement (50% confidence); 7-day: 0.5-1.5% movement (40% confidence); 14-day: 1-3% movement (30% confidence)\n7. Options Implications: Given the neutral outlook and low confidence, a strategy focusing on premium collection is most appropriate. Credit spreads with 7-15 DTE are viable. Given the RSI of 50, strikes should be at-the-money or slightly out-of-the-money (OTM) to maximize premium. A 2-3% OTM put spread or call spread would be appropriate, aiming for a small credit. The low ATR suggests relatively stable price action, making time decay a favorable factor for this strategy.\n\n\n\n**Analysis Details:**\n\nThe provided data presents significant challenges. The 'error' flag and zero values for key indicators (EMAs, ATR, MACD, Volume) severely limit a robust technical analysis. However, we can attempt a basic assessment based on the available information and the previous analysis.\n\n**Price Trend Analysis:**\n\n*   **Price vs EMAs:** With both EMAs at zero, the current price of $100.00 is effectively above both. However, this is meaningless given the data quality.\n*   **RSI:** An RSI of 50 indicates a neutral momentum.\n*   **MACD:** A MACD of 0.00 with a signal of 0.00 provides no directional signal.\n*   **Volume:** Volume is zero, and average volume is zero, making it impossible to assess volume confirmation.\n\n**Support/Resistance Analysis:**\n\nWithout historical data, identifying support and resistance levels is impossible.\n\n**Volatility Assessment:**\n\nThe ATR of 0.00 (1.50% ATR%) is extremely low, suggesting a very stable stock. This supports a 'normal' risk assessment.\n\n**Fundamental Context:**\n\nNo fundamental data is provided, so the sentiment score remains at 0.\n\n**Market Alignment:**\n\nThe SPY trend is 'neutral' with a score of 10. AAPL's trend is also 'neutral'. Therefore, the market alignment is 'neutral'.\n\n**Multi-Day Forecasting:**\n\nGiven the lack of reliable data and the neutral indicators, the forecast is a continuation of the previous analysis. The confidence levels remain low due to the data quality issues. The forecast assumes a continuation of the recent, limited movement.\n",
    "next_day_prediction": {
      "trend": "neutral",
      "volatility": "steady"
    }
  }
]