[
  {
    "trend": "neutral",
    "technical_score": 0,
    "sentiment_score": 0,
    "risk_assessment": "normal",
    "market_alignment": "neutral",
    "movement_prediction": "** 1-day: 0-0.5% movement (50% confidence); 7-day: 1-2% movement (50% confidence); 14-day: 2-3% movement (40% confidence)",
    "options_implications": "** Given the neutral forecast and moderate volatility (ATR of 1.5%), credit spreads with 7-15 DTE are viable. Ideal strike distances would be 1-2% out-of-the-money (OTM) on both the call and put sides, aiming for a credit of 0.10-0.20 per share. The low confidence levels suggest a smaller position size is prudent. The VIX at 20 indicates relatively normal fear levels, supporting this strategy.",
    "structured_movement_prediction": {
      "1_day": {
        "magnitude": "0-0.5",
        "direction": "movement",
        "confidence": 50
      },
      "7_day": {
        "magnitude": "1-2",
        "direction": "movement",
        "confidence": 50
      },
      "14_day": {
        "magnitude": "2-3",
        "direction": "movement",
        "confidence": 40
      }
    },
    "summary": "## SPY Analysis - 2025-03-19\n\n**1. Stock trend:** neutral\n\n**2. Technical Score:** 0\n\n**3.",
    "date": "2025-03-19",
    "price": 0,
    "atr_percent": 0,
    "analysis_type": "daily_1mo",
    "full_analysis": "## SPY Analysis - 2025-03-19\n\n**1. Stock trend:** neutral\n\n**2. Technical Score:** 0\n\n**3. Sentiment Score:** 0\n\n**4. Risk assessment:** normal\n\n**5. Market Alignment:** neutral\n\n**6. Movement Prediction:** 1-day: 0-0.5% movement (50% confidence); 7-day: 1-2% movement (50% confidence); 14-day: 2-3% movement (40% confidence)\n\n**7. Options Implications:** Given the neutral forecast and moderate volatility (ATR of 1.5%), credit spreads with 7-15 DTE are viable. Ideal strike distances would be 1-2% out-of-the-money (OTM) on both the call and put sides, aiming for a credit of 0.10-0.20 per share. The low confidence levels suggest a smaller position size is prudent. The VIX at 20 indicates relatively normal fear levels, supporting this strategy.\n",
    "next_day_prediction": {
      "trend": "neutral",
      "volatility": "steady"
    }
  },
  {
    "accuracy": "low",
    "key_learning": "I need to more heavily prioritize the probability of *no* movement, especially when the broader market shows neutral trends and low conviction.",
    "weight_adjustment": "Increase the weight of SPY trend and market trend score, particularly when the score is below 15. Decrease the weight of standard technical indicators in neutral market conditions.",
    "quantified_error": "Predicted 0-0.5% movement, actual was 0.00% - Underestimated by 0.0-0.5%.",
    "credit_spread_strategy_refinement": "In situations with a neutral SPY trend and low market trend score, avoid opening 7-15 DTE credit spreads unless extremely wide strikes are available to account for minimal price movement and maximize time decay potential (though even then, the risk/reward is likely unfavorable).",
    "accuracy_score": 2,
    "error_magnitude": 0.0,
    "date": "2025-03-20",
    "analysis_type": "reflection_daily",
    "full_reflection": "## Pretraining Reflection - 2025-03-19/20 Analysis\n\nThis analysis reflects on the prediction made on 2025-03-19 for the period ending 2025-03-20. The actual outcome was a completely neutral movement, a significant deviation from the predicted potential for even minimal movement.\n\n**1. Trend Prediction Accuracy Assessment:**\n\n*   **1-day Prediction:** The prediction of 0-0.5% movement was inaccurate. The actual movement was 0.00%. The error margin is therefore -0.5% to 0.0%. This represents a complete miss, predicting movement where none occurred.\n*   **7-day & 14-day Predictions:** These predictions are currently invalidated by the 1-day outcome. A sustained neutral trend was not anticipated, and the lack of any movement on day one suggests the longer-term predictions are unlikely to materialize.\n*   **Reliable Indicators:** Given the neutral outcome, it's difficult to identify *reliable* indicators. However, the fact that the market context showed a neutral SPY trend and a market trend score of 10 (indicating low conviction) *should* have been a stronger signal for a higher probability of a flat outcome. I likely didn't weight this strongly enough.\n\n**2. Volatility Assessment:**\n\n*   **Volatility Prediction:** The prediction implicitly assumed *some* volatility, even within the 0-0.5% range. The actual volatility was zero, as indicated by the 0.00% change in ATR. This was a complete misjudgment.\n*   **Missed Factors:** The VIX at 20.0 and its \"stable\" designation were misleading. While not *high*, a VIX of 20 suggests some underlying anxiety. However, the stability indicated that anxiety wasn't translating into price action. I failed to recognize that stability could mean *continued* lack of movement, rather than a precursor to a breakout. The \"standard\" risk adjustment also didn't flag the potential for a truly inert market.\n\n**3. Technical Analysis Review:**\n\n*   **Helpful/Misleading Indicators:** Without any price movement, assessing indicator usefulness is difficult. However, the lack of any reaction to EMAs (not detailed in the provided context, but assumed to be part of the analysis) suggests they were unhelpful in this specific instance. Reliance on standard technical patterns was clearly flawed.\n*   **Support/Resistance:** Support and resistance levels (not detailed in the provided context) were irrelevant as the price didn't test them.\n*   **EMA Correlation:** No correlation could be observed as there was no price movement.\n\n**4. Market Alignment Impact:**\n\n*   **Broader Market Influence:** The neutral SPY trend was the most significant factor. The stock mirrored the broader market's lack of direction. I underestimated the strength of this alignment.\n*   **SPY Movement:** The aligned movement with SPY was crucial. The stock didn't deviate from the broader market's inertia. This suggests a strong correlation in this specific instance, and I should prioritize SPY trend analysis.\n\n**5. Options Implications:**\n\n*   **Credit Spread Positioning:** This analysis would *not* have correctly positioned credit spreads. Any spread would have been vulnerable to time decay with no price movement to generate profit.\n*   **Optimal Strike Selection:** Given the actual movement, the optimal strike selection would have been to avoid opening any positions. If forced to trade, extremely wide strikes would have minimized risk, but also potential reward.\n*   **7-15 DTE Strategy:** A 7-15 DTE credit spread strategy would have been a losing proposition. Time decay would have eroded the premium, and the lack of price movement would have prevented any profitable adjustments.\n\n\n\n1. Prediction Accuracy: **low**\n2. Quantified Error: Predicted 0-0.5% movement, actual was 0.00% - Underestimated by 0.0-0.5%.\n3. Key Learning: I need to more heavily prioritize the probability of *no* movement, especially when the broader market shows neutral trends and low conviction.\n4. Weight Adjustment: Increase the weight of SPY trend and market trend score, particularly when the score is below 15. Decrease the weight of standard technical indicators in neutral market conditions.\n5. Credit Spread Strategy Refinement: In situations with a neutral SPY trend and low market trend score, avoid opening 7-15 DTE credit spreads unless extremely wide strikes are available to account for minimal price movement and maximize time decay potential (though even then, the risk/reward is likely unfavorable).\n"
  },
  {
    "trend": "neutral",
    "technical_score": 0,
    "sentiment_score": 0,
    "risk_assessment": "low",
    "market_alignment": "neutral",
    "movement_prediction": "** 1-day: 0-0.5% movement (50% confidence); 7-day: 1-2% movement (50% confidence); 14-day: 2-4% movement (40% confidence)",
    "options_implications": "** Given the neutral forecast and moderate volatility (VIX at 20), credit spreads with 7-15 DTE are viable. Ideal strike distances would be 1-2% out-of-the-money (OTM) for both calls and puts, aiming for a theta decay play. The relatively stable VIX suggests limited premium will be available, so focus on maximizing probability of profit rather than high yield. A small position size is recommended due to the low confidence in the directional forecast.",
    "structured_movement_prediction": {
      "1_day": {
        "magnitude": "0-0.5",
        "direction": "movement",
        "confidence": 50
      },
      "7_day": {
        "magnitude": "1-2",
        "direction": "movement",
        "confidence": 50
      },
      "14_day": {
        "magnitude": "2-4",
        "direction": "movement",
        "confidence": 40
      }
    },
    "summary": "## SPY Analysis - 2025-03-19\n\n**1. Stock trend:** neutral\n\n**2. Technical Score:** 5\n\n**3.",
    "date": "2025-03-19",
    "price": 0,
    "atr_percent": 0,
    "analysis_type": "intraday_15m",
    "full_analysis": "## SPY Analysis - 2025-03-19\n\n**1. Stock trend:** neutral\n\n**2. Technical Score:** 5\n\n**3. Sentiment Score:** 0\n\n**4. Risk assessment:** normal\n\n**5. Market Alignment:** neutral\n\n**6. Movement Prediction:** 1-day: 0-0.5% movement (50% confidence); 7-day: 1-2% movement (50% confidence); 14-day: 2-4% movement (40% confidence)\n\n**7. Options Implications:** Given the neutral forecast and moderate volatility (VIX at 20), credit spreads with 7-15 DTE are viable. Ideal strike distances would be 1-2% out-of-the-money (OTM) for both calls and puts, aiming for a theta decay play. The relatively stable VIX suggests limited premium will be available, so focus on maximizing probability of profit rather than high yield. A small position size is recommended due to the low confidence in the directional forecast.\n",
    "next_day_prediction": {
      "trend": "neutral",
      "volatility": "steady"
    }
  },
  {
    "accuracy": "low",
    "key_learning": "I will prioritize a more conservative baseline expectation of movement when the VIX is stable and the broader market trend is neutral.",
    "weight_adjustment": "Increase the weight given to VIX stability and SPY trend direction, particularly in scenarios where both indicate neutrality. Decrease the weight given to indicators that assume *some* level of price fluctuation.",
    "quantified_error": "Predicted 0-0.5% movement, actual was 0.00% - Overestimated by 0.00-0.50%.",
    "credit_spread_strategy_refinement": "In situations with a stable VIX and neutral SPY trend, I will avoid initiating credit spread strategies or select strikes extremely close to the current price to minimize risk, even if potential profit is limited.",
    "accuracy_score": 2,
    "error_magnitude": 0.0,
    "date": "2025-03-20",
    "analysis_type": "reflection_intraday",
    "full_reflection": "## Pretraining Reflection - 2025-03-19/20 Analysis\n\nThis analysis reflects on the prediction made on 2025-03-19 for the period ending 2025-03-20. The actual outcome was a completely neutral movement, a significant deviation from the predicted potential for movement, even within the stated ranges.\n\n**1. Trend Prediction Accuracy Assessment:**\n\n*   **1-day Prediction:** The prediction of 0-0.5% movement was highly inaccurate. The actual movement was 0.00%, falling squarely outside the predicted range. The error margin is substantial \u2013 a complete miss.\n*   **7-day & 14-day Predictions:** These predictions are currently irrelevant as only one day has passed since the initial forecast. However, the complete lack of movement suggests these longer-term predictions are also likely to be inaccurate.\n*   **Reliable Indicators:** Given the neutral outcome, it's difficult to identify *reliable* indicators. The market context suggested a neutral SPY trend and stable VIX, which *aligned* with the outcome, but the prediction still anticipated *some* movement. This suggests the initial assessment of neutral conditions wasn't strong enough to preclude any movement.\n\n**2. Volatility Assessment:**\n\n*   **Volatility Prediction:** The prediction implicitly assumed some volatility, even within the small movement ranges. The actual volatility remained steady (0.00% change in ATR), indicating a misjudgment.\n*   **Missed Factors:** The VIX being stable at 20.0 should have been a stronger signal for extremely limited movement. The analysis likely underestimated the impact of a stable VIX in a neutral market environment. Perhaps a more conservative baseline expectation of volatility should be established when VIX is below a certain threshold.\n\n**3. Technical Analysis Review:**\n\n*   **Helpful/Misleading Indicators:** Without specific indicators used in the original prediction (which are not provided in the prompt), it's difficult to pinpoint specific issues. However, the failure to predict zero movement suggests reliance on indicators that often signal *some* level of price fluctuation, even in quiet markets.\n*   **Support/Resistance:** Support and resistance levels were not tested, making assessment impossible.\n*   **EMAs:** EMA analysis is also impossible without knowing which EMAs were considered. However, the lack of movement suggests that any EMA crossovers or price action around EMAs were not predictive in this instance.\n\n**4. Market Alignment Impact:**\n\n*   **Broader Market Influence:** The neutral SPY trend strongly influenced the stock's movement, reinforcing the lack of directional bias. The stock essentially mirrored the broader market's inaction.\n*   **SPY Alignment:** The aligned movement with SPY was *more* important than expected. The analysis should have given greater weight to the neutral SPY trend and stable VIX, leading to a more conservative prediction.\n\n**5. Options Implications:**\n\n*   **Credit Spread Positioning:** The analysis would *not* have correctly positioned credit spreads. Predicting even a small movement would have led to strike selection that would have resulted in losses.\n*   **Optimal Strike Selection:** Given the actual movement, the optimal strategy would have been to avoid credit spreads altogether or to select strikes extremely close to the current price, anticipating minimal profit but also minimal risk.\n*   **7-15 DTE Strategy:** A 7-15 DTE credit spread strategy would have likely resulted in a loss, as any movement, even a small one, would have been enough to move the price outside the profitable range.\n\n\n\n1. Prediction Accuracy: **low**\n2. Quantified Error: Predicted 0-0.5% movement, actual was 0.00% - Overestimated by 0.00-0.50%.\n3. Key Learning: I will prioritize a more conservative baseline expectation of movement when the VIX is stable and the broader market trend is neutral.\n4. Weight Adjustment: Increase the weight given to VIX stability and SPY trend direction, particularly in scenarios where both indicate neutrality. Decrease the weight given to indicators that assume *some* level of price fluctuation.\n5. Credit Spread Strategy Refinement: In situations with a stable VIX and neutral SPY trend, I will avoid initiating credit spread strategies or select strikes extremely close to the current price to minimize risk, even if potential profit is limited.\n"
  },
  {
    "trend": "neutral",
    "technical_score": 0,
    "sentiment_score": 0,
    "risk_assessment": "normal",
    "market_alignment": "neutral",
    "movement_prediction": "** 1-day: 0-0.5% movement (50% confidence); 7-day: 0.5-1.5% movement (50% confidence); 14-day: 1-3% movement (40% confidence)",
    "options_implications": "** Given the neutral forecast and low confidence, a strategy focusing on time decay would be most appropriate. Credit spreads with 7-15 DTE are viable. Ideal strike distances would be relatively close to the current price (e.g., 1-2% OTM calls or puts) to maximize premium collection, but with a defined risk. The VIX at 20 suggests relatively normal volatility, so premium will be moderate. Avoid deep OTM options as the probability of profit is low given the limited expected movement.",
    "structured_movement_prediction": {
      "1_day": {
        "magnitude": "0-0.5",
        "direction": "movement",
        "confidence": 50
      },
      "7_day": {
        "magnitude": "0.5-1.5",
        "direction": "movement",
        "confidence": 50
      },
      "14_day": {
        "magnitude": "1-3",
        "direction": "movement",
        "confidence": 40
      }
    },
    "summary": "## SPY Analysis - 2025-03-20\n\n**1. Stock trend:** neutral\n\n**2. Technical Score:** 5\n\n**3.",
    "date": "2025-03-20",
    "price": 0,
    "atr_percent": 0,
    "analysis_type": "intraday_15m",
    "full_analysis": "## SPY Analysis - 2025-03-20\n\n**1. Stock trend:** neutral\n\n**2. Technical Score:** 5\n\n**3. Sentiment Score:** 0\n\n**4. Risk assessment:** normal\n\n**5. Market Alignment:** neutral\n\n**6. Movement Prediction:** 1-day: 0-0.5% movement (50% confidence); 7-day: 0.5-1.5% movement (50% confidence); 14-day: 1-3% movement (40% confidence)\n\n**7. Options Implications:** Given the neutral forecast and low confidence, a strategy focusing on time decay would be most appropriate. Credit spreads with 7-15 DTE are viable. Ideal strike distances would be relatively close to the current price (e.g., 1-2% OTM calls or puts) to maximize premium collection, but with a defined risk. The VIX at 20 suggests relatively normal volatility, so premium will be moderate. Avoid deep OTM options as the probability of profit is low given the limited expected movement.\n",
    "next_day_prediction": {
      "trend": "neutral",
      "volatility": "steady"
    }
  },
  {
    "accuracy": "low",
    "key_learning": "I need to incorporate a higher probability weighting for truly neutral market conditions, especially when the broader market is also exhibiting neutrality.",
    "weight_adjustment": "Increase the weight of SPY trend and VIX stability when assessing potential price movement. Decrease the weight given to inherent market volatility assumptions.",
    "quantified_error": "Predicted 0-0.5% movement, actual was 0.00% - Accurate to within 0.5%.",
    "credit_spread_strategy_refinement": "In neutral market conditions with stable VIX, avoid credit spread strategies unless extremely wide strikes are used to account for minimal directional movement and maximize theta decay potential. Focus on strategies that profit from time decay rather than directional prediction.",
    "accuracy_score": 2,
    "date": "2025-03-21",
    "analysis_type": "reflection_intraday",
    "full_reflection": "## Pretraining Reflection - 2025-03-20/21 Analysis\n\nThis analysis reflects on the prediction made on 2025-03-20 for the period ending 2025-03-21. The actual outcome was a completely neutral movement, a scenario that highlights the challenges of short-term price prediction.\n\n**1. Trend Prediction Accuracy Assessment:**\n\n*   **1-day Prediction:** My prediction of 0-0.5% movement was highly accurate. The actual movement was 0.00%. The error margin is essentially zero.\n*   **7-day & 14-day Predictions:** These predictions are still open, but the initial day\u2019s outcome suggests a high probability of remaining within the predicted ranges, though leaning towards the lower end. The 7-day prediction of 0.5-1.5% now seems optimistic given the initial flat movement. The 14-day prediction of 1-3% also appears potentially overstated.\n*   **Reliable Indicators:** Given the lack of movement, no technical indicators proved particularly *reliable* in predicting direction. However, the stable VIX (20.0) and neutral SPY trend were consistent with the outcome. The market context correctly signaled a lack of strong directional pressure.\n\n**2. Volatility Assessment:**\n\n*   I did not correctly predict any volatility change. I anticipated *some* movement, even within a narrow range, which implied a potential, albeit small, change in ATR. The actual ATR remained unchanged.\n*   **Missed Factors:** The primary factor I missed was the complete lack of conviction in either direction. The VIX being stable at 20.0 suggested *potential* for movement, but didn\u2019t preclude a period of consolidation. I should have given more weight to the possibility of a truly sideways market, especially given the neutral SPY trend. I likely overemphasized the inherent volatility present in markets, even during stable periods.\n\n**3. Technical Analysis Review:**\n\n*   **Helpful/Misleading Indicators:** EMAs and support/resistance levels were not particularly helpful as there was no price action to assess their influence. They were essentially static during this period.\n*   **Support/Resistance:** Support and resistance levels were not tested, so their validity remains unknown.\n*   **EMA Correlation:** No correlation could be established as price didn\u2019t interact with EMAs.\n\n**4. Market Alignment Impact:**\n\n*   The broader market (neutral SPY trend) heavily influenced the stock\u2019s movement. The stock mirrored the SPY\u2019s lack of directional bias.\n*   The aligned movement with SPY was *more* important than expected. The neutral SPY trend was a strong indicator of a likely neutral outcome for the individual stock. A contrary movement would have been a significant signal, but the alignment reinforced the expectation of stability.\n\n**5. Options Implications:**\n\n*   **Credit Spreads:** My analysis would *not* have correctly positioned credit spreads for this movement. A credit spread strategy would have likely resulted in a small loss or, at best, minimal profit due to time decay.\n*   **Strike Selection:** Optimal strike selection would have been to choose strikes as far out-of-the-money as possible, recognizing the low probability of significant price movement. A very wide spread would have been necessary to avoid assignment.\n*   **7-15 DTE Strategy:** A 7-15 DTE credit spread strategy would have been unfavorable. The lack of movement would have meant relying entirely on theta decay, which would have been minimal given the low implied volatility and narrow spread needed to avoid assignment.\n\n\n\n1. Prediction Accuracy: **high**\n2. Quantified Error: Predicted 0-0.5% movement, actual was 0.00% - Accurate to within 0.5%.\n3. Key Learning: I need to incorporate a higher probability weighting for truly neutral market conditions, especially when the broader market is also exhibiting neutrality.\n4. Weight Adjustment: Increase the weight of SPY trend and VIX stability when assessing potential price movement. Decrease the weight given to inherent market volatility assumptions.\n5. Credit Spread Strategy Refinement: In neutral market conditions with stable VIX, avoid credit spread strategies unless extremely wide strikes are used to account for minimal directional movement and maximize theta decay potential. Focus on strategies that profit from time decay rather than directional prediction.\n"
  },
  {
    "trend": "neutral",
    "technical_score": 0,
    "sentiment_score": 0,
    "risk_assessment": "normal",
    "market_alignment": "neutral",
    "movement_prediction": "** 1-day: 0-0.5% movement (50% confidence); 7-day: 0.5-1.5% movement (50% confidence); 14-day: 1-3% movement (40% confidence)",
    "options_implications": "** Given the neutral forecast and low confidence, a strategy focusing on time decay is preferable. Credit spreads with 7-15 DTE are suitable. Given the RSI of 50, strikes should be at-the-money (ATM) or slightly out-of-the-money (OTM) to maximize premium collection. A call spread (selling a call and buying a higher strike call) or a put spread (selling a put and buying a lower strike put) would be appropriate. Ideal strike distance would be 1-2% from the current price, aiming for a credit of 0.10-0.20 per share. Manage risk by being prepared to close the spread if the price moves significantly in either direction.",
    "structured_movement_prediction": {
      "1_day": {
        "magnitude": "0-0.5",
        "direction": "movement",
        "confidence": 50
      },
      "7_day": {
        "magnitude": "0.5-1.5",
        "direction": "movement",
        "confidence": 50
      },
      "14_day": {
        "magnitude": "1-3",
        "direction": "movement",
        "confidence": 40
      }
    },
    "summary": "## SPY Analysis - 2025-03-21\n\n**1. Stock trend:** neutral\n\n**2. Technical Score:** 5\n\n**3.",
    "date": "2025-03-21",
    "price": 0,
    "atr_percent": 0,
    "analysis_type": "intraday_15m",
    "full_analysis": "## SPY Analysis - 2025-03-21\n\n**1. Stock trend:** neutral\n\n**2. Technical Score:** 5\n\n**3. Sentiment Score:** 0\n\n**4. Risk assessment:** normal\n\n**5. Market Alignment:** neutral\n\n**6. Movement Prediction:** 1-day: 0-0.5% movement (50% confidence); 7-day: 0.5-1.5% movement (50% confidence); 14-day: 1-3% movement (40% confidence)\n\n**7. Options Implications:** Given the neutral forecast and low confidence, a strategy focusing on time decay is preferable. Credit spreads with 7-15 DTE are suitable. Given the RSI of 50, strikes should be at-the-money (ATM) or slightly out-of-the-money (OTM) to maximize premium collection. A call spread (selling a call and buying a higher strike call) or a put spread (selling a put and buying a lower strike put) would be appropriate. Ideal strike distance would be 1-2% from the current price, aiming for a credit of 0.10-0.20 per share. Manage risk by being prepared to close the spread if the price moves significantly in either direction.\n",
    "next_day_prediction": {
      "trend": "neutral",
      "volatility": "steady"
    }
  },
  {
    "trend": "neutral",
    "technical_score": 0,
    "sentiment_score": 0,
    "risk_assessment": "normal",
    "market_alignment": "neutral",
    "movement_prediction": "** 1-day: 0-0.5% movement (50% confidence); 7-day: 0.5-1.5% movement (50% confidence); 14-day: 1-3% movement (40% confidence)",
    "options_implications": "** Given the neutral forecast and low confidence, a strategy focusing on time decay is preferable. Credit spreads with 7-15 DTE are suitable. Given the RSI of 50, strikes should be at-the-money (ATM) or slightly out-of-the-money (OTM) to maximize premium collection. A call spread (selling a call and buying a higher strike call) or a put spread (selling a put and buying a lower strike put) would be appropriate. Ideal strike distance would be 1-2% from the current price, aiming for a credit of 0.10-0.20 per share. Manage risk by being prepared to close the spread if the price moves significantly in either direction.",
    "structured_movement_prediction": {
      "1_day": {
        "magnitude": "0-0.5",
        "direction": "movement",
        "confidence": 50
      },
      "7_day": {
        "magnitude": "0.5-1.5",
        "direction": "movement",
        "confidence": 50
      },
      "14_day": {
        "magnitude": "1-3",
        "direction": "movement",
        "confidence": 40
      }
    },
    "summary": "## SPY Analysis - 2025-03-24\n\n**1. Stock trend:** neutral\n\n**2. Technical Score:** 5\n\n**3.",
    "date": "2025-03-24",
    "price": 0,
    "atr_percent": 0,
    "analysis_type": "intraday_15m",
    "full_analysis": "## SPY Analysis - 2025-03-24\n\n**1. Stock trend:** neutral\n\n**2. Technical Score:** 5\n\n**3. Sentiment Score:** 0\n\n**4. Risk assessment:** normal\n\n**5. Market Alignment:** neutral\n\n**6. Movement Prediction:** 1-day: 0-0.5% movement (50% confidence); 7-day: 0.5-1.5% movement (50% confidence); 14-day: 1-3% movement (40% confidence)\n\n**7. Options Implications:** Given the neutral forecast and low confidence, a strategy focusing on time decay is preferable. Credit spreads with 7-15 DTE are suitable. Given the RSI of 50, strikes should be at-the-money (ATM) or slightly out-of-the-money (OTM) to maximize premium collection. A call spread (selling a call and buying a higher strike call) or a put spread (selling a put and buying a lower strike put) would be appropriate. Ideal strike distance would be 1-2% from the current price, aiming for a credit of 0.10-0.20 per share. Manage risk by being prepared to close the spread if the price moves significantly in either direction.\n",
    "next_day_prediction": {
      "trend": "neutral",
      "volatility": "steady"
    }
  }
]