[
  {
    "trend": "neutral",
    "technical_score": 0,
    "sentiment_score": 0,
    "risk_assessment": "low",
    "market_alignment": "neutral",
    "movement_prediction": "** 1-day: 0-0.5% rangebound (50% confidence); 7-day: 0.5-1.5% rangebound (45% confidence); 14-day: 1-2% rangebound (40% confidence)",
    "options_implications": "**",
    "structured_movement_prediction": {
      "1_day": {
        "magnitude": "0-0.5",
        "direction": "rangebound",
        "confidence": 50
      },
      "7_day": {
        "magnitude": "0.5-1.5",
        "direction": "rangebound",
        "confidence": 45
      },
      "14_day": {
        "magnitude": "1-2",
        "direction": "rangebound",
        "confidence": 40
      }
    },
    "summary": "## SPY Analysis - 2025-03-19\n\n**1. Stock trend:** neutral\n\n**2. Technical Score:** 0\n\n**Analysis:** The provided data presents a significant challenge.",
    "date": "2025-03-19",
    "price": 0,
    "atr_percent": 0,
    "analysis_type": "daily_1mo",
    "full_analysis": "## SPY Analysis - 2025-03-19\n\n**1. Stock trend:** neutral\n\n**2. Technical Score:** 0\n\n**Analysis:** The provided data presents a significant challenge. The stock data is flagged with an error and contains mostly zero values for key indicators (EMAs, ATR, MACD, Volume). The RSI is at 50, indicating neutral momentum. Given the lack of directional signals, the stock trend is assessed as neutral.\n\n*   **Price vs EMAs:** Unable to assess due to EMA values being zero.\n*   **RSI:** Neutral at 50.\n*   **MACD:** Unable to assess due to MACD and Signal values being zero.\n*   **Volume:** Unable to assess due to volume values being zero.\n\n**3. Sentiment Score:** 0\n\n**Analysis:** No fundamental data (earnings, news) is provided, so the sentiment score remains neutral.\n\n**4. Risk assessment:** normal\n\n**Analysis:** The VIX is at 20.0 and is stable, indicating a standard risk environment. The ATR is 1.50% of the price, placing it in the moderate volatility range. Risk adjustment is also set to 'standard' in the market context.\n\n**5. Market Alignment:** neutral\n\n**Analysis:** The SPY trend is neutral, and the stock trend is also neutral. Therefore, the alignment is neutral.\n\n**6. Movement Prediction:** 1-day: 0-0.5% rangebound (50% confidence); 7-day: 0.5-1.5% rangebound (45% confidence); 14-day: 1-2% rangebound (40% confidence)\n\n**Analysis:** Given the neutral technicals and market context, a rangebound movement is expected. Confidence levels are low due to the limited data quality and lack of clear signals.\n\n**7. Options Implications:**\n\nGiven the neutral forecast and moderate volatility, credit spreads with 7-15 DTE are potentially viable. Ideal strike distances would be relatively tight, focusing on the 1-2% rangebound prediction. For example, a call spread sold with strikes 1% OTM and 0.5% OTM, or a put spread sold with similar strike distances. The low confidence in the forecast suggests smaller position sizes and careful monitoring are crucial. The VIX stability suggests theta decay will be moderate, but a sudden spike in volatility could negatively impact the position.\n",
    "next_day_prediction": {
      "trend": "neutral",
      "volatility": "steady"
    }
  },
  {
    "accuracy": "high",
    "key_learning": "In highly stable market conditions (stable VIX, neutral SPY), a conservative, rangebound prediction is often the most accurate.",
    "weight_adjustment": "Increase the weight given to VIX stability and SPY trend in future analyses, particularly when both indicate a neutral environment. Reduce the weight given to technical indicators in such scenarios.",
    "quantified_error": "Predicted 0-0.5% rangebound, actual was 0.00% - Accurate within the predicted range.",
    "credit_spread_strategy_refinement": "In neutral market environments, prioritize tight strike selection for 7-15 DTE credit spreads to maximize theta decay, even if potential profit is limited. Focus on minimizing spread width rather than attempting to capture large price movements.",
    "accuracy_score": 8,
    "date": "2025-03-20",
    "analysis_type": "reflection_daily",
    "full_reflection": "## Pretraining Reflection - 2025-03-19/20 Analysis\n\nThis was a remarkably accurate prediction, albeit a very conservative one. The actual outcome was essentially a flatline, aligning perfectly with the lower end of my predicted range.\n\n**1. Trend Prediction Accuracy Assessment:**\n\n*   **1-day:** My prediction of a 0-0.5% rangebound movement was perfectly accurate. The actual change was 0.00%. Error margin is effectively zero.\n*   **7-day/14-day:** While I didn\u2019t have specific price targets, the implied rangebound expectation for these periods also held true. The lack of movement over the 1-day period strongly suggests the 7 and 14-day predictions would have also been accurate.\n*   **Reliable Indicators:** The market context was the most reliable indicator. The neutral SPY trend and stable VIX (at 20) strongly suggested limited directional movement. The market_trend_score of 10 reinforced this.\n\n**2. Volatility Assessment:**\n\n*   I correctly predicted stable volatility. The ATR remained unchanged at 0.00%.\n*   Factors missed: Honestly, nothing was missed. The VIX stability was a key signal, and the lack of significant news or economic data releases contributed to the low volatility environment. The 'standard' risk adjustment setting was appropriate.\n\n**3. Technical Analysis Review:**\n\n*   **Helpful/Misleading Indicators:** Technical indicators were largely irrelevant in this scenario. With a flat price movement, EMAs, support/resistance levels, and other indicators didn\u2019t have an opportunity to demonstrate their predictive power. They weren\u2019t *misleading*, just inconsequential.\n*   **Support/Resistance:** Not applicable, as there was no price movement to test these levels.\n*   **EMAs:** Not applicable, as there was no price interaction with EMAs.\n\n**4. Market Alignment Impact:**\n\n*   The broader market (SPY) significantly influenced this stock\u2019s movement. The neutral SPY trend directly correlated with the stock\u2019s neutral movement.\n*   Aligned movement to SPY mattered significantly. The stock essentially mirrored the SPY\u2019s lack of directional bias. A contrary movement would have been highly unexpected given the market context.\n\n**5. Options Implications:**\n\n*   **Credit Spreads:** My analysis would have correctly positioned for a neutral outcome, making credit spreads a viable strategy.\n*   **Strike Selection:** Given the 0.00% movement, very tight strike selection would have been optimal. A spread with strikes very close to the current price (e.g., at-the-money or slightly out-of-the-money) would have maximized premium capture.\n*   **7-15 DTE Strategy:** A 7-15 DTE credit spread strategy would have been profitable, but the profit would have been relatively small due to the limited price movement. The key would have been minimizing the spread width to maximize theta decay.\n\n\n\n1. Prediction Accuracy: high\n2. Quantified Error: Predicted 0-0.5% rangebound, actual was 0.00% - Accurate within the predicted range.\n3. Key Learning: In highly stable market conditions (stable VIX, neutral SPY), a conservative, rangebound prediction is often the most accurate.\n4. Weight Adjustment: Increase the weight given to VIX stability and SPY trend in future analyses, particularly when both indicate a neutral environment. Reduce the weight given to technical indicators in such scenarios.\n5. Credit Spread Strategy Refinement: In neutral market environments, prioritize tight strike selection for 7-15 DTE credit spreads to maximize theta decay, even if potential profit is limited. Focus on minimizing spread width rather than attempting to capture large price movements."
  },
  {
    "trend": "neutral",
    "technical_score": 5,
    "sentiment_score": 0,
    "risk_assessment": "normal",
    "market_alignment": "neutral",
    "movement_prediction": "1-day: 0-0.5% movement (40% confidence); 7-day: 1-2% movement (35% confidence); 14-day: 2-4% movement (30% confidence)",
    "options_implications": "Given the neutral outlook and low confidence, a strategy focusing on time decay would be most appropriate. Credit spreads with 7-15 DTE are viable, but strike selection should be conservative \u2013 approximately 2-3% out-of-the-money (OTM) puts or calls. The low ATR suggests relatively stable premiums, but the error in the data makes accurate pricing difficult. A smaller position size is recommended due to the data quality issues.",
    "structured_movement_prediction": {
      "1_day": {
        "magnitude": "0-0.5",
        "direction": "movement",
        "confidence": 40
      },
      "7_day": {
        "magnitude": "1-2",
        "direction": "movement",
        "confidence": 35
      },
      "14_day": {
        "magnitude": "2-4",
        "direction": "movement",
        "confidence": 30
      }
    },
    "summary": "## SPY Analysis - 2025-03-19\n\n**Important Note:** The provided stock data contains an error message (\"The truth value of a Series is ambiguous...\") and several indicators are reporting zero values (EMAs, ATR, MACD, Volume). This severely limits the quality of the analysis. I will proceed with the best possible interpretation given the constraints, but the conclusions should be treated with extreme caution.",
    "date": "2025-03-19",
    "price": 0,
    "atr_percent": 0,
    "analysis_type": "intraday_15m",
    "full_analysis": "## SPY Analysis - 2025-03-19\n\n**Important Note:** The provided stock data contains an error message (\"The truth value of a Series is ambiguous...\") and several indicators are reporting zero values (EMAs, ATR, MACD, Volume). This severely limits the quality of the analysis. I will proceed with the best possible interpretation given the constraints, but the conclusions should be treated with extreme caution. I will assume a current price of $100.00 as stated in the key technical indicators.\n\n1. Stock trend: neutral\n2. Technical Score: 5\n3. Sentiment Score: 0\n4. Risk assessment: normal\n5. Market Alignment: neutral\n6. Movement Prediction: 1-day: 0-0.5% movement (40% confidence); 7-day: 1-2% movement (35% confidence); 14-day: 2-4% movement (30% confidence)\n7. Options Implications: Given the neutral outlook and low confidence, a strategy focusing on time decay would be most appropriate. Credit spreads with 7-15 DTE are viable, but strike selection should be conservative \u2013 approximately 2-3% out-of-the-money (OTM) puts or calls. The low ATR suggests relatively stable premiums, but the error in the data makes accurate pricing difficult. A smaller position size is recommended due to the data quality issues.\n\n**Analysis Breakdown:**\n\n**Price Trend Analysis:**\n\n*   **Price vs EMAs:** With EMAs at 0, it's impossible to determine a relationship.\n*   **RSI:** An RSI of 50 is neutral, indicating neither overbought nor oversold conditions.\n*   **MACD:** MACD and Signal at 0 provide no directional signal.\n*   **Volume:** Volume is 0, and average volume is 0, making it impossible to assess volume confirmation.\n\n**Support/Resistance Analysis:**\n\n*   Without historical data or identifiable swing highs/lows, support and resistance levels cannot be determined.\n\n**Volatility Assessment:**\n\n*   ATR is 0, but ATR% is 1.50%. Assuming a price of $100, this equates to an ATR of $1.50. This places volatility in the moderate range (neutral).\n\n**Fundamental Context:**\n\n*   No fundamental data is provided, so the sentiment score remains at 0.\n\n**Market Alignment:**\n\n*   The SPY trend is neutral, and the stock trend is also neutral. Therefore, the alignment is neutral.\n\n**Multi-Day Forecasting:**\n\n*   Given the lack of clear signals from any technical indicator, a neutral forecast is the most reasonable approach. The predicted movements are small and accompanied by low confidence levels, reflecting the poor data quality. The 7 and 14-day forecasts represent a slight potential for movement, but are highly uncertain.\n",
    "next_day_prediction": {
      "trend": "neutral",
      "volatility": "steady"
    }
  },
  {
    "accuracy": "high",
    "key_learning": "In neutral market conditions, prioritize strategies that minimize risk and avoid directional bets, even if potential profit is limited.",
    "weight_adjustment": "Increase the weight given to broader market trends (SPY) and VIX stability when assessing potential movement, and decrease the weight given to individual stock technical indicators in neutral market environments.",
    "quantified_error": "Predicted 0-0.5% movement, actual was 0.00% - Accurate within 0.5%.",
    "credit_spread_strategy_refinement": "In periods of low volatility and neutral market trends, favor tighter credit spreads with minimal width, or consider alternative strategies that are less reliant on directional movement, such as iron condors.",
    "accuracy_score": 8,
    "date": "2025-03-20",
    "analysis_type": "reflection_intraday",
    "full_reflection": "## Pretraining Reflection - 2025-03-19/20 Analysis\n\nThis analysis reflects on the prediction made on 2025-03-19 for the period ending 2025-03-20. The actual outcome was a completely neutral movement, a scenario that highlights the challenges of short-term price prediction.\n\n**1. Trend Prediction Accuracy Assessment:**\n\n*   **1-day Prediction:** My prediction of 0-0.5% movement was highly accurate. The actual movement was 0.00%. The error margin is essentially zero.\n*   **7-day & 14-day Predictions:** These predictions are currently moot as only one day has passed since the initial forecast. However, the initial expectation of 1-2% and 2-4% movement respectively, now appear overly optimistic given the immediate lack of movement.\n*   **Reliable Indicators:** Given the neutral outcome, no indicators proved particularly *reliable* in predicting direction. However, the stable VIX (at 20.0) and neutral SPY trend were consistent with the lack of significant movement. The market trend score of 10, while not strongly bullish or bearish, did not signal a strong directional bias.\n\n**2. Volatility Assessment:**\n\n*   I did not correctly predict volatility changes, but this isn\u2019t necessarily a failure. I predicted *potential* movement, not necessarily increased volatility. The actual outcome was steady volatility (0.00% change in ATR).\n*   Factors contributing to the lack of volatility shifts were likely the stable VIX and the neutral market sentiment. The market appears to be in a consolidation phase, lacking a strong catalyst for directional movement. I may have underestimated the strength of the consolidation.\n\n**3. Technical Analysis Review:**\n\n*   **Helpful/Misleading Indicators:** In this instance, the lack of strong signals from any indicator was arguably the most helpful aspect. Over-reliance on specific indicators could have led to a false sense of directional certainty.\n*   **Support/Resistance:** Support and resistance levels were not tested during this period, making assessment impossible.\n*   **EMAs:** EMA analysis was not a significant factor in the prediction, as the price remained static relative to the EMAs.\n\n**4. Market Alignment Impact:**\n\n*   The broader market (SPY) significantly influenced this stock\u2019s movement, or rather, *lack* of movement. The neutral SPY trend directly correlated with the stock\u2019s neutral performance.\n*   The aligned movement with SPY was crucial. The stock didn\u2019t deviate from the broader market\u2019s lack of direction. This suggests a high degree of correlation in the current market environment.\n\n**5. Options Implications:**\n\n*   **Credit Spreads:** My analysis would *not* have correctly positioned credit spreads for profit. A credit spread strategy would have likely resulted in minimal premium capture and potential early assignment risk if positioned aggressively.\n*   **Strike Selection:** Given the actual movement, the optimal strike selection would have been extremely tight \u2013 essentially at-the-money or slightly out-of-the-money. A wider spread would have been unnecessary and increased risk.\n*   **7-15 DTE Strategy:** A 7-15 DTE credit spread strategy would have been unfavorable. The lack of movement would have resulted in minimal premium decay, and the risk of assignment would have outweighed the potential reward. A strategy focusing on premium capture from time decay would have been ineffective.\n\n\n\n1. Prediction Accuracy: high\n2. Quantified Error: Predicted 0-0.5% movement, actual was 0.00% - Accurate within 0.5%.\n3. Key Learning: In neutral market conditions, prioritize strategies that minimize risk and avoid directional bets, even if potential profit is limited.\n4. Weight Adjustment: Increase the weight given to broader market trends (SPY) and VIX stability when assessing potential movement, and decrease the weight given to individual stock technical indicators in neutral market environments.\n5. Credit Spread Strategy Refinement: In periods of low volatility and neutral market trends, favor tighter credit spreads with minimal width, or consider alternative strategies that are less reliant on directional movement, such as iron condors.\n"
  },
  {
    "trend": "neutral",
    "technical_score": 5,
    "sentiment_score": 0,
    "risk_assessment": "normal",
    "market_alignment": "neutral",
    "movement_prediction": "1-day: 0-0.5% movement (40% confidence); 7-day: 1-2% movement (35% confidence); 14-day: 2-4% movement (30% confidence)",
    "options_implications": "Given the neutral outlook and low confidence, a strategy focusing on defined risk is preferable. Credit spreads with 7-15 DTE could be considered, but strike selection should be conservative \u2013 approximately 2-3% OTM (Out-of-the-Money) on both the call and put sides to account for the potential for minimal movement. The VIX at 20 suggests relatively normal implied volatility, so premium collection will be moderate. Avoid aggressive strike prices due to the uncertainty.",
    "structured_movement_prediction": {
      "1_day": {
        "magnitude": "0-0.5",
        "direction": "movement",
        "confidence": 40
      },
      "7_day": {
        "magnitude": "1-2",
        "direction": "movement",
        "confidence": 35
      },
      "14_day": {
        "magnitude": "2-4",
        "direction": "movement",
        "confidence": 30
      }
    },
    "summary": "## SPY Analysis - 2025-03-20\n\n**Important Disclaimer:** The provided data is severely flawed with error messages and zero values for key indicators. This analysis is based on the limited information available and should be treated with extreme caution. 1.",
    "date": "2025-03-20",
    "price": 0,
    "atr_percent": 0,
    "analysis_type": "intraday_15m",
    "full_analysis": "## SPY Analysis - 2025-03-20\n\n**Important Disclaimer:** The provided data is severely flawed with error messages and zero values for key indicators. This analysis is based on the limited information available and should be treated with extreme caution.\n\n1. Stock trend: neutral\n2. Technical Score: 5\n3. Sentiment Score: 0\n4. Risk assessment: normal\n5. Market Alignment: neutral\n6. Movement Prediction: 1-day: 0-0.5% movement (40% confidence); 7-day: 1-2% movement (35% confidence); 14-day: 2-4% movement (30% confidence)\n7. Options Implications: Given the neutral outlook and low confidence, a strategy focusing on defined risk is preferable. Credit spreads with 7-15 DTE could be considered, but strike selection should be conservative \u2013 approximately 2-3% OTM (Out-of-the-Money) on both the call and put sides to account for the potential for minimal movement. The VIX at 20 suggests relatively normal implied volatility, so premium collection will be moderate. Avoid aggressive strike prices due to the uncertainty.\n",
    "next_day_prediction": {
      "trend": "neutral",
      "volatility": "steady"
    }
  },
  {
    "accuracy": "high",
    "key_learning": "When the broader market is neutral and volatility is stable, prioritize avoiding directional strategies like credit spreads and focus on identifying opportunities where volatility expansion is likely.",
    "weight_adjustment": "Increase the weight given to broader market trends (SPY) and VIX stability when making short-term predictions. Decrease the weight given to technical indicators in neutral market environments.",
    "quantified_error": "Predicted 0-0.5% movement, actual was 0.00% - Accurate to within 0.5%.",
    "credit_spread_strategy_refinement": "In situations with neutral market trends and stable VIX, avoid initiating 7-15 DTE credit spreads. If a strategy is necessary, consider iron condors with very wide strikes to capitalize on time decay without significant directional risk, or explore alternative strategies like calendar spreads.",
    "accuracy_score": 8,
    "date": "2025-03-21",
    "analysis_type": "reflection_intraday",
    "full_reflection": "## Pretraining Reflection - 2025-03-20/21 Analysis\n\nThis analysis reflects on my prediction for 2025-03-20, given the actual outcome on 2025-03-21. The prediction was for a very limited range of movement, and the actual outcome was precisely no movement.\n\n**1. Trend Prediction Accuracy Assessment:**\n\n*   **1-day Prediction:** My 1-day prediction of 0-0.5% movement was *highly* accurate. The actual movement was 0.00%. The error margin is essentially zero.\n*   **7-day/14-day Predictions:** These predictions are still open, but the initial day\u2019s outcome suggests a strong likelihood of remaining within the predicted ranges (1-2% for 7-day, 2-4% for 14-day) *if* the neutral trend continues.\n*   **Reliable Indicators:** Given the lack of movement, the most reliable indicator was the market context itself \u2013 a neutral SPY trend and stable VIX. This suggests a lack of strong directional pressure.\n\n**2. Volatility Assessment:**\n\n*   I did correctly predict a lack of volatility change. The actual change in ATR was 0.00%, aligning with my expectation of minimal movement.\n*   Factors I may have missed: While the VIX was stable, a deeper dive into implied volatility *specifically* for this stock (if available) might have provided further confirmation. The market context was the primary driver here, and I correctly identified that.\n\n**3. Technical Analysis Review:**\n\n*   **Helpful/Misleading Indicators:** In this scenario, technical indicators were largely irrelevant. The lack of movement suggests fundamental or macro factors were dominant, overshadowing any short-term technical signals. EMAs and support/resistance levels didn\u2019t have an opportunity to demonstrate their predictive power.\n*   **Support/Resistance:** Support and resistance levels were not tested, so their reliability couldn\u2019t be assessed.\n*   **EMAs:** Price action around EMAs was non-existent, making correlation analysis impossible.\n\n**4. Market Alignment Impact:**\n\n*   The broader market (neutral SPY trend) heavily influenced this stock\u2019s movement. The stock mirrored the SPY\u2019s lack of direction.\n*   Aligned movement to SPY mattered significantly. The stock didn\u2019t deviate from the broader market\u2019s neutral stance, reinforcing the importance of considering macro trends.\n\n**5. Options Implications:**\n\n*   **Credit Spreads:** My analysis would *not* have correctly positioned credit spreads for optimal profit. A credit spread strategy would have been a poor choice given the zero movement. The theta decay would have been the primary loss driver.\n*   **Strike Selection:** Optimal strike selection would have been to *avoid* initiating a credit spread. If forced to trade, extremely wide strikes would have been necessary to avoid assignment, sacrificing premium.\n*   **7-15 DTE Strategy:** A 7-15 DTE credit spread strategy would have likely resulted in a loss due to time decay and the lack of price movement.\n\n\n\n1. Prediction Accuracy: high\n2. Quantified Error: Predicted 0-0.5% movement, actual was 0.00% - Accurate to within 0.5%.\n3. Key Learning: When the broader market is neutral and volatility is stable, prioritize avoiding directional strategies like credit spreads and focus on identifying opportunities where volatility expansion is likely.\n4. Weight Adjustment: Increase the weight given to broader market trends (SPY) and VIX stability when making short-term predictions. Decrease the weight given to technical indicators in neutral market environments.\n5. Credit Spread Strategy Refinement: In situations with neutral market trends and stable VIX, avoid initiating 7-15 DTE credit spreads. If a strategy is necessary, consider iron condors with very wide strikes to capitalize on time decay without significant directional risk, or explore alternative strategies like calendar spreads."
  },
  {
    "trend": "neutral",
    "technical_score": 5,
    "sentiment_score": 0,
    "risk_assessment": "normal",
    "market_alignment": "neutral",
    "movement_prediction": "1-day: 0-0.5% movement (40% confidence); 7-day: 1-2% movement (35% confidence); 14-day: 2-4% movement (30% confidence)",
    "options_implications": "Given the neutral outlook and low confidence, a strategy focusing on defined risk is preferable. Credit spreads with 7-15 DTE could be considered, but strike selection should be conservative \u2013 approximately 2-3% OTM (Out-of-the-Money) on both the call and put sides to account for the potential for minimal movement. The VIX at 20 suggests relatively normal implied volatility, so premium collection will be moderate. Avoid aggressive strike prices due to the lack of strong directional conviction.",
    "structured_movement_prediction": {
      "1_day": {
        "magnitude": "0-0.5",
        "direction": "movement",
        "confidence": 40
      },
      "7_day": {
        "magnitude": "1-2",
        "direction": "movement",
        "confidence": 35
      },
      "14_day": {
        "magnitude": "2-4",
        "direction": "movement",
        "confidence": 30
      }
    },
    "summary": "## SPY Analysis - 2025-03-21\n\n**Important Disclaimer:** The provided data is severely flawed with error messages and zero values for key indicators. This analysis is based on the limited information available and should be treated with extreme caution. 1.",
    "date": "2025-03-21",
    "price": 0,
    "atr_percent": 0,
    "analysis_type": "intraday_15m",
    "full_analysis": "## SPY Analysis - 2025-03-21\n\n**Important Disclaimer:** The provided data is severely flawed with error messages and zero values for key indicators. This analysis is based on the limited information available and should be treated with extreme caution.\n\n1. Stock trend: neutral\n2. Technical Score: 5\n3. Sentiment Score: 0\n4. Risk assessment: normal\n5. Market Alignment: neutral\n6. Movement Prediction: 1-day: 0-0.5% movement (40% confidence); 7-day: 1-2% movement (35% confidence); 14-day: 2-4% movement (30% confidence)\n7. Options Implications: Given the neutral outlook and low confidence, a strategy focusing on defined risk is preferable. Credit spreads with 7-15 DTE could be considered, but strike selection should be conservative \u2013 approximately 2-3% OTM (Out-of-the-Money) on both the call and put sides to account for the potential for minimal movement. The VIX at 20 suggests relatively normal implied volatility, so premium collection will be moderate. Avoid aggressive strike prices due to the lack of strong directional conviction.\n",
    "next_day_prediction": {
      "trend": "neutral",
      "volatility": "steady"
    }
  },
  {
    "trend": "neutral",
    "technical_score": 5,
    "sentiment_score": 0,
    "risk_assessment": "normal",
    "market_alignment": "neutral",
    "movement_prediction": "1-day: 0-0.5% movement (40% confidence); 7-day: 1-2% movement (35% confidence); 14-day: 2-4% movement (30% confidence)",
    "options_implications": "Given the neutral outlook and low confidence, a strategy focusing on defined risk is preferable. Credit spreads with 7-15 DTE could be considered, but strike selection should be conservative \u2013 approximately 2-3% OTM (Out-of-the-Money) on both the call and put sides to account for the potential for minimal movement. The VIX at 20 suggests relatively normal implied volatility, so premium collection will be moderate. Avoid aggressive strike prices due to the lack of strong directional conviction.",
    "structured_movement_prediction": {
      "1_day": {
        "magnitude": "0-0.5",
        "direction": "movement",
        "confidence": 40
      },
      "7_day": {
        "magnitude": "1-2",
        "direction": "movement",
        "confidence": 35
      },
      "14_day": {
        "magnitude": "2-4",
        "direction": "movement",
        "confidence": 30
      }
    },
    "summary": "## SPY Analysis - 2025-03-24\n\n**Important Disclaimer:** The provided data is severely flawed with error messages and zero values for key indicators. This analysis is based on the limited information available and should be treated with extreme caution. 1.",
    "date": "2025-03-24",
    "price": 0,
    "atr_percent": 0,
    "analysis_type": "intraday_15m",
    "full_analysis": "## SPY Analysis - 2025-03-24\n\n**Important Disclaimer:** The provided data is severely flawed with error messages and zero values for key indicators. This analysis is based on the limited information available and should be treated with extreme caution.\n\n1. Stock trend: neutral\n2. Technical Score: 5\n3. Sentiment Score: 0\n4. Risk assessment: normal\n5. Market Alignment: neutral\n6. Movement Prediction: 1-day: 0-0.5% movement (40% confidence); 7-day: 1-2% movement (35% confidence); 14-day: 2-4% movement (30% confidence)\n7. Options Implications: Given the neutral outlook and low confidence, a strategy focusing on defined risk is preferable. Credit spreads with 7-15 DTE could be considered, but strike selection should be conservative \u2013 approximately 2-3% OTM (Out-of-the-Money) on both the call and put sides to account for the potential for minimal movement. The VIX at 20 suggests relatively normal implied volatility, so premium collection will be moderate. Avoid aggressive strike prices due to the lack of strong directional conviction.\n",
    "next_day_prediction": {
      "trend": "neutral",
      "volatility": "steady"
    }
  }
]