{
  "ticker": "SPY",
  "start_date": "2025-01-24",
  "end_date": "2025-01-24",
  "processing_time": 148.5784454345703,
  "analyses_count": 5,
  "accuracy_rate": 0,
  "total_predictions": 0,
  "correct_predictions": 0,
  "results": [
    {
      "ticker": "SPY",
      "date": "2025-03-20",
      "step": 2,
      "analysis_type": "5d/15m_analysis",
      "price": 565.6900024414062,
      "trend": "neutral",
      "next_day_prediction": {
        "direction": "neutral",
        "magnitude": 0.1,
        "timeframe": "next_day",
        "confidence": 75,
        "specific_levels": [
          562.0,
          567.0,
          570.0
        ],
        "spread_recommendation": "iron condor",
        "strike_recommendation": "Sell 570C, Buy 572C, Sell 563P, Buy 561P - based on intraday high/low and providing a buffer.",
        "invalidation": "A break above 570.50 or below 562.50 would invalidate this prediction."
      },
      "prediction_accuracy": null,
      "memory_updates": {
        "reliability_update": {},
        "volatility_adjustment": "no change",
        "key_level_update": [],
        "updated_confidence": 0
      },
      "full_analysis": "## SPY Intraday Analysis - 2025-03-20 (15-Minute Data)\n\n**1. PRIOR CONTEXT INTEGRATION:**\n\nThe baseline trend remains neutral (60% confidence) as per the secret. Today\u2019s data doesn\u2019t contradict this. The neutral market trend score (50) reinforces this assessment. The 30-day ATR anchor of 1.0% provides a stability point. The current intraday range (562.60 - 570.57) is relatively contained, suggesting continued consolidation within a neutral framework. No key levels were previously identified, so this remains unchanged. The slight increase in implied volatility (1.36%) compared to historical volatility (1.09%) suggests a cautious market, but not a significant shift.\n\n**2. INTRADAY PATTERN ANALYSIS:**\n\nThe 15-minute chart shows a period of consolidation. The price action has been choppy, oscillating within a roughly 3-point range. The MACD at 0 indicates a lack of strong directional momentum. Volume (50,777,542) is moderate, not indicating a strong conviction in either direction. The VWAP (566.47) sits slightly above the current price (565.69), suggesting a potential for a minor upward move, but this is not definitive. There's no clear formation of bullish or bearish patterns like head and shoulders or double tops/bottoms. The intraday high and low suggest a testing of levels, but no sustained breakout.\n\n**3. VOLATILITY AND OPTIONS FOCUS:**\n\nIntraday volatility, as indicated by the ATR of 1.54% and ATR% of 0.27%, is elevated compared to the 30-day ATR anchor of 1.0%. This suggests short-term uncertainty. The implied volatility (1.36%) is also higher than historical volatility (1.09%), indicating options are pricing in a premium for potential movement. This elevated volatility is favorable for credit spread strategies. Ideal entry timing would be during periods of relative calm within the intraday range, capitalizing on the inflated premium. We should anticipate potential premium contraction as the day progresses if the market remains range-bound.\n\n**4. KEY LEVEL INTERACTION:**\n\nCurrently, there are no pre-defined key levels. However, based on the intraday data, we can identify potential intraday support at 563.50 (around the midpoint of the range) and intraday resistance at 568.50. These are not strong levels, but they represent areas where price has shown some hesitation. These levels are critical for strike selection.\n\n**5. CREDIT SPREAD OPPORTUNITY:**\n\nGiven the neutral trend, elevated volatility, and moderate volume, an **iron condor** strategy is the most appropriate, aligning with the recommended weighting.\n\n* **Strike Selection:**\n    * **Call Side:** Sell a call option at 570.00 (slightly above the intraday high, offering a buffer).\n    * **Put Side:** Sell a put option at 563.00 (slightly below the intraday low, offering a buffer).\n    * **Wings:** Buy a call option at 572.00 and a put option at 561.00 to define the maximum risk.\n* **Entry Timing:** Enter the trade when the price is near the VWAP (566.47) and volatility is relatively stable.\n* **Probability of Success Estimate:** 65% (based on the expectation of continued range-bound trading).\n* **Risk/Reward Profile:** 1:2 (aim for a credit of 0.50 per share, with a maximum risk of 1.00 per share).\n\n**6. PREDICTION:**\n\n```\nPREDICTION OUTPUT:\ndirection: neutral\nmagnitude: 0.1%\ntimeframe: next_day\nconfidence: 75\nspecific_levels: [562.00, 567.00, 570.00]\nspread_recommendation: iron condor\nstrike_recommendation: Sell 570C, Buy 572C, Sell 563P, Buy 561P - based on intraday high/low and providing a buffer.\ninvalidation: A break above 570.50 or below 562.50 would invalidate this prediction.\n```\n\n**7. MEMORY UPDATE:**\n\n```\nMEMORY UPDATE:\nreliability_update: {\n        \"iron_condor\": {\n            \"accuracy\": 50, \n            \"correct\": 0,\n            \"total\": 0\n        }\n   }\nvolatility_adjustment: no change\nkey_level_update: [intraday support: 563.50, intraday resistance: 568.50]\nupdated_confidence: 70\n```\n"
    },
    {
      "ticker": "SPY",
      "date": "2025-03-21",
      "step": 3,
      "analysis_type": "5d/15m_analysis",
      "price": 564.1900024414062,
      "trend": "neutral",
      "next_day_prediction": {
        "direction": "neutral",
        "magnitude": 0.1,
        "timeframe": "next_day",
        "confidence": 75,
        "specific_levels": [
          557.5,
          565.0,
          560.0
        ],
        "spread_recommendation": "iron condor",
        "strike_recommendation": "Sell 565C, Sell 557.5P, Buy 570C, Buy 552.5P",
        "invalidation": "Price breaks above 565.00 or below 557.50 with significant volume."
      },
      "prediction_accuracy": null,
      "memory_updates": {
        "reliability_update": {},
        "volatility_adjustment": "no change",
        "key_level_update": [],
        "updated_confidence": 0
      },
      "full_analysis": "## SPY Intraday Analysis - 2025-03-21 (15-Minute Data)\n\n**1. PRIOR CONTEXT INTEGRATION:**\n\nToday\u2019s data largely confirms the neutral baseline trend established in the secret. The SPY is trading within a relatively tight range, indicated by the intraday high/low of 564.89 and 558.03 respectively. The slight increase in implied volatility (1.2175 vs. 1.3622 yesterday) suggests a cautious market, but remains within the volatility anchor of 1.0%. The neutral market trend score of 50 reinforces the initial assessment. No key levels were previously identified, so there's no contradiction there. The lack of significant movement suggests the prior analysis remains relevant, but requires refinement with intraday data.\n\n**2. INTRADAY PATTERN ANALYSIS:**\n\nThe 15-minute chart shows a period of consolidation after a slight dip early in the session. The price action lacks a clear directional bias, oscillating within the intraday range. Volume (65,444,287) is moderate, not indicating strong conviction in either direction. The VWAP (561.39) sits slightly below the current price (564.19), suggesting short-term bullish pressure, but it's not a strong signal. MACD at 0 indicates a lack of momentum. RSI at 64.09 suggests the market is not overbought or oversold, further supporting the neutral assessment. There's a potential for a small double bottom forming around the 558 level, but it's too early to confirm.\n\n**3. VOLATILITY AND OPTIONS FOCUS:**\n\nIntraday volatility, as indicated by the ATR of 1.3738, is slightly higher than the 30-day ATR of 1.0%, suggesting increased short-term uncertainty. The difference between historical volatility (0.9740) and implied volatility (1.2175) indicates a premium for options, likely due to the cautious market sentiment. This premium provides an opportunity for credit spread strategies. Ideal entry timing would be during periods of relative calm within the intraday range, capitalizing on the inflated IV. A slight contraction in IV is expected if the price remains range-bound.\n\n**4. KEY LEVEL INTERACTION:**\n\nCurrently, there are no established key levels. However, based on intraday data, we can identify potential levels. The intraday high of 564.89 acts as immediate resistance. The intraday low of 558.03 serves as immediate support. A break above 564.89 could signal a short-term bullish move, while a break below 558.03 could indicate a short-term bearish move. These levels are critical for strike selection.\n\n**5. CREDIT SPREAD OPPORTUNITY:**\n\nGiven the neutral trend, moderate volatility, and the potential for range-bound trading, an **iron condor** is the most appropriate strategy.\n\n* **Strike Selection:**\n    * **Call Side:** Sell a call option with a strike price of 565.00. This is slightly above the intraday high, offering a reasonable premium while maintaining a buffer.\n    * **Put Side:** Sell a put option with a strike price of 557.50. This is slightly below the intraday low, offering a reasonable premium while maintaining a buffer.\n    * **Wings:** Buy a call option with a strike price of 570.00 and a put option with a strike price of 552.50 to limit potential losses.\n* **Entry Timing:** Enter the trade when the price is near the VWAP (561.39) and volatility is relatively stable.\n* **Probability of Success Estimate:** 65% - The neutral trend and defined range suggest a high probability of the price remaining within the strike prices.\n* **Risk/Reward Profile:** 1:2 - Aim for a credit of $0.50 per share, with a maximum potential loss of $2.50 per share.\n\n**6. PREDICTION:**\n\n```\nPREDICTION OUTPUT:\ndirection: neutral\nmagnitude: 0.1%\ntimeframe: next_day\nconfidence: 75\nspecific_levels: [557.50, 565.00, 560.00]\nspread_recommendation: iron condor\nstrike_recommendation: Sell 565C, Sell 557.5P, Buy 570C, Buy 552.5P\ninvalidation: Price breaks above 565.00 or below 557.50 with significant volume.\n```\n\n**7. MEMORY UPDATE:**\n\n```\nMEMORY UPDATE:\nreliability_update: {\n        \"iron_condor\": {\n            \"accuracy\": 0.0, \n            \"correct\": 0,\n            \"total\": 1\n        }\n   }\nvolatility_adjustment: no change\nkey_level_update: [557.50 (support), 564.89 (resistance), 565.00 (resistance)]\nupdated_confidence: 75\n```\n"
    },
    {
      "ticker": "SPY",
      "date": "2025-03-24",
      "step": 4,
      "analysis_type": "5d/15m_analysis",
      "price": 574.02001953125,
      "trend": "neutral",
      "next_day_prediction": {
        "direction": "neutral",
        "magnitude": 0.2,
        "timeframe": "next_day",
        "confidence": 75,
        "specific_levels": [
          569.0,
          572.0,
          575.0,
          578.0
        ],
        "spread_recommendation": "bear call spread",
        "strike_recommendation": "Short Call 575.00, Long Call 580.00 - capitalizing on IV contraction and limited upside potential.",
        "invalidation": "Price breaks above 578.00 with significant volume, indicating a bullish reversal."
      },
      "prediction_accuracy": null,
      "memory_updates": {
        "reliability_update": {},
        "volatility_adjustment": "no change",
        "key_level_update": [],
        "updated_confidence": 0
      },
      "full_analysis": "## SPY Intraday Analysis - 2025-03-24 (15-Minute Data)\n\n**1. PRIOR CONTEXT INTEGRATION:**\n\nToday\u2019s data largely confirms the neutral baseline trend established in the secret. The market trend score of 50 reinforces this. Implied Volatility (IV) has decreased significantly from the past two days (1.36 & 1.22 to 0.68), indicating a cooling off in option pricing. Historical Volatility (HV) remains lower than IV, suggesting IV is still elevated but normalizing. The neutral trend and decreasing IV support a strategy focused on premium collection, but the low historical performance of iron condors necessitates caution. No key levels were previously identified, so today\u2019s analysis will focus on establishing those.\n\n**2. INTRADAY PATTERN ANALYSIS:**\n\nThe 15-minute chart shows a range-bound session, with price oscillating between 570.20 and 575.15. The relatively narrow range suggests a lack of strong directional conviction. Volume (46.7M) is moderate, not indicating a significant breakout or reversal. The VWAP (573.26) sits near the middle of the range, further supporting the neutral assessment. The MACD at 0 indicates no clear momentum. There's a slight tendency for price to bounce off the 570.20 level, but it's too early to define a strong support.\n\n**3. VOLATILITY AND OPTIONS FOCUS:**\n\nThe significant drop in IV is the most important observation. This creates an opportunity to sell volatility, but the historical performance of iron condors is a major concern. The IV/HV disparity suggests that IV is likely to continue to contract, making premium collection strategies attractive. However, the ATR of 0.7857% (ATR% of 0.1369%) indicates that price swings, while contained, are still present. Ideal entry timing would be during periods of relative calm, near the VWAP, to maximize premium capture. A further decrease in IV would be beneficial for the spread.\n\n**4. KEY LEVEL INTERACTION:**\n\nCurrently, no significant key levels exist. However, based on intraday data, we can identify potential levels:\n\n*   **Intraday Support:** 570.20 (the low of the session) \u2013 a potential short-term support level.\n*   **Intraday Resistance:** 575.15 (the high of the session) \u2013 a potential short-term resistance level.\n*   **VWAP:** 573.26 \u2013 acting as a magnet for price action.\n\nThese levels are preliminary and require further confirmation.\n\n**5. CREDIT SPREAD OPPORTUNITY:**\n\nGiven the neutral trend, decreasing IV, and moderate volume, a **bear call spread** appears to be the most appropriate strategy. Iron condors have a 0% win rate, making them unsuitable. Bull put spreads are less attractive given the lack of strong downside momentum.\n\n*   **Strike Selection:**\n    *   **Short Call:** 575.00 (slightly above intraday resistance) \u2013 maximizes premium capture.\n    *   **Long Call:** 580.00 (out-of-the-money, providing a buffer) \u2013 limits potential losses.\n*   **Entry Timing:** Enter the spread when price pulls back towards the VWAP (573.26) or tests the 570.20 support.\n*   **Probability of Success Estimate:** 65% (based on the neutral trend and IV contraction).\n*   **Risk/Reward Profile:** 2:1 (potential profit of $50 against a maximum risk of $25, assuming standard contract pricing).\n\n**6. PREDICTION:**\n\n```\nPREDICTION OUTPUT:\ndirection: neutral\nmagnitude: 0.2%\ntimeframe: next_day\nconfidence: 75\nspecific_levels: [569.00, 572.00, 575.00, 578.00]\nspread_recommendation: bear call spread\nstrike_recommendation: Short Call 575.00, Long Call 580.00 - capitalizing on IV contraction and limited upside potential.\ninvalidation: Price breaks above 578.00 with significant volume, indicating a bullish reversal.\n```\n\n**7. MEMORY UPDATE:**\n\n```\nMEMORY UPDATE:\nreliability_update: {\n        \"pattern_type\": {\n            \"range_bound_intraday\": {\n                \"accuracy\": 60, \n                \"correct\": 1,\n                \"total\": 2\n            }\n   }\nvolatility_adjustment: decrease\nkey_level_update: [570.20 (support), 575.15 (resistance), 573.26 (VWAP)]\nupdated_confidence: 70\n```\n"
    },
    {
      "ticker": "SPY",
      "date": "2025-01-24",
      "step": 7,
      "analysis_type": "Summary",
      "price": 0,
      "trend": "neutral",
      "next_day_prediction": {
        "direction": "neutral",
        "magnitude": 0,
        "timeframe": "next_day",
        "confidence": 0,
        "specific_levels": [],
        "spread_recommendation": "",
        "strike_recommendation": "",
        "invalidation": ""
      },
      "full_analysis": "## SPY Credit Spread Trading Strategy: 2025-01-24 \u2013 2025-01-24\n\n**Executive Summary:** Despite a 0% historical success rate across all strategies analyzed, the consistent neutral intraday and daily analysis, coupled with a 60% confidence baseline neutral trend and a low volatility anchor of 1.0%, suggests a strategy focused on premium collection with tight risk management. Given the lack of directional conviction, Iron Condors remain the most suitable approach, but with extremely conservative strike selection and position sizing. The historical data is limited, necessitating a highly cautious approach.\n\n**1. TREND SYNTHESIS AND PATTERN IDENTIFICATION:**\n\nThe analysis consistently points to a neutral trend across all three days (75% confidence each day). This aligns with the baseline neutral trend (60% confidence). No reliable technical patterns were identified due to the limited data. Volume profile assessment is impossible with only three days of data. The consistency of the neutral signal across intraday and daily analysis strengthens the conviction, albeit weakly, in a sideways market.\n\n**2. KEY LEVEL CONSOLIDATION:**\n\nThe absence of historical data prevents the identification of core support and resistance levels. Therefore, strike selection will be based on the current SPY price (assumed to be around 485 as of late 2023/early 2024) and the volatility anchor. We will focus on strikes that offer a reasonable premium while maintaining a buffer zone around the current price.  Price action behavior around these levels is currently unknown, necessitating close monitoring post-trade. The most important price zones will be defined *after* initial trade establishment and observation of price reaction.\n\n**3. VOLATILITY PROFILE:**\n\nThe volatility anchor of 1.0% suggests relatively low volatility. Implied Volatility (IV) is likely higher than Historical Volatility (HV), presenting an opportunity for premium collection. Ideal premium collection zones will be defined by strikes that offer a credit of at least 0.10% of the underlying price (approximately $4.85 for a $485 SPY). Risk management will be paramount, with tight stop-loss orders and small position sizes.  We will target the 20th-80th percentile of IV rank for strike selection.\n\n**4. OPTIMIZED SPREAD STRATEGY:**\n\nGiven the neutral outlook and low volatility, **Iron Condors** are the most appropriate strategy.  The goal is to profit from time decay and a lack of significant price movement.\n\n* **Strike Selection:**  Assuming SPY is trading at $485:\n    * **Call Spread:** Sell a 490 Call, Buy a 495 Call.\n    * **Put Spread:** Sell a 480 Put, Buy a 475 Put.\n    * *Rationale:* These strikes provide a buffer of approximately 2.06% above and below the current price, offering a reasonable probability of success in a neutral market. The 5-point spread between the sold and bought options limits maximum loss.\n* **Entry Timing:** Enter the trade at the market open on 2025-01-24.\n* **Position Sizing:**  Trade 1 contract initially.  This is a conservative approach given the limited historical data.\n* **Risk Parameters:**\n    * **Maximum Loss:** Approximately $500 (5 points x 100 shares).\n    * **Maximum Profit:** Approximately $45 (credit received).\n    * **Stop-Loss:**  Close the trade if SPY closes above 495 or below 475.\n* **Invalidation Criteria:** The trade is invalidated if SPY closes above 495 or below 475.  This triggers immediate closure to limit losses.\n\n\n\n**5. MULTI-TIMEFRAME FORECAST:**\n\n```\nFORECAST: NEXT DAY (1-2 Day Outlook)\ndirection: neutral\nmagnitude: 0.0% - 0.2%\nconfidence: 70%\nspread_recommendation: Iron Condor\nstrike_selection: Sell 490C/Buy 495C, Sell 480P/Buy 475P (SPY @ $485)\nkey_levels: 495 (Call side invalidation), 475 (Put side invalidation)\ninvalidation: SPY closes above 495 or below 475.\nrisk_reward: 1:9 (Potential $45 profit vs. $500 max loss)\n```\n\n```\nFORECAST: NEXT WEEK (3-5 Day Outlook)\ndirection: neutral\nmagnitude: -0.5% - +0.5%\nconfidence: 65%\nspread_recommendation: Iron Condor (adjust strikes if necessary)\nstrike_selection: Re-evaluate strikes based on price movement. If SPY remains within the initial range, maintain the same strikes. If SPY moves significantly, adjust strikes to maintain a similar buffer.\nkey_levels: 495 (Call side invalidation), 475 (Put side invalidation)\ninvalidation: SPY closes above 495 or below 475.\nrisk_reward: 1:9 (Potential $45 profit vs. $500 max loss)\n```\n\n```\nFORECAST: NEXT MONTH (20-30 Day Outlook)\ndirection: neutral\nmagnitude: -1.0% - +1.0%\nconfidence: 60%\nspread_recommendation: Iron Condor (adjust strikes and potentially roll)\nstrike_selection:  Roll the Iron Condor to the next expiration if SPY remains within the initial range. Adjust strikes based on price movement and IV changes.  Consider widening the strike spreads if IV decreases significantly.\nkey_levels: 495 (Call side invalidation), 475 (Put side invalidation)\ninvalidation: SPY closes above 495 or below 475.\nrisk_reward: 1:9 (Potential $45 profit vs. $500 max loss)\n```\n\n**Technical Indicators:** Given the limited data, no specific technical indicators have proven reliable. However, monitoring the 20-day Simple Moving Average (SMA) and Relative Strength Index (RSI) may provide some insight into potential trend shifts.\n\n**Important Disclaimer:** This strategy is based on extremely limited historical data and a neutral baseline. It is a high-risk strategy and should be implemented with caution. Continuous monitoring and adjustment are crucial. The risk/reward ratio is unfavorable, reflecting the low confidence in the forecast. This is a premium collection strategy designed to profit from a lack of movement, not a directional bet.\n"
    },
    {
      "ticker": "SPY",
      "date": "2025-01-24",
      "type": "summary",
      "analysis_type": "summary",
      "next_day_prediction": {
        "direction": "neutral",
        "magnitude": 0,
        "timeframe": "next_day",
        "confidence": 0,
        "specific_levels": [],
        "spread_recommendation": "",
        "strike_recommendation": "",
        "invalidation": ""
      },
      "next_week_prediction": {
        "direction": "neutral",
        "magnitude": 0,
        "timeframe": "next_week",
        "confidence": 0,
        "specific_levels": [],
        "spread_recommendation": "",
        "strike_recommendation": "",
        "invalidation": ""
      },
      "next_month_prediction": {
        "direction": "neutral",
        "magnitude": 0,
        "timeframe": "next_month",
        "confidence": 0,
        "specific_levels": [],
        "spread_recommendation": "",
        "strike_recommendation": "",
        "invalidation": ""
      },
      "full_analysis": "## SPY Credit Spread Trading Strategy: 2025-01-24 \u2013 2025-01-24\n\n**Executive Summary:** Despite a 0% historical success rate across all strategies analyzed, the consistent neutral intraday and daily analysis, coupled with a 60% confidence baseline neutral trend and a low volatility anchor of 1.0%, suggests a strategy focused on premium collection with tight risk management. Given the lack of predictive power from historical data, the strategy will prioritize defined-risk trades with a focus on minimizing capital at risk.  We will lean heavily into Iron Condors, despite the historical failure, as the neutral outlook best suits this strategy.\n\n**1. TREND SYNTHESIS AND PATTERN IDENTIFICATION:**\n\nThe analysis consistently points to a neutral trend across all timeframes (intraday, daily).  No reliable technical patterns were identified due to the limited data. There are no divergences between intraday and daily analysis \u2013 both consistently indicate neutrality. Volume profile assessment is impossible with only 3 days of data.  The lack of any discernible trend necessitates a non-directional strategy.  Reliable indicators are currently undefined due to the limited dataset.\n\n**2. KEY LEVEL CONSOLIDATION:**\n\nThe baseline provides no core support or resistance levels.  With only 3 days of data, establishing meaningful levels is impossible.  Therefore, strike selection will be based on current price and implied volatility, rather than attempting to predict support/resistance.  The most important price zone is the current SPY price, as all spreads will be constructed around it.  Probability boundaries are equally undefined.\n\n**3. VOLATILITY PROFILE:**\n\nThe volatility anchor is 1.0%, indicating low expected volatility.  The relationship between Implied Volatility (IV) and Historical Volatility (HV) is currently unknown due to the limited data.  Premium collection zones will target the upper end of the expected volatility range, aiming for a credit. Risk management will be paramount, with tight stop-loss orders and small position sizes.  Given the low volatility anchor, we will target a maximum risk of 1% of capital per trade.\n\n**4. OPTIMIZED SPREAD STRATEGY:**\n\nGiven the neutral outlook and low volatility, **Iron Condors** are the most appropriate strategy.  While the historical performance is 0%, the strategy aligns with the expected market behavior.\n\n* **Strike Selection:**  We will construct an Iron Condor 30 days out (February 22nd expiration) centered around the current SPY price (assume SPY is currently at $485).\n    * **Call Side:** Sell a call option with a strike price of $490 (+$5 from current price). Buy a call option with a strike price of $495 (+$10 from current price).\n    * **Put Side:** Sell a put option with a strike price of $480 (-$5 from current price). Buy a put option with a strike price of $475 (-$10 from current price).\n* **Rationale:** This strike selection aims to capture premium decay while remaining outside the likely range of price movement given the neutral forecast and low volatility.\n* **Entry Timing:** Enter the trade on 2025-01-24 at market open.\n* **Position Sizing:** Allocate 2% of total capital to this trade, divided equally between the call and put sides. (This allows for two Iron Condors to be established).\n* **Risk Parameters:** Maximum loss is capped at the difference between the strike prices, less the premium received, multiplied by the number of shares represented by one option contract (100).\n* **Invalidation Criteria:** If SPY closes above $495 or below $475, the trade is invalidated and will be closed immediately.\n\n\n\n**5. MULTI-TIMEFRAME FORECAST:**\n\nAssume SPY is currently trading at $485.\n\n```\nFORECAST: NEXT DAY (1-2 Day Outlook)\ndirection: neutral\nmagnitude: 0.1%\nconfidence: 75\nspread_recommendation: Iron Condor (same strikes as above)\nstrike_selection: 490/495 Call Spread & 480/475 Put Spread\nkey_levels: $483 (minor resistance), $487 (minor resistance)\ninvalidation: SPY closes above $488 or below $482\nrisk_reward: 1:2 (Potential premium collected: $1.00/contract. Max loss: $4.00/contract.  Risk/Reward = 4/1 = 0.25)\n```\n\n```\nFORECAST: NEXT WEEK (3-5 Day Outlook)\ndirection: neutral\nmagnitude: 0.5%\nconfidence: 60\nspread_recommendation: Iron Condor (adjust strikes if necessary based on price movement)\nstrike_selection:  Maintain current strikes if SPY remains between $482-$488. If SPY moves above $488, adjust call side up by 5 points. If SPY moves below $482, adjust put side down by 5 points.\nkey_levels: $480 (support), $490 (resistance)\ninvalidation: SPY closes above $495 or below $475\nrisk_reward: 1:2.5 (Potential premium collected: $1.25/contract. Max loss: $5.00/contract. Risk/Reward = 5/1.25 = 0.4)\n```\n\n```\nFORECAST: NEXT MONTH (20-30 Day Outlook)\ndirection: neutral\nmagnitude: 1.0%\nconfidence: 60\nspread_recommendation: Iron Condor (continue to adjust strikes based on price movement)\nstrike_selection:  Continuously adjust strikes to maintain a neutral position and maximize premium collection.  Roll the spread forward if necessary to avoid assignment.\nkey_levels: $475 (long-term support), $500 (long-term resistance)\ninvalidation: SPY closes above $500 or below $475\nrisk_reward: 1:3 (Potential premium collected: $1.50/contract. Max loss: $6.00/contract. Risk/Reward = 6/1.5 = 0.4)\n```\n\n**Important Considerations:**\n\n*   **Data Limitations:** This strategy is based on extremely limited data.  Continuous monitoring and adjustment are crucial.\n*   **Volatility Changes:** A significant increase in volatility will negatively impact this strategy.  Be prepared to close the trade if IV spikes.\n*   **Black Swan Events:**  Unforeseen events can invalidate the neutral outlook.  Strict adherence to invalidation criteria is essential.\n*   **Continuous Monitoring:**  The market is dynamic.  This strategy requires constant monitoring and adjustments based on evolving conditions.\n\n\n\n**Disclaimer:** This analysis is for informational purposes only and should not be considered financial advice. Trading involves risk, and you could lose money. Always consult with a qualified financial advisor before making any investment decisions."
    }
  ],
  "memory_context": {
    "ticker": "SPY",
    "key_levels": {
      "support": [],
      "resistance": [],
      "pivot_points": []
    },
    "pattern_reliability": {
      "head_and_shoulders": {
        "correct": 0,
        "total": 0,
        "accuracy": 0
      },
      "double_top": {
        "correct": 0,
        "total": 0,
        "accuracy": 0
      },
      "double_bottom": {
        "correct": 0,
        "total": 0,
        "accuracy": 0
      },
      "triangle": {
        "correct": 0,
        "total": 0,
        "accuracy": 0
      },
      "flag": {
        "correct": 0,
        "total": 0,
        "accuracy": 0
      },
      "wedge": {
        "correct": 0,
        "total": 0,
        "accuracy": 0
      }
    },
    "volatility_history": [
      {
        "date": "2025-03-20",
        "iv": 1.3622400513588284,
        "hv": 1.0897920410870627,
        "adjustment": "no change"
      },
      {
        "date": "2025-03-21",
        "iv": 1.2175307444543289,
        "hv": 0.974024595563463,
        "adjustment": "no change"
      },
      {
        "date": "2025-03-24",
        "iv": 0.6844518095780909,
        "hv": 0.5475614476624727,
        "adjustment": "no change"
      },
      0
    ],
    "spread_performance": {
      "bull_put": {
        "wins": 0,
        "total": 0,
        "win_rate": 0
      },
      "bear_call": {
        "wins": 0,
        "total": 1,
        "win_rate": 0.0
      },
      "iron_condor": {
        "wins": 1,
        "total": 3,
        "win_rate": 0.3333333333333333
      }
    },
    "weight_adjustments": [
      0
    ],
    "multi_timeframe": {
      "daily_trend": "neutral",
      "weekly_trend": "neutral"
    },
    "secret": {
      "baseline_trend": "neutral",
      "trend_confidence": 60,
      "volatility_anchor": 1.0,
      "core_levels": {
        "support": [],
        "resistance": []
      }
    }
  }
}