{
  "ticker": "VTV",
  "start_date": "2025-01-24",
  "end_date": "2025-01-24",
  "processing_time": 149.6575961112976,
  "analyses_count": 5,
  "accuracy_rate": 0,
  "total_predictions": 0,
  "correct_predictions": 0,
  "results": [
    {
      "ticker": "VTV",
      "date": "2025-03-20",
      "step": 2,
      "analysis_type": "5d/15m_analysis",
      "price": 173.44000244140625,
      "trend": "neutral",
      "next_day_prediction": {
        "direction": "neutral",
        "magnitude": 0.2,
        "timeframe": "next_day",
        "confidence": 75,
        "specific_levels": [
          172.5,
          173.5,
          174.5
        ],
        "spread_recommendation": "iron condor",
        "strike_recommendation": "173.00/174.00 (Sell 173 Put, Buy 172.50 Put, Sell 174 Call, Buy 174.50 Call) - narrow width to maximize time decay.",
        "invalidation": "A break above 174.50 or below 172.50 with significant volume."
      },
      "prediction_accuracy": null,
      "memory_updates": {
        "reliability_update": {},
        "volatility_adjustment": "no change",
        "key_level_update": [],
        "updated_confidence": 0
      },
      "full_analysis": "## VTV Intraday Analysis - 2025-03-20 (15-Minute Data)\n\n**1. PRIOR CONTEXT INTEGRATION:**\n\nThe baseline trend remains neutral (60% confidence) as per the secret. Today\u2019s data doesn\u2019t contradict this. The SPY is also neutral, reinforcing the broader market indecision. The 30-day ATR of 1.0% provides a volatility anchor. The current intraday range (172.68 - 174.26) is relatively contained, suggesting a continuation of this neutral stance. No key levels were previously identified, so this analysis will focus on establishing those intraday. The slight difference between historical (0.76%) and implied volatility (0.95%) suggests a mild increase in option pricing relative to recent realized movement, but not a significant spike.\n\n**2. INTRADAY PATTERN ANALYSIS:**\n\nThe 15-minute chart shows a period of consolidation. The price action has been choppy, oscillating within a narrow range. The MACD at 0 indicates a lack of strong directional momentum. Volume (2193299) is moderate, not indicating a strong conviction in either direction. The VWAP (173.63) is slightly above the current price (173.44), suggesting a potential for short-term downside pressure. There's a slight tendency towards lower highs within the last hour of trading, hinting at a possible bearish bias, but it's too early to confirm. No clear chart patterns (e.g., head and shoulders, triangles) are discernible with only 26 bars.\n\n**3. VOLATILITY AND OPTIONS FOCUS:**\n\nIntraday volatility, as indicated by the ATR of 0.33 (1.9% of price), is lower than the 30-day ATR. This suggests a period of relative calm within the broader volatility context. Implied volatility (0.95%) is slightly elevated compared to historical volatility (0.76%), indicating options are pricing in a bit more risk than recent price movements suggest. This creates a favorable environment for selling premium. Premium expansion is unlikely in the short term given the neutral market context and contained price action. A slight contraction in IV is possible if the price remains range-bound.\n\n**4. KEY LEVEL INTERACTION:**\n\nGiven the lack of pre-existing key levels, we need to define intraday levels. Based on the 15-minute data:\n\n*   **Intraday Resistance:** 174.00 - 174.25 (High of the session)\n*   **Intraday Support:** 172.70 - 173.00 (Low of the session)\n*   **Critical Zone:** 173.50 - 173.75 (Around VWAP, potential area of consolidation)\n\nPrice is currently testing the lower end of the intraday support zone. A break below 172.70 could signal further downside, while a move above 174.00 could indicate a bullish reversal.\n\n**5. CREDIT SPREAD OPPORTUNITY:**\n\nGiven the neutral market context, moderate volatility, and the potential for continued consolidation, an **Iron Condor** is the most appropriate strategy.\n\n*   **Strike Selection:**\n    *   **Call Side:** 174.00 (slightly above intraday resistance)\n    *   **Put Side:** 173.00 (slightly below intraday support)\n    *   **Width:** 1.00 (174.00 - 173.00) - a relatively narrow width to capitalize on time decay.\n*   **Entry Timing:** Enter the Iron Condor when the price tests or slightly breaks below 173.00, ideally with a small bounce. This provides a better entry price and confirms support.\n*   **Probability of Success Estimate:** 65-70% (given the neutral outlook and defined range)\n*   **Risk/Reward Profile:** Aim for a credit of $0.10 - $0.20 per share, with a maximum risk of $1.00 per share (the width of the spread). This yields a risk/reward ratio of at least 1:1.\n\n**6. PREDICTION:**\n\n```\nPREDICTION OUTPUT:\ndirection: neutral\nmagnitude: 0.2%\ntimeframe: next_day\nconfidence: 75\nspecific_levels: [172.50, 173.50, 174.50]\nspread_recommendation: iron condor\nstrike_recommendation: 173.00/174.00 (Sell 173 Put, Buy 172.50 Put, Sell 174 Call, Buy 174.50 Call) - narrow width to maximize time decay.\ninvalidation: A break above 174.50 or below 172.50 with significant volume.\n```\n\n**7. MEMORY UPDATE:**\n\n```\nMEMORY UPDATE:\nreliability_update: {\n        \"iron_condor\": {\n            \"accuracy\": [0], \n            \"correct\": [0],\n            \"total\": [0]\n        }\n   }\nvolatility_adjustment: no change\nkey_level_update: [172.70-173.00 (Support), 174.00-174.25 (Resistance), 173.50-173.75 (Critical Zone)]\nupdated_confidence: 70\n```\n"
    },
    {
      "ticker": "VTV",
      "date": "2025-03-21",
      "step": 3,
      "analysis_type": "5d/15m_analysis",
      "price": 172.61500549316406,
      "trend": "neutral",
      "next_day_prediction": {
        "direction": "neutral",
        "magnitude": 0.1,
        "timeframe": "next_day",
        "confidence": 75,
        "specific_levels": [
          171.0,
          172.5,
          173.0
        ],
        "spread_recommendation": "iron condor",
        "strike_recommendation": "173.00/173.50 call spread and 171.50/171.00 put spread. Rationale: These strikes are slightly outside the current intraday range, offering a buffer and maximizing potential premium capture in a range-bound market.",
        "invalidation": "A break above 173.00 or below 171.00 with significant volume would invalidate this prediction."
      },
      "prediction_accuracy": null,
      "memory_updates": {
        "reliability_update": {},
        "volatility_adjustment": "no change",
        "key_level_update": [],
        "updated_confidence": 0
      },
      "full_analysis": "## VTV Intraday Analysis - 2025-03-21\n\n**1. PRIOR CONTEXT INTEGRATION:**\n\nToday\u2019s data largely confirms the neutral baseline trend established in the secret. The SPY is also neutral, reinforcing this view. Yesterday\u2019s IV (0.9521) and HV (0.7617) were slightly lower than today\u2019s, suggesting a minor increase in volatility, but still within a relatively contained range. The lack of identified key levels remains consistent, meaning we are operating in a level-less environment, relying heavily on intraday dynamics. The mixed trend (daily neutral, weekly neutral) supports a strategy that profits from range-bound movement.\n\n**2. INTRADAY PATTERN ANALYSIS:**\n\nThe 15-minute data shows a range of 171.42 to 172.95, a relatively tight range for the time elapsed (26 bars). Volume (2484344) is moderate, not indicating a strong directional push. The VWAP (172.31) sits slightly below the current price (172.62), suggesting a slight bullish bias within the intraday session. The MACD at 0 indicates no strong momentum. The RSI at 53.87 is neutral, further supporting the range-bound assessment. There's no clear pattern formation (e.g., head and shoulders, triangles) visible in the limited 15-minute data. The price action appears to be choppy, lacking a defined trend.\n\n**3. VOLATILITY AND OPTIONS FOCUS:**\n\nImplied Volatility (0.9813) is slightly higher than Historical Volatility (0.7850), indicating a volatility premium. The ATR of 0.3388 (1.96% as a percentage of price) provides a reasonable anchor for risk assessment. Given the neutral trend and moderate volatility, a strategy that benefits from time decay and range-bound movement is preferred. The slight increase in IV from yesterday suggests potential for premium contraction, favoring selling options. Entry timing should focus on periods of relative calm within the intraday range, ideally near the upper end of the range to capitalize on potential premium decay.\n\n**4. KEY LEVEL INTERACTION:**\n\nCurrently, no key levels are identified. Within the intraday data, the high of 172.95 and low of 171.42 act as immediate intraday resistance and support, respectively. These are not considered significant levels for longer-term trading but are crucial for strike selection within the 15-minute timeframe. We can define a short-term resistance zone around 172.80-172.95 and a support zone around 171.50-171.65.\n\n**5. CREDIT SPREAD OPPORTUNITY:**\n\nGiven the neutral trend, moderate volatility, and slight bullish intraday bias, an **iron condor** is the most appropriate strategy.\n\n* **Strike Selection:**\n    * **Call Side:** Sell a 173.00 call, buy a 173.50 call. (Slightly above intraday resistance)\n    * **Put Side:** Sell a 171.50 put, buy a 171.00 put. (Slightly below intraday support)\n* **Entry Timing:** Enter the iron condor around 11:00 AM EST, allowing the intraday range to establish itself.\n* **Probability of Success Estimate:** 65% (Based on the range-bound nature of the market and the moderate volatility)\n* **Risk/Reward Profile:** 1:2 (Potential profit of $50 per spread, risking $25 per spread).\n\n**6. PREDICTION:**\n\n```\nPREDICTION OUTPUT:\ndirection: neutral\nmagnitude: 0.1%\ntimeframe: next_day\nconfidence: 75\nspecific_levels: [171.00, 172.50, 173.00]\nspread_recommendation: iron condor\nstrike_recommendation: 173.00/173.50 call spread and 171.50/171.00 put spread. Rationale: These strikes are slightly outside the current intraday range, offering a buffer and maximizing potential premium capture in a range-bound market.\ninvalidation: A break above 173.00 or below 171.00 with significant volume would invalidate this prediction.\n```\n\n**7. MEMORY UPDATE:**\n\n```\nMEMORY UPDATE:\nreliability_update: {\n        \"iron_condor\": {\n            \"accuracy\": 0.0, \n            \"correct\": 0,\n            \"total\": 1\n        }\n   }\nvolatility_adjustment: no change\nkey_level_update: [171.50-171.65 (support), 172.80-172.95 (resistance)]\nupdated_confidence: 70\n```\n"
    },
    {
      "ticker": "VTV",
      "date": "2025-03-24",
      "step": 4,
      "analysis_type": "5d/15m_analysis",
      "price": 174.60000610351562,
      "trend": "neutral",
      "next_day_prediction": {
        "direction": "neutral",
        "magnitude": 0.2,
        "timeframe": "next_day",
        "confidence": 75,
        "specific_levels": [
          173.75,
          174.75,
          175.0
        ],
        "spread_recommendation": "bear call spread",
        "strike_recommendation": "Sell 175 call, Buy 176 call - capitalizing on IV contraction and limited upside potential.",
        "invalidation": "A break above 175.00 with significant volume would invalidate this prediction."
      },
      "prediction_accuracy": null,
      "memory_updates": {
        "reliability_update": {},
        "volatility_adjustment": "no change",
        "key_level_update": [],
        "updated_confidence": 0
      },
      "full_analysis": "## VTV Intraday Analysis - 2025-03-24\n\n**1. PRIOR CONTEXT INTEGRATION:**\n\nToday\u2019s data largely confirms the neutral baseline trend established in the secret. The SPY trend is also neutral, reinforcing this view. Implied Volatility (IV) has decreased from the previous two days (0.9521 & 0.9812) to 0.6071, indicating a potential easing of market anxiety. Historical Volatility (HV) remains lower than IV, suggesting IV is still elevated but contracting. The lack of identified key levels previously remains consistent. The intraday range (173.61 - 174.83) is relatively narrow, supporting the neutral outlook. No contradictions to the prior analysis are present.\n\n**2. INTRADAY PATTERN ANALYSIS:**\n\nThe 15-minute chart shows a period of consolidation within the intraday range. The price action lacks a clear directional bias. The volume (2339023) is moderate, not indicating strong conviction in either direction. The VWAP (174.505) sits slightly below the current price (174.60), suggesting a slight bullish lean within the intraday session, but not significant enough to alter the overall neutral assessment. There are no obvious chart patterns like head and shoulders or triangles forming. Momentum, as indicated by the MACD at 0, is neutral. The RSI at 57.02 suggests the price is not overbought or oversold.\n\n**3. VOLATILITY AND OPTIONS FOCUS:**\n\nThe decrease in IV is the most significant observation. This suggests a potential opportunity to sell volatility. The IV/HV disparity still allows for premium collection, but the shrinking gap requires careful strike selection. The ATR of 0.2120 (1.21% ATR%) provides a reasonable benchmark for potential price movement.  An ideal entry timing would be near the VWAP or a slight pullback towards support, capitalizing on the IV contraction. Premium expansion is less likely given the current trend, but a sudden market shock could cause it. Focus should be on strategies that benefit from stable or decreasing volatility.\n\n**4. KEY LEVEL INTERACTION:**\n\nCurrently, no key levels have been identified. However, based on the intraday data, we can establish preliminary levels. Intraday support forms around 173.75-173.80 (multiple touches on the low) and intraday resistance around 174.75-174.80 (multiple touches on the high). These are *intraday* levels and should not be confused with longer-term support/resistance. Price is currently testing the intraday resistance.\n\n**5. CREDIT SPREAD OPPORTUNITY:**\n\nGiven the neutral trend, decreasing IV, and moderate volume, a **bear call spread** appears to be the most appropriate strategy. This allows for profiting from time decay and a lack of significant upward movement.\n\n*   **Strike Selection:** Sell a 175 call and buy a 176 call. The 175 strike is slightly above the intraday resistance, offering a reasonable buffer. The 176 strike provides limited downside protection.\n*   **Entry Timing:** Enter the spread when the price pulls back slightly from the intraday resistance (around 174.70-174.75) or trades near the VWAP.\n*   **Probability of Success Estimate:** 65% - Based on the neutral trend and decreasing IV, the probability of the price remaining below 175 by expiration is reasonably high.\n*   **Risk/Reward Profile:** Aim for a credit of $0.10 - $0.15. Maximum risk is $0.05 (difference between strikes minus the credit received). This yields a risk/reward ratio of at least 2:1.\n\n**6. PREDICTION:**\n\n```\nPREDICTION OUTPUT:\ndirection: neutral\nmagnitude: 0.2%\ntimeframe: next_day\nconfidence: 75\nspecific_levels: [173.75, 174.75, 175.00]\nspread_recommendation: bear call spread\nstrike_recommendation: Sell 175 call, Buy 176 call - capitalizing on IV contraction and limited upside potential.\ninvalidation: A break above 175.00 with significant volume would invalidate this prediction.\n```\n\n**7. MEMORY UPDATE:**\n\n```\nMEMORY UPDATE:\nreliability_update: {\n        \"pattern_type\": {\n            \"consolidation\": {\n                \"accuracy\": 60, \n                \"correct\": 1,\n                \"total\": 2\n            }\n   }\nvolatility_adjustment: decrease\nkey_level_update: [intraday support: 173.75-173.80, intraday resistance: 174.75-174.80]\nupdated_confidence: 70\n```\n"
    },
    {
      "ticker": "VTV",
      "date": "2025-01-24",
      "step": 7,
      "analysis_type": "Summary",
      "price": 0,
      "trend": "neutral",
      "next_day_prediction": {
        "direction": "neutral",
        "magnitude": 0,
        "timeframe": "next_day",
        "confidence": 0,
        "specific_levels": [],
        "spread_recommendation": "",
        "strike_recommendation": "",
        "invalidation": ""
      },
      "full_analysis": "## VTV Credit Spread Trading Strategy: 2025-01-24 - 2025-01-24 (3-Day Analysis)\n\n**Executive Summary:** Despite a consistent neutral intraday outlook, the historical performance of implemented strategies is 0% successful. Given the baseline neutral trend with 60% confidence and a volatility anchor of 1.0%, a highly conservative approach focusing on premium collection with tight risk management is paramount. The lack of identified support/resistance levels necessitates a strategy that profits from time decay and minimal directional movement. We will prioritize Iron Condors, but with extremely tight strike selection and a focus on maximizing probability of profit (POP) even at the expense of premium.\n\n**1. TREND SYNTHESIS AND PATTERN IDENTIFICATION:**\n\nThe analysis consistently indicates a neutral trend across all intraday periods (75% confidence each day). No discernible technical patterns were identified due to the limited data and neutral price action. There are no divergences between intraday and daily analysis as both consistently point to neutrality. Volume profile assessment is unavailable due to the limited data set.  The consistent neutrality suggests a range-bound market.\n\n**2. KEY LEVEL CONSOLIDATION:**\n\nThe analysis *failed to identify* any core support or resistance levels. This is a critical limitation.  Without defined levels, strike selection must be based on current price and implied volatility, aiming for strikes with a high probability of remaining unbreached.  The most important price zone is the current trading range, which is currently undefined due to the lack of historical data.\n\n**3. VOLATILITY PROFILE:**\n\nVolatility is anchored at 1.0%, suggesting low expected movement. The IV vs HV relationship is unavailable due to the limited data.  Ideal premium collection zones are those offering the highest probability of profit, even if the premium is minimal. Risk management parameters must be extremely tight, with defined exit points for even small breaches of the spread.  Given the low volatility, focus on maximizing time decay (Theta) and minimizing Delta exposure.\n\n**4. OPTIMIZED SPREAD STRATEGY:**\n\nGiven the neutral trend, lack of defined levels, and low volatility, **Iron Condors** are the most appropriate strategy.  However, due to the 0% historical success rate, we will implement a *highly conservative* approach.\n\n* **Strike Selection:**  We will select strikes 1-2% OTM on both the call and put sides. This prioritizes POP over premium.  Assume VTV is currently trading at $140.\n    * **Short Put:** $138.20 (2% OTM)\n    * **Long Put:** $137.20 (3% OTM)\n    * **Short Call:** $141.80 (2% OTM)\n    * **Long Call:** $142.80 (3% OTM)\n* **Entry Timing:** Enter the spread at the market open.\n* **Position Sizing:** 1 contract initially.  Scale up *only* if the spread maintains a 70%+ POP throughout the day.\n* **Risk Parameters:** Maximum loss per contract is capped at $180 (difference between strikes x 100 shares).\n* **Invalidation Criteria:**  Breach of either the short put or short call strike *immediately* invalidates the trade. Exit the spread regardless of time remaining.\n\n\n\n**5. MULTI-TIMEFRAME FORECAST:**\n\n```\nFORECAST: NEXT DAY (1-2 Day Outlook)\ndirection: neutral\nmagnitude: 0.0% - 0.2%\nconfidence: 70%\nspread_recommendation: Iron Condor\nstrike_selection: Short Put $138.20, Long Put $137.20, Short Call $141.80, Long Call $142.80 (based on $140 current price)\nkey_levels: $138.20 (Put Breach), $141.80 (Call Breach)\ninvalidation: Breach of either short strike.\nrisk_reward: 1:2 (Potential profit of $100 - $180, Max Loss $180) - *Highly dependent on premium received, aiming for at least $50 premium.*\n```\n\n```\nFORECAST: NEXT WEEK (3-5 Day Outlook)\ndirection: neutral\nmagnitude: -0.5% - +0.5%\nconfidence: 60%\nspread_recommendation: Iron Condor\nstrike_selection: Short Put $138.20, Long Put $137.20, Short Call $141.80, Long Call $142.80 (adjust based on price movement, maintaining 1-2% OTM)\nkey_levels: $138.20 (Put Breach), $141.80 (Call Breach)\ninvalidation: Breach of either short strike.\nrisk_reward: 1:2 (Potential profit of $100 - $180, Max Loss $180) - *Highly dependent on premium received, aiming for at least $50 premium.*\n```\n\n```\nFORECAST: NEXT MONTH (20-30 Day Outlook)\ndirection: neutral\nmagnitude: -1.0% - +1.0%\nconfidence: 60%\nspread_recommendation: Iron Condor\nstrike_selection: Short Put $138.20, Long Put $137.20, Short Call $141.80, Long Call $142.80 (adjust based on price movement, maintaining 1-2% OTM)\nkey_levels: $138.20 (Put Breach), $141.80 (Call Breach)\ninvalidation: Breach of either short strike.\nrisk_reward: 1:2 (Potential profit of $100 - $180, Max Loss $180) - *Highly dependent on premium received, aiming for at least $50 premium.*\n```\n\n**Technical Indicators:** Given the limited data, no indicators proved reliable.  Future analysis should incorporate moving averages (20-day, 50-day) and RSI to identify potential support/resistance levels.\n\n**Important Considerations:**\n\n* **Data Limitations:** This strategy is based on only 3 days of data.  The 0% success rate is a significant concern.  Continuous monitoring and adjustment are crucial.\n* **Premium Collection:** The success of this strategy hinges on collecting sufficient premium to justify the risk.  If premium is insufficient, *do not execute the trade*.\n* **Dynamic Adjustment:**  Strike selection must be dynamically adjusted based on price movement.  Maintain the 1-2% OTM rule.\n* **Strict Invalidation:**  The invalidation criteria are non-negotiable.  Protect capital by exiting immediately upon breach of either short strike.\n\n\n\nThis strategy is designed for a neutral market and prioritizes capital preservation. The extremely conservative strike selection and strict risk management are a direct response to the historical performance and limited data available.  Continuous monitoring and adaptation are essential for success."
    },
    {
      "ticker": "VTV",
      "date": "2025-01-24",
      "type": "summary",
      "analysis_type": "summary",
      "next_day_prediction": {
        "direction": "neutral",
        "magnitude": 0,
        "timeframe": "next_day",
        "confidence": 0,
        "specific_levels": [],
        "spread_recommendation": "",
        "strike_recommendation": "",
        "invalidation": ""
      },
      "next_week_prediction": {
        "direction": "neutral",
        "magnitude": 0,
        "timeframe": "next_week",
        "confidence": 0,
        "specific_levels": [],
        "spread_recommendation": "",
        "strike_recommendation": "",
        "invalidation": ""
      },
      "next_month_prediction": {
        "direction": "neutral",
        "magnitude": 0,
        "timeframe": "next_month",
        "confidence": 0,
        "specific_levels": [],
        "spread_recommendation": "",
        "strike_recommendation": "",
        "invalidation": ""
      },
      "full_analysis": "## VTV Credit Spread Trading Strategy: 2025-01-24 - 2025-01-24 (3-Day Analysis)\n\n**Executive Summary:** Despite a consistent neutral intraday outlook, the historical performance of implemented strategies is 0% successful. Given the baseline neutral trend with 60% confidence and a volatility anchor of 1.0%, a highly conservative approach focusing on premium collection with tight risk management is paramount. The lack of identified support/resistance levels necessitates a strategy that profits from time decay and minimal directional movement. We will prioritize Iron Condors, but with extremely tight strike selection and a focus on maximizing probability of profit (POP) even at the expense of premium.\n\n**1. TREND SYNTHESIS AND PATTERN IDENTIFICATION:**\n\nThe analysis consistently indicates a neutral trend across all intraday periods (75% confidence each day). No discernible technical patterns were identified due to the limited data and neutral price action. There are no divergences between intraday and daily analysis as all point to neutrality. Volume profile assessment is unavailable due to the limited data set.  The consistent neutrality suggests a range-bound market.\n\n**2. KEY LEVEL CONSOLIDATION:**\n\nThe analysis *failed to identify* any core support or resistance levels. This is a critical limitation.  Without defined levels, strike selection must be based on current price and implied volatility, aiming for strikes with a high probability of remaining outside of.  The absence of levels suggests a lack of strong directional conviction in the market.  We will focus on the current price as a central point for strike selection.\n\n**3. VOLATILITY PROFILE:**\n\nThe volatility anchor is 1.0%, indicating relatively low volatility expectations.  Given the neutral trend, we expect Implied Volatility (IV) to remain relatively stable.  The goal is to collect premium in a low-volatility environment.  Ideal premium collection zones will be determined by maximizing POP, even if the premium collected is minimal. Risk management will be heavily reliant on defined invalidation criteria and tight stop-loss orders.\n\n**4. OPTIMIZED SPREAD STRATEGY:**\n\nGiven the neutral trend, lack of defined levels, and low volatility, **Iron Condors** are the most appropriate strategy.  The goal is to profit from time decay and minimal price movement.\n\n* **Strike Selection:**  We will use a 1-2% out-of-the-money (OTM) buffer on both the call and put sides, relative to the current VTV price (assume VTV is currently trading at $150 for illustrative purposes). This means selling a put at $147-148 and a call at $152-153.  The exact strikes will be adjusted based on real-time IV and bid-ask spreads.\n* **Entry Timing:** Enter the Iron Condor at the open, aiming for a credit of at least $0.10 per share (total credit of $100 per contract).\n* **Position Sizing:**  Limit position size to 1-2 contracts initially, given the 0% historical success rate.\n* **Risk Parameters:** Maximum loss is capped at the difference between the strike prices, less the premium received, multiplied by 100.\n* **Invalidation Criteria:**  A breach of either the call or put strike price *immediately* invalidates the trade.  Close the entire position.\n\n\n\n**5. MULTI-TIMEFRAME FORECAST:**\n\nAssume VTV is currently trading at $150.\n\n```\nFORECAST: NEXT DAY (1-2 Day Outlook)\ndirection: neutral\nmagnitude: 0.0% - 0.2%\nconfidence: 70%\nspread_recommendation: Iron Condor\nstrike_selection: Sell 150C at $152.50, Sell 150P at $147.50 (aim for $0.15 credit)\nkey_levels: $152.50 (Call Strike), $147.50 (Put Strike)\ninvalidation: Price closes above $152.50 or below $147.50\nrisk_reward: Risk = $2.50 - $0.15 = $2.35. Reward = $0.15. Risk/Reward = 15.67\n```\n\n```\nFORECAST: NEXT WEEK (3-5 Day Outlook)\ndirection: neutral\nmagnitude: -0.5% - +0.5%\nconfidence: 65%\nspread_recommendation: Iron Condor\nstrike_selection: Sell 150C at $153.00, Sell 150P at $147.00 (aim for $0.20 credit)\nkey_levels: $153.00 (Call Strike), $147.00 (Put Strike)\ninvalidation: Price closes above $153.00 or below $147.00\nrisk_reward: Risk = $3.00 - $0.20 = $2.80. Reward = $0.20. Risk/Reward = 14.0\n```\n\n```\nFORECAST: NEXT MONTH (20-30 Day Outlook)\ndirection: neutral\nmagnitude: -1.0% - +1.0%\nconfidence: 60%\nspread_recommendation: Iron Condor\nstrike_selection: Sell 150C at $154.00, Sell 150P at $146.00 (aim for $0.30 credit)\nkey_levels: $154.00 (Call Strike), $146.00 (Put Strike)\ninvalidation: Price closes above $154.00 or below $146.00\nrisk_reward: Risk = $4.00 - $0.30 = $3.70. Reward = $0.30. Risk/Reward = 12.33\n```\n\n**Important Considerations:**\n\n* **Historical Performance:** The 0% success rate is a significant concern. This strategy is being implemented with extreme caution and tight risk management.\n* **Lack of Levels:** The absence of defined support and resistance levels makes this a challenging trading environment.\n* **Volatility:** Monitor IV closely. A spike in IV could significantly impact the profitability of the Iron Condor.\n* **Technical Indicators:** Given the limited data, no specific technical indicators proved reliable.  Focus on price action around the strike prices.\n* **Adjustment:** Be prepared to adjust or close the position if the market deviates from the neutral expectation.\n\n\n\n**Disclaimer:** This analysis is based on limited data and should not be considered financial advice. Trading involves risk, and you could lose money. Always conduct your own research and consult with a qualified financial advisor before making any investment decisions."
    }
  ],
  "memory_context": {
    "ticker": "VTV",
    "key_levels": {
      "support": [],
      "resistance": [],
      "pivot_points": []
    },
    "pattern_reliability": {
      "head_and_shoulders": {
        "correct": 0,
        "total": 0,
        "accuracy": 0
      },
      "double_top": {
        "correct": 0,
        "total": 0,
        "accuracy": 0
      },
      "double_bottom": {
        "correct": 0,
        "total": 0,
        "accuracy": 0
      },
      "triangle": {
        "correct": 0,
        "total": 0,
        "accuracy": 0
      },
      "flag": {
        "correct": 0,
        "total": 0,
        "accuracy": 0
      },
      "wedge": {
        "correct": 0,
        "total": 0,
        "accuracy": 0
      }
    },
    "volatility_history": [
      {
        "date": "2025-03-20",
        "iv": 0.9521339173091037,
        "hv": 0.761707133847283,
        "adjustment": "no change"
      },
      {
        "date": "2025-03-21",
        "iv": 0.981269270535444,
        "hv": 0.7850154164283552,
        "adjustment": "no change"
      },
      {
        "date": "2025-03-24",
        "iv": 0.607128098554691,
        "hv": 0.4857024788437528,
        "adjustment": "no change"
      },
      0
    ],
    "spread_performance": {
      "bull_put": {
        "wins": 0,
        "total": 0,
        "win_rate": 0
      },
      "bear_call": {
        "wins": 0,
        "total": 1,
        "win_rate": 0.0
      },
      "iron_condor": {
        "wins": 1,
        "total": 3,
        "win_rate": 0.3333333333333333
      }
    },
    "weight_adjustments": [
      0
    ],
    "multi_timeframe": {
      "daily_trend": "neutral",
      "weekly_trend": "neutral"
    },
    "secret": {
      "baseline_trend": "neutral",
      "trend_confidence": 60,
      "volatility_anchor": 1.0,
      "core_levels": {
        "support": [],
        "resistance": []
      }
    }
  }
}