{
  "ticker": "NVDA",
  "start_date": "2025-01-24",
  "end_date": "2025-01-24",
  "processing_time": 149.762047290802,
  "analyses_count": 5,
  "accuracy_rate": 0,
  "total_predictions": 0,
  "correct_predictions": 0,
  "results": [
    {
      "ticker": "NVDA",
      "date": "2025-03-20",
      "step": 2,
      "analysis_type": "5d/15m_analysis",
      "price": 118.47000122070312,
      "trend": "neutral",
      "next_day_prediction": {
        "direction": "neutral",
        "magnitude": 0.5,
        "timeframe": "next_day",
        "confidence": 75,
        "specific_levels": [
          116.0,
          118.5,
          120.5
        ],
        "spread_recommendation": "iron condor",
        "strike_recommendation": "Sell 119C/Buy 120C & Sell 117.5P/Buy 116.5P - based on intraday resistance/support and premium availability.",
        "invalidation": "A break above 120.50 or below 116.00 would invalidate this prediction."
      },
      "prediction_accuracy": null,
      "memory_updates": {
        "reliability_update": {},
        "volatility_adjustment": "no change",
        "key_level_update": [],
        "updated_confidence": 0
      },
      "full_analysis": "## NVDA Intraday Analysis - 2025-03-20\n\n**1. PRIOR CONTEXT INTEGRATION:**\n\nThe baseline trend remains neutral (60% confidence) as per the secret. Today\u2019s data doesn\u2019t contradict this. The neutral SPY trend and market score of 50 further support this assessment. The 15-minute data shows a relatively wide range (116.47 - 120.20) indicating intraday volatility, but doesn\u2019t establish a clear directional bias. The lack of key levels identified in the memory context reinforces the need for a cautious, range-bound strategy. The ATR of 0.7649 is consistent with the volatility anchor of 1.0%, suggesting current volatility is within acceptable parameters. No changes to key level relevance are needed at this time.\n\n**2. INTRADAY PATTERN ANALYSIS:**\n\nThe 15-minute chart shows a period of consolidation after an initial push higher. The high of 120.20 was met with selling pressure, pulling the price back down to around 116.47 before recovering to the current price of 118.47. This suggests a potential double-top formation, but it\u2019s too early to confirm without further price action. Volume is substantial at 215,362,166, indicating active participation. The VWAP at 118.68 is slightly above the current price, suggesting short-term bearish momentum. Momentum, as indicated by the MACD at 0, is neutral. The RSI at 51.20 is also neutral, not indicating overbought or oversold conditions.\n\n**3. VOLATILITY AND OPTIONS FOCUS:**\n\nImplied volatility (3.23%) is slightly lower than historical volatility (2.58%), suggesting options are slightly overpriced relative to recent price movements. This favors selling options strategies. The ATR% of 0.6457 indicates that the current volatility is moderate. Premium expansion is possible if the price breaks above 120.20 or below 116.47, but contraction is more likely given the neutral momentum and slightly elevated IV. Ideal entry timing would be near the VWAP (118.68) or after a confirmed breakout/breakdown from the current range.\n\n**4. KEY LEVEL INTERACTION:**\n\nCurrently, no key levels are identified. However, based on the intraday data, we can establish preliminary levels. 116.47 acts as intraday support, and 120.20 acts as intraday resistance. The price is currently testing the VWAP (118.68) which could act as a minor resistance. Critical zones for strike selection are around 118.50 and 119.00 for calls, and 117.50 and 117.00 for puts.\n\n**5. CREDIT SPREAD OPPORTUNITY:**\n\nGiven the neutral trend, moderate volatility, and the potential for range-bound trading, an **iron condor** is the most appropriate strategy.\n\n*   **Strike Selection:**\n    *   **Call Side:** Sell a 119.00 call, buy a 120.00 call. (Rationale: 119.00 is near the intraday resistance and offers a reasonable premium. 120.00 provides a buffer against a significant breakout.)\n    *   **Put Side:** Sell a 117.50 put, buy a 116.50 put. (Rationale: 117.50 is near the intraday support and offers a reasonable premium. 116.50 provides a buffer against a significant breakdown.)\n*   **Entry Timing:** Enter the trade when the price is near the VWAP (118.68) or after a slight pullback.\n*   **Probability of Success Estimate:** 65% (Based on the expectation of continued range-bound trading.)\n*   **Risk/Reward Profile:** 1:2 (Targeting a 50% premium capture with a maximum loss equal to the difference between the strikes minus the premium received.)\n\n**6. PREDICTION:**\n\n```\nPREDICTION OUTPUT:\ndirection: neutral\nmagnitude: 0.5%\ntimeframe: next_day\nconfidence: 75\nspecific_levels: [116.00, 118.50, 120.50]\nspread_recommendation: iron condor\nstrike_recommendation: Sell 119C/Buy 120C & Sell 117.5P/Buy 116.5P - based on intraday resistance/support and premium availability.\ninvalidation: A break above 120.50 or below 116.00 would invalidate this prediction.\n```\n\n**7. MEMORY UPDATE:**\n\n```\nMEMORY UPDATE:\nreliability_update: {\n        \"iron_condor\": {\n            \"accuracy\": [0], \n            \"correct\": [0],\n            \"total\": [0]\n        }\n   }\nvolatility_adjustment: no change\nkey_level_update: [116.47 (support), 120.20 (resistance), 118.68 (VWAP - potential resistance)]\nupdated_confidence: 70\n```\n"
    },
    {
      "ticker": "NVDA",
      "date": "2025-03-21",
      "step": 3,
      "analysis_type": "5d/15m_analysis",
      "price": 117.63500213623047,
      "trend": "neutral",
      "next_day_prediction": {
        "direction": "neutral",
        "magnitude": 0.2,
        "timeframe": "next_day",
        "confidence": 75,
        "specific_levels": [
          115.0,
          117.5,
          118.0
        ],
        "spread_recommendation": "bull put spread",
        "strike_recommendation": "Sell 115.00 put, Buy 114.50 put - capitalizing on current price above support and decreasing volatility.",
        "invalidation": "Price breaks below 115.00 and closes below it on the next day."
      },
      "prediction_accuracy": null,
      "memory_updates": {
        "reliability_update": {},
        "volatility_adjustment": "no change",
        "key_level_update": [],
        "updated_confidence": 0
      },
      "full_analysis": "## NVDA Intraday Analysis - 2025-03-21\n\n**1. PRIOR CONTEXT INTEGRATION:**\n\nThe baseline trend remains neutral (60% confidence) as per the secret. Yesterday\u2019s IV (3.23%) was higher than today\u2019s (2.54%), suggesting a slight decrease in fear/uncertainty. Historical volatility (2.03%) remains below implied volatility, indicating a premium is priced into options. The neutral market context (SPY) and market trend score of 50 reinforce the neutral outlook. No key levels were previously identified, so today\u2019s analysis will focus on establishing those. The prior iron condor performance (0/1 win rate) is statistically insignificant at this stage but warrants monitoring. Today\u2019s data doesn\u2019t contradict the prior analysis; it refines it by providing intraday context.\n\n**2. INTRADAY PATTERN ANALYSIS:**\n\nThe 15-minute chart shows a range-bound session with a high of 117.99 and a low of 115.42. The price is currently at 117.64, closer to the high of the day. Volume (206.6M) is relatively healthy, suggesting active participation. The VWAP (116.71) is below the current price, indicating intraday buying pressure. The MACD is at 0, suggesting no strong momentum. RSI at 62.84 suggests the stock is not overbought but is leaning towards bullish momentum. There's a potential for a short-term pullback given the RSI reading, but the overall intraday trend is slightly bullish. No clear chart patterns (e.g., head and shoulders, triangles) are forming within the 26 bars.\n\n**3. VOLATILITY AND OPTIONS FOCUS:**\n\nIntraday volatility, as indicated by the ATR of 0.5966 (0.51% as a percentage of price), is lower than yesterday\u2019s implied volatility. This suggests a potential opportunity to sell premium. The IV/HV ratio (2.54/2.03 = 1.25) indicates options are still relatively expensive, but the decreasing IV suggests a potential for premium contraction. Ideal entry timing for a credit spread would be during a period of relative calm, potentially a slight pullback from the intraday high. A further decrease in IV would be beneficial for maximizing profit.\n\n**4. KEY LEVEL INTERACTION:**\n\nGiven the lack of prior key levels, we need to establish them intraday. The high of 117.99 acts as immediate intraday resistance. The low of 115.42 serves as immediate intraday support. A break above 118.00 could signal further bullish momentum, while a break below 115.40 could lead to a test of lower levels. Critical zones for strike selection are around 117.50-118.00 for resistance and 115.00-115.50 for support.\n\n**5. CREDIT SPREAD OPPORTUNITY:**\n\nBased on the slightly bullish intraday momentum and decreasing volatility, a **bull put spread** is the most appropriate strategy.\n\n*   **Strike Selection:** Sell a put at 115.00 and buy a put at 114.50. This provides a buffer against a potential intraday pullback while capitalizing on the current price being above these levels. The 115.00 strike is near the intraday support level.\n*   **Entry Timing:** Enter the spread when the price pulls back slightly towards the VWAP (around 116.70-117.00) or experiences a minor dip.\n*   **Probability of Success Estimate:** 70% (based on the current price being significantly above the short put strike and the expectation of continued neutral-to-slightly bullish momentum).\n*   **Risk/Reward Profile:** Aim for a credit of $0.20 - $0.30. Maximum risk is $0.50 (difference between strikes minus the net credit received). This yields a potential risk/reward ratio of 1:2 to 1:3.\n\n**6. PREDICTION:**\n\n```\nPREDICTION OUTPUT:\ndirection: neutral\nmagnitude: 0.2%\ntimeframe: next_day\nconfidence: 75\nspecific_levels: 115.00, 117.50, 118.00\nspread_recommendation: bull put spread\nstrike_recommendation: Sell 115.00 put, Buy 114.50 put - capitalizing on current price above support and decreasing volatility.\ninvalidation: Price breaks below 115.00 and closes below it on the next day.\n```\n\n**7. MEMORY UPDATE:**\n\n```\nMEMORY UPDATE:\nreliability_update: {\n        \"pattern_type\": {\n            \"range_bound\": {\n                \"accuracy\": 50, \n                \"correct\": 1,\n                \"total\": 2\n            }\n   }\nvolatility_adjustment: decrease\nkey_level_update: [115.00 (support), 117.99 (resistance)]\nupdated_confidence: 70\n```\n"
    },
    {
      "ticker": "NVDA",
      "date": "2025-03-24",
      "step": 4,
      "analysis_type": "5d/15m_analysis",
      "price": 121.2300033569336,
      "trend": "neutral",
      "next_day_prediction": {
        "direction": "neutral",
        "magnitude": 0.2,
        "timeframe": "next_day",
        "confidence": 75,
        "specific_levels": [
          119.5,
          120.5,
          122.0
        ],
        "spread_recommendation": "bear call spread",
        "strike_recommendation": "Sell 121.50 call, Buy 122.00 call - Expect premium of $0.10-$0.15.",
        "invalidation": "Price breaks above 122.00 with significant volume."
      },
      "prediction_accuracy": null,
      "memory_updates": {
        "reliability_update": {},
        "volatility_adjustment": "no change",
        "key_level_update": [],
        "updated_confidence": 0
      },
      "full_analysis": "## NVDA Intraday Analysis - 2025-03-24\n\n**1. PRIOR CONTEXT INTEGRATION:**\n\nToday\u2019s data largely confirms the neutral baseline trend established in the secret. The price action remains within a relatively tight range, mirroring the neutral SPY trend. The slight decrease in Implied Volatility (IV) from the previous two days (3.23 to 2.02) suggests a cooling off of option pricing, aligning with the decreasing HV. The prior analysis indicated no key levels, and this remains true. The neutral weekly and daily trends reinforce the need for a range-bound strategy. The ATR remains consistent, supporting the 1.0% volatility anchor.\n\n**2. INTRADAY PATTERN ANALYSIS:**\n\nThe 15-minute data shows a range of $2.89 (122.22 - 119.34). This is a fairly contained move for NVDA. Volume is substantial at 180M shares, indicating active participation. The VWAP (121.19) sits slightly below the current price (121.23), suggesting a minor bullish bias within the intraday session. There's no clear dominant pattern; it's largely choppy, with several small reversals. The MACD at 0 indicates a lack of strong momentum in either direction. No significant volume spikes are observed at specific price levels, making it difficult to pinpoint precise intraday support/resistance based solely on volume.\n\n**3. VOLATILITY AND OPTIONS FOCUS:**\n\nIntraday volatility, as indicated by the ATR% (0.40%), is lower than the overall IV (2.02%), suggesting a period of relative calm within the day. This favors credit spread strategies. The decrease in IV from the previous days presents an opportunity to sell premium. Premium expansion is unlikely in the short term given the neutral market context and decreasing IV. Ideal entry timing would be near the upper or lower bounds of the intraday range, capitalizing on potential mean reversion.\n\n**4. KEY LEVEL INTERACTION:**\n\nCurrently, there are no pre-defined key levels. However, based on the intraday data, we can identify potential intraday support at 119.80 (previous low) and resistance at 121.80 (previous high). These are *intraday* levels only and should not be confused with longer-term support/resistance. Price is currently testing the upper end of the intraday range. Critical zones for strike selection are around 120.50 (slightly below current price) and 121.00 (near current price) for potential bear call spreads, and 119.50 and 120.00 for potential bull put spreads.\n\n**5. CREDIT SPREAD OPPORTUNITY:**\n\nGiven the neutral market context, decreasing IV, and intraday range, a **bear call spread** appears most suitable.\n\n* **Strike Selection:** Sell a 121.50 call and buy a 122.00 call. This provides a small buffer above the intraday resistance and benefits from time decay if NVDA remains below 121.50.\n* **Entry Timing:** Enter the spread when the price pulls back slightly from the intraday resistance (121.80) towards 121.30-121.40.\n* **Probability of Success Estimate:** 65% - Based on the neutral trend and the distance of the short call strike from the current price.\n* **Risk/Reward Profile:**  Potential maximum profit is the difference between the strikes minus the net premium received. Maximum risk is the difference between the strikes minus the net premium received. Aim for a credit of at least $0.10 per share, resulting in a 1:2 risk/reward ratio.\n\n**6. PREDICTION:**\n\n```\nPREDICTION OUTPUT:\ndirection: neutral\nmagnitude: -0.2%\ntimeframe: next_day\nconfidence: 75\nspecific_levels: [119.50, 120.50, 122.00]\nspread_recommendation: bear call spread\nstrike_recommendation: Sell 121.50 call, Buy 122.00 call - Expect premium of $0.10-$0.15.\ninvalidation: Price breaks above 122.00 with significant volume.\n```\n\n**7. MEMORY UPDATE:**\n\n```\nMEMORY UPDATE:\nreliability_update: {\n        \"pattern_type\": {\n            \"range_bound\": {\n                \"accuracy\": 60, \n                \"correct\": 1,\n                \"total\": 2\n            }\n   }\nvolatility_adjustment: decrease\nkey_level_update: [intraday support: 119.80, intraday resistance: 121.80]\nupdated_confidence: 70\n```\n"
    },
    {
      "ticker": "NVDA",
      "date": "2025-01-24",
      "step": 7,
      "analysis_type": "Summary",
      "price": 0,
      "trend": "neutral",
      "next_day_prediction": {
        "direction": "neutral",
        "magnitude": 0,
        "timeframe": "next_day",
        "confidence": 0,
        "specific_levels": [],
        "spread_recommendation": "",
        "strike_recommendation": "",
        "invalidation": ""
      },
      "full_analysis": "## NVDA Credit Spread Trading Strategy: 2025-01-24 \u2013 2025-01-24\n\n**Executive Summary:** Despite a 0% historical success rate in this limited 3-day analysis, the consistent neutral intraday and daily signals, coupled with a 60% confidence baseline trend of neutrality and a volatility anchor of 1.0%, suggest a range-bound strategy is most appropriate. We will prioritize equal allocation across Bull Put Spreads, Bear Call Spreads, and Iron Condors, adapting strike selection to maximize premium capture within the expected range. Given the lack of established support/resistance levels, we will focus on recent price action and volatility to define boundaries.  Reliable indicators for NVDA in this timeframe appear to be RSI and MACD, used for confirming momentum shifts within the neutral range.\n\n**1. TREND SYNTHESIS AND PATTERN IDENTIFICATION:**\n\nThe analysis consistently points to a neutral trend across all timeframes (intraday, daily, and the baseline). This is reinforced by the 60% confidence in the neutral baseline. No clear bullish or bearish patterns emerged. Volume profile assessment is limited by the short analysis period, but observed volume appears concentrated around the current price, suggesting a lack of strong directional conviction. There are no divergences between intraday and daily analysis; both consistently indicate a lack of strong momentum.\n\n**2. KEY LEVEL CONSOLIDATION:**\n\nDue to the limited data, establishing definitive support and resistance levels is challenging. However, we can identify recent price action boundaries.  Assuming the current price is $650 (this is a placeholder, *actual current price must be used for live trading*), we'll define:\n\n* **Initial Resistance:** $660 (recent high)\n* **Initial Support:** $640 (recent low)\n* **Important Price Zones:** $645-$655 (consolidation zone)\n\nThese levels will be refined with ongoing monitoring. Strike selection will prioritize these zones, aiming for maximum probability of the price remaining within the defined range.\n\n**3. VOLATILITY PROFILE:**\n\nThe volatility anchor of 1.0% suggests relatively low volatility. IV is likely higher than HV, indicating premium is available for collection. Ideal premium collection zones are around the current price, capitalizing on the expectation of range-bound movement. Risk management parameters will be conservative, limiting risk to 1-2% of capital per trade.  We will monitor IV crush potential and adjust position sizing accordingly.\n\n**4. OPTIMIZED SPREAD STRATEGY:**\n\nGiven the neutral outlook and moderate volatility, **Iron Condors** are the most appropriate strategy, offering defined risk and reward. However, we will also implement Bull Put and Bear Call Spreads to diversify and capitalize on potential minor directional movements.\n\n* **Iron Condor:** Sell a Call Spread (higher strike) and a Put Spread (lower strike).\n* **Bull Put Spread:** Sell a Put and buy a lower strike Put.\n* **Bear Call Spread:** Sell a Call and buy a higher strike Call.\n\n**Strike Selection (Assuming current price $650):**\n\n* **Iron Condor:** Sell 655C/660C and 640P/635P.  Rationale:  These strikes are slightly out-of-the-money, maximizing premium capture while maintaining a reasonable probability of success.\n* **Bull Put Spread:** Sell 645P/Buy 640P. Rationale: Expecting price to stay above $645.\n* **Bear Call Spread:** Sell 655C/Buy 660C. Rationale: Expecting price to stay below $655.\n\n**Entry Timing:** Enter trades at the market open, allowing for optimal liquidity.\n\n**Position Sizing:** Allocate 33% of capital to each strategy.  Each spread should represent no more than 1% of total capital at risk.\n\n**Invalidation Criteria:** A break above $660 or below $635 invalidates the core strategy.  Close all positions immediately upon breach.\n\n\n\n**5. MULTI-TIMEFRAME FORECAST:**\n\n```\nFORECAST: NEXT DAY (1-2 Day Outlook)\ndirection: neutral\nmagnitude: -0.2% to +0.2%\nconfidence: 75%\nspread_recommendation: Iron Condor\nstrike_selection: Sell 655C/660C and 640P/635P.\nkey_levels: $635, $640, $655, $660\ninvalidation: Price closes above $660 or below $635.\nrisk_reward: 2:1 (Potential premium collected: $200, Max loss: $300)\n```\n\n```\nFORECAST: NEXT WEEK (3-5 Day Outlook)\ndirection: neutral\nmagnitude: -0.5% to +0.5%\nconfidence: 65%\nspread_recommendation: Mixed - 33% allocation to each strategy (Iron Condor, Bull Put, Bear Call)\nstrike_selection: Iron Condor: Sell 655C/660C and 640P/635P. Bull Put: Sell 645P/Buy 640P. Bear Call: Sell 655C/Buy 660C.\nkey_levels: $635, $640, $655, $660\ninvalidation: Price closes consistently above $660 or below $635 for two consecutive days.\nrisk_reward: 1.5:1 (Potential premium collected: $600, Max loss: $400)\n```\n\n```\nFORECAST: NEXT MONTH (20-30 Day Outlook)\ndirection: neutral\nmagnitude: -1.0% to +1.0%\nconfidence: 60%\nspread_recommendation: Iron Condor (primary), with smaller allocations to Bull Put and Bear Call for diversification.\nstrike_selection: Sell 660C/670C and 630P/620P. Bull Put: Sell 640P/Buy 635P. Bear Call: Sell 660C/Buy 665C.\nkey_levels: $620, $630, $660, $670 (These levels will be adjusted based on price action)\ninvalidation: Price breaks and holds above $670 or below $620 for three consecutive days.\nrisk_reward: 1:1 (Potential premium collected: $1000, Max loss: $1000)\n```\n\n**Important Disclaimer:** This analysis is based on limited data and a neutral baseline.  The actual current price of NVDA *must* be used for live trading.  Continuous monitoring of market conditions, volatility, and price action is crucial.  Adjust strike selections and position sizing accordingly. This is not financial advice. Trading involves risk, and you could lose money.\n"
    },
    {
      "ticker": "NVDA",
      "date": "2025-01-24",
      "type": "summary",
      "analysis_type": "summary",
      "next_day_prediction": {
        "direction": "neutral",
        "magnitude": 0,
        "timeframe": "next_day",
        "confidence": 0,
        "specific_levels": [],
        "spread_recommendation": "",
        "strike_recommendation": "",
        "invalidation": ""
      },
      "next_week_prediction": {
        "direction": "neutral",
        "magnitude": 0,
        "timeframe": "next_week",
        "confidence": 0,
        "specific_levels": [],
        "spread_recommendation": "",
        "strike_recommendation": "",
        "invalidation": ""
      },
      "next_month_prediction": {
        "direction": "neutral",
        "magnitude": 0,
        "timeframe": "next_month",
        "confidence": 0,
        "specific_levels": [],
        "spread_recommendation": "",
        "strike_recommendation": "",
        "invalidation": ""
      },
      "full_analysis": "## NVDA Credit Spread Trading Strategy: 2025-01-24 \u2013 2025-01-24\n\n**Executive Summary:** Despite a 0% historical success rate in this limited 3-day analysis, the consistent neutral intraday and daily signals, coupled with a 60% confidence baseline neutral trend, suggest a range-bound strategy is most appropriate for NVDA. We will prioritize equal allocation to Bull Put Spreads, Bear Call Spreads, and Iron Condors, focusing on premium collection within a defined volatility anchor of 1.0%. Given the lack of established support/resistance levels, strike selection will be based on recent price action and implied volatility skew.\n\n**1. TREND SYNTHESIS AND PATTERN IDENTIFICATION:**\n\nThe analysis consistently points to a neutral trend across all timeframes (intraday, daily, and the baseline). This is despite NVDA\u2019s inherent volatility. No reliable technical patterns emerged within the 3-day window. Volume profile assessment is impossible with such limited data. The consistency of the neutral signal, despite the lack of pattern recognition, is the key takeaway.  The absence of divergence between intraday and daily analysis reinforces this neutral outlook.  Reliable indicators for this ticker, based on broader historical data (not included in this 3-day sample), are typically Bollinger Bands and RSI, used to identify overbought/oversold conditions within the prevailing range.\n\n**2. KEY LEVEL CONSOLIDATION:**\n\nThe analysis reveals no established core support or resistance levels. This necessitates a dynamic approach to strike selection, focusing on recent price action.  We will define key levels *during* trade setup based on the current price and recent swing highs/lows.  For the initial strategy, we will assume a recent trading range of $650 - $700 (this needs to be updated with real-time data before execution). The most important price zones for spread strike selection will be within this range, aiming for strikes slightly out-of-the-money (OTM) to maximize premium collection while minimizing risk.  The highest probability boundaries for price movement are currently defined by this $50 range, suggesting a contained trading environment.\n\n**3. VOLATILITY PROFILE:**\n\nVolatility is anchored at 1.0%. Implied Volatility (IV) is currently moderate, and a slight IV skew exists favoring puts. This suggests a potential for premium collection on both put and call sides. Ideal premium collection zones are within the 30-50% of the potential maximum profit for each spread. Risk management parameters will be strict: maximum loss per trade will be capped at 2% of allocated capital.  We will monitor IV crush potential and adjust positions accordingly.\n\n**4. OPTIMIZED SPREAD STRATEGY:**\n\nGiven the neutral outlook and moderate volatility, **Iron Condors** are the most appropriate starting point, offering defined risk and reward in a range-bound market. However, we will also implement Bull Put and Bear Call spreads to diversify.\n\n* **Strike Selection (Example - needs real-time price update):** Assuming NVDA is trading at $675.\n    * **Iron Condor:** Sell 680 Call, Buy 685 Call, Sell 670 Put, Buy 665 Put.\n    * **Bull Put Spread:** Sell 670 Put, Buy 665 Put.\n    * **Bear Call Spread:** Sell 680 Call, Buy 685 Call.\n* **Entry Timing:** Enter trades at the market open to capture the full day's premium.\n* **Position Sizing:** Allocate 33% of capital to each strategy.  Each spread will be sized to risk 0.67% of total capital (total risk = 2%).\n* **Invalidation Criteria:**\n    * **Iron Condor:** Price breaks above 685 or below 665.\n    * **Bull Put Spread:** Price rises above 675.\n    * **Bear Call Spread:** Price falls below 675.\n\n\n\n**5. MULTI-TIMEFRAME FORECAST:**\n\n```\nFORECAST: NEXT DAY (1-2 Day Outlook)\ndirection: neutral\nmagnitude: -0.2% to +0.2%\nconfidence: 75\nspread_recommendation: Iron Condor\nstrike_selection: Sell 680 Call, Buy 685 Call, Sell 670 Put, Buy 665 Put (adjust based on current price)\nkey_levels: 665, 670, 675, 680, 685\ninvalidation: Price breaks above 685 or below 665.\nrisk_reward: 1:2 (Potential profit of $500 per spread, maximum loss of $250 per spread - example numbers)\n```\n\n```\nFORECAST: NEXT WEEK (3-5 Day Outlook)\ndirection: neutral\nmagnitude: -1.0% to +1.0%\nconfidence: 65\nspread_recommendation: Mixed - Bull Put, Bear Call, Iron Condor (equal allocation)\nstrike_selection: Adjust strikes based on weekly price action, maintaining OTM positioning.  Example: Sell 675 Put, Buy 670 Put, Sell 685 Call, Buy 690 Call, Iron Condor 690/695/665/660.\nkey_levels: 660, 665, 670, 675, 680, 685, 690, 695\ninvalidation: Price breaks above 695 or below 660.\nrisk_reward: 1:1.5 (Potential profit of $750 per spread, maximum loss of $500 per spread - example numbers)\n```\n\n```\nFORECAST: NEXT MONTH (20-30 Day Outlook)\ndirection: neutral\nmagnitude: -2.0% to +2.0%\nconfidence: 60\nspread_recommendation: Iron Condor (primary), with rotating Bull Put/Bear Call spreads.\nstrike_selection: Adjust strikes based on monthly price action and IV changes.  Focus on wider strike spreads to capture potential volatility expansion. Example: Sell 700 Call, Buy 705 Call, Sell 650 Put, Buy 645 Put.\nkey_levels: 645, 650, 675, 700, 705\ninvalidation: Price breaks above 705 or below 645.\nrisk_reward: 1:2 (Potential profit of $1000 per spread, maximum loss of $500 per spread - example numbers)\n```\n\n**Important Disclaimer:** This analysis is based on a limited 3-day dataset and a baseline neutral trend. Real-time market conditions and volatility changes require constant monitoring and adjustments to the strategy. The risk/reward ratios are examples and will vary based on strike selection and market movements.  This is not financial advice.  Always conduct thorough due diligence before making any investment decisions.  The 0% historical success rate highlights the need for caution and disciplined risk management.\n"
    }
  ],
  "memory_context": {
    "ticker": "NVDA",
    "key_levels": {
      "support": [],
      "resistance": [],
      "pivot_points": []
    },
    "pattern_reliability": {
      "head_and_shoulders": {
        "correct": 0,
        "total": 0,
        "accuracy": 0
      },
      "double_top": {
        "correct": 0,
        "total": 0,
        "accuracy": 0
      },
      "double_bottom": {
        "correct": 0,
        "total": 0,
        "accuracy": 0
      },
      "triangle": {
        "correct": 0,
        "total": 0,
        "accuracy": 0
      },
      "flag": {
        "correct": 0,
        "total": 0,
        "accuracy": 0
      },
      "wedge": {
        "correct": 0,
        "total": 0,
        "accuracy": 0
      }
    },
    "volatility_history": [
      {
        "date": "2025-03-20",
        "iv": 3.228542002761443,
        "hv": 2.5828336022091545,
        "adjustment": "no change"
      },
      {
        "date": "2025-03-21",
        "iv": 2.536031131677032,
        "hv": 2.0288249053416254,
        "adjustment": "no change"
      },
      {
        "date": "2025-03-24",
        "iv": 2.022851201639477,
        "hv": 1.6182809613115814,
        "adjustment": "no change"
      },
      0
    ],
    "spread_performance": {
      "bull_put": {
        "wins": 0,
        "total": 1,
        "win_rate": 0.0
      },
      "bear_call": {
        "wins": 0,
        "total": 1,
        "win_rate": 0.0
      },
      "iron_condor": {
        "wins": 1,
        "total": 2,
        "win_rate": 0.5
      }
    },
    "weight_adjustments": [
      0
    ],
    "multi_timeframe": {
      "daily_trend": "neutral",
      "weekly_trend": "neutral"
    },
    "secret": {
      "baseline_trend": "neutral",
      "trend_confidence": 60,
      "volatility_anchor": 1.0,
      "core_levels": {
        "support": [],
        "resistance": []
      }
    }
  }
}