{
  "ticker": "VGLT",
  "start_date": "2025-01-24",
  "end_date": "2025-01-24",
  "processing_time": 145.8651020526886,
  "analyses_count": 5,
  "accuracy_rate": 0,
  "total_predictions": 0,
  "correct_predictions": 0,
  "results": [
    {
      "ticker": "VGLT",
      "date": "2025-03-20",
      "step": 2,
      "analysis_type": "5d/15m_analysis",
      "price": 57.720001220703125,
      "trend": "neutral",
      "next_day_prediction": {
        "direction": "neutral",
        "magnitude": 0.2,
        "timeframe": "next_day",
        "confidence": 70,
        "specific_levels": [
          57.5,
          57.75,
          58.0,
          58.25
        ],
        "spread_recommendation": "bull put spread",
        "strike_recommendation": "Short Put at 57.50, Long Put at 57.00 - Expecting price to stay above 57.50.",
        "invalidation": "Price breaks below 57.50 and sustains momentum downwards."
      },
      "prediction_accuracy": null,
      "memory_updates": {
        "reliability_update": {},
        "volatility_adjustment": "no change",
        "key_level_update": [],
        "updated_confidence": 0
      },
      "full_analysis": "## VGLT Intraday Analysis - 2025-03-20 (15-Minute Data)\n\n**1. PRIOR CONTEXT INTEGRATION:**\n\nThe baseline trend remains neutral (60% confidence) as per the secret. The 30-day ATR anchor at 1.0% provides a stable volatility reference. Today\u2019s data doesn\u2019t contradict this. The neutral SPY trend and market score of 50 reinforce the overall neutral outlook. The lack of historical data in memory (volatility history, pattern reliability, spread performance) necessitates a conservative approach, relying heavily on the secret and current intraday data. No key levels were previously identified, so we are starting from a clean slate. The current implied volatility (0.536) is below historical volatility (0.429), suggesting potential for IV expansion, but this needs further confirmation.\n\n**2. INTRADAY PATTERN ANALYSIS:**\n\nThe 15-minute data shows a range of 57.64 to 58.26, a relatively tight range given the 26 bars. The RSI at 30.13 suggests the instrument is approaching oversold territory, potentially indicating a short-term bounce. The MACD at 0 indicates no strong momentum. Volume (1793805) is moderate. The VWAP at 57.866 is slightly above the current price (57.72), suggesting short-term bearish pressure. There's no clear, dominant pattern forming yet. It appears to be consolidating within a narrow range. No significant transactions are immediately apparent from the provided data.\n\n**3. VOLATILITY AND OPTIONS FOCUS:**\n\nThe intraday ATR of 0.0619 (0.1072%) is lower than the 30-day ATR of 1.0%. This suggests a period of reduced volatility *within* the broader context of the 30-day ATR. The discrepancy between implied and historical volatility suggests potential for IV expansion if a catalyst emerges. Credit spreads benefit from stable or expanding IV. Given the current IV levels, pricing is relatively cheap. An ideal entry timing would be a slight dip towards the lower end of the intraday range (around 57.65-57.70) coinciding with a potential IV increase. We are looking for a small IV pop to enhance premium.\n\n**4. KEY LEVEL INTERACTION:**\n\nCurrently, there are no pre-defined key levels. Based on the intraday data, we can identify potential intraday support at 57.64 (the low) and resistance at 58.26 (the high). These are *intraday* levels and should not be confused with longer-term key levels. A break above 58.26 could signal a short-term bullish move, while a break below 57.64 could signal a short-term bearish move. Critical zones for strike selection are around 57.50 (slightly below the intraday low) and 58.50 (slightly above the intraday high).\n\n**5. CREDIT SPREAD OPPORTUNITY:**\n\nGiven the neutral baseline, RSI approaching oversold, and potential for IV expansion, a **bull put spread** appears most suitable.\n\n* **Strike Selection:**\n    * **Short Put:** 57.50 \u2013 Slightly below the intraday low and a potential support level.\n    * **Long Put:** 57.00 \u2013 Provides a buffer and defines the maximum loss.\n* **Entry Timing:** Enter the spread if the price dips towards 57.65-57.70, ideally with a slight increase in implied volatility.\n* **Probability of Success Estimate:** 65% - Based on the expectation of a short-term bounce from oversold conditions.\n* **Risk/Reward Profile:**  The maximum profit is the difference between the strikes minus the net premium paid. The maximum loss is the difference between the strikes minus the net premium received. Aim for a risk/reward ratio of at least 1:2.\n\n**6. PREDICTION:**\n\n```\nPREDICTION OUTPUT:\ndirection: neutral\nmagnitude: 0.2%\ntimeframe: next_day\nconfidence: 70\nspecific_levels: [57.50, 57.75, 58.00, 58.25]\nspread_recommendation: bull put spread\nstrike_recommendation: Short Put at 57.50, Long Put at 57.00 - Expecting price to stay above 57.50.\ninvalidation: Price breaks below 57.50 and sustains momentum downwards.\n```\n\n**7. MEMORY UPDATE:**\n\n```\nMEMORY UPDATE:\nreliability_update: {\n        \"RSI_oversold_bounce\": {\n            \"accuracy\": [0], \n            \"correct\": [0],\n            \"total\": [1]\n        }\n   }\nvolatility_adjustment: no change\nkey_level_update: [intraday support: 57.64, intraday resistance: 58.26]\nupdated_confidence: 75\n```\n"
    },
    {
      "ticker": "VGLT",
      "date": "2025-03-21",
      "step": 3,
      "analysis_type": "5d/15m_analysis",
      "price": 57.439998626708984,
      "trend": "neutral",
      "next_day_prediction": {
        "direction": "neutral",
        "magnitude": 0.2,
        "timeframe": "next_day",
        "confidence": 75,
        "specific_levels": [
          57.0,
          57.4,
          57.6,
          57.8
        ],
        "spread_recommendation": "bull put spread",
        "strike_recommendation": "Sell 57.00 put, Buy 56.50 put - Expect premium capture of $0.10-$0.15.",
        "invalidation": "A break below 57.00 with significant volume would invalidate this prediction."
      },
      "prediction_accuracy": null,
      "memory_updates": {
        "reliability_update": {},
        "volatility_adjustment": "no change",
        "key_level_update": [],
        "updated_confidence": 0
      },
      "full_analysis": "## VGLT Intraday Analysis - 2025-03-21\n\n**1. PRIOR CONTEXT INTEGRATION:**\n\nToday\u2019s data largely confirms the neutral baseline trend established in the secret. The slight decrease in Implied Volatility (IV) from 0.5363 to 0.4605 suggests a cooling off from yesterday\u2019s volatility, aligning with the expectation of a relatively stable market. The neutral SPY trend further reinforces this outlook. No key levels were previously identified, so there\u2019s no contradiction there. The intraday range (57.3999 - 57.8349) is relatively narrow, supporting the neutral assessment.\n\n**2. INTRADAY PATTERN ANALYSIS:**\n\nThe 15-minute chart shows a period of consolidation within a tight range. The RSI at 32.35 suggests the instrument is approaching oversold territory, but the MACD at 0 indicates no strong momentum in either direction. Volume (1550559) is moderate, not indicating a strong directional move. The VWAP (57.5399) is near the current price (57.4399), suggesting fair value for the intraday session. There's a slight tendency for price to bounce off the 57.40 level, potentially forming a micro-support. No clear chart patterns (e.g., head and shoulders, triangles) are discernible with only 26 bars.\n\n**3. VOLATILITY AND OPTIONS FOCUS:**\n\nIntraday volatility, as measured by the ATR% (0.0921), is slightly lower than the 30-day ATR (1.0%), indicating a decrease in volatility compared to the recent past. This suggests that option premiums are likely to be relatively cheap. This favors credit spread strategies. The IV/HV ratio (0.4605/0.3684 = 1.25) indicates IV is slightly elevated compared to historical volatility, offering a small premium for selling options. Ideal entry timing would be near the VWAP or after a slight bounce from the potential micro-support at 57.40, capitalizing on premium contraction.\n\n**4. KEY LEVEL INTERACTION:**\n\nCurrently, there are no established key levels. However, the intraday low of 57.3999 and high of 57.8349 are acting as immediate support and resistance, respectively. The price is currently hovering around the VWAP, which could act as a magnet. A break below 57.40 could signal a move towards 57.30, while a break above 57.60 could target 57.70. These levels are crucial for strike selection.\n\n**5. CREDIT SPREAD OPPORTUNITY:**\n\nGiven the neutral market context, moderate volume, and slightly elevated IV, a **bull put spread** appears to be the most suitable strategy. The RSI approaching oversold territory supports this.\n\n* **Strike Selection:** Sell a put at 57.00 and buy a put at 56.50. This provides a buffer against a potential downside move while capitalizing on the current IV. The 57.00 strike is chosen as it's below the intraday low and offers a reasonable premium, while 56.50 provides a safety net.\n* **Entry Timing:** Enter the spread after a slight bounce from the 57.40 level, ideally near the VWAP (57.54).\n* **Probability of Success Estimate:** 70% (based on the neutral market outlook and the chosen strike prices).\n* **Risk/Reward Profile:** Risk is limited to the difference between the strikes ($0.50) minus the net premium received. Reward is the net premium received. Aim for a premium capture of at least $0.10 - $0.15.\n\n**6. PREDICTION:**\n\n```\nPREDICTION OUTPUT:\ndirection: neutral\nmagnitude: 0.2%\ntimeframe: next_day\nconfidence: 75\nspecific_levels: [57.00, 57.40, 57.60, 57.80]\nspread_recommendation: bull put spread\nstrike_recommendation: Sell 57.00 put, Buy 56.50 put - Expect premium capture of $0.10-$0.15.\ninvalidation: A break below 57.00 with significant volume would invalidate this prediction.\n```\n\n**7. MEMORY UPDATE:**\n\n```\nMEMORY UPDATE:\nreliability_update: {\n        \"bull_put\": {\n            \"accuracy\": 0.0, \n            \"correct\": 0,\n            \"total\": 1\n        }\n   }\nvolatility_adjustment: no change\nkey_level_update: [57.40 (potential micro-support), 57.60 (potential resistance)]\nupdated_confidence: 75\n```\n"
    },
    {
      "ticker": "VGLT",
      "date": "2025-03-24",
      "step": 4,
      "analysis_type": "5d/15m_analysis",
      "price": 56.845001220703125,
      "trend": "neutral",
      "next_day_prediction": {
        "direction": "neutral",
        "magnitude": 0.2,
        "timeframe": "next_day",
        "confidence": 70,
        "specific_levels": [
          56.75,
          56.83,
          57.15
        ],
        "spread_recommendation": "bull put spread",
        "strike_recommendation": "Short Put at 56.75, Long Put at 56.50 - capitalizing on time decay and a potential slight bounce.",
        "invalidation": "A break below 56.83 with significant volume would invalidate this prediction."
      },
      "prediction_accuracy": null,
      "memory_updates": {
        "reliability_update": {},
        "volatility_adjustment": "no change",
        "key_level_update": [],
        "updated_confidence": 0
      },
      "full_analysis": "## VGLT Intraday Analysis - 2025-03-24\n\n**1. PRIOR CONTEXT INTEGRATION:**\n\nToday\u2019s data largely confirms the neutral baseline trend established in the secret. The SPY is also neutral, reinforcing this view. Implied Volatility (IV) continues to decline from 0.5363 on March 20th to 0.4569 today, indicating decreasing market expectation of large price movements. Historical Volatility (HV) remains lower than IV, suggesting IV is still elevated but compressing. The lack of identified key levels remains consistent with the neutral outlook. The consistent neutral trend across multiple timeframes (daily, weekly) and instruments (VGLT, SPY) strengthens the validity of the initial assessment.\n\n**2. INTRADAY PATTERN ANALYSIS:**\n\nThe 15-minute data shows a narrow trading range (56.83 - 57.15), indicating consolidation. Volume (1846517) is moderate, not suggesting a strong directional move. The VWAP (56.93) is slightly above the current price (56.845), suggesting a slight bearish intraday bias, but it's not significant. The RSI at 30.49 is approaching oversold territory, potentially signaling a short-term bounce. The MACD at 0 indicates no strong momentum. There's no clear pattern formation (e.g., head and shoulders, triangles) within the 26 bars. The intraday low is very close to the current price, suggesting potential for a test of that level.\n\n**3. VOLATILITY AND OPTIONS FOCUS:**\n\nIntraday volatility, as measured by the ATR% (0.0914%), is relatively low, but still above the 30-day ATR of 1.0%. The decreasing IV suggests a potential opportunity to sell premium. However, the low intraday volatility limits the potential profit. Premium expansion is unlikely given the current environment, but a slight contraction is possible if the price remains range-bound. The best entry timing would be near the intraday high (57.15) or a bounce from the intraday low (56.83) to capitalize on potential premium decay.\n\n**4. KEY LEVEL INTERACTION:**\n\nCurrently, there are no established key levels. The intraday high (57.15) and low (56.83) are acting as temporary resistance and support, respectively. A break above 57.15 could signal a short-term bullish move, while a break below 56.83 could indicate further downside. These levels are critical for strike selection. Given the narrow range, any move beyond these levels will be significant.\n\n**5. CREDIT SPREAD OPPORTUNITY:**\n\nGiven the neutral outlook, low volatility, and RSI approaching oversold territory, a **bull put spread** is the most appropriate strategy. The goal is to profit from time decay and a slight bounce in price.\n\n*   **Strike Selection:**\n    *   **Short Put:** 56.75 (slightly below the intraday low, offering a small buffer)\n    *   **Long Put:** 56.50 (provides a margin of safety and limits maximum loss)\n*   **Entry Timing:** Enter the spread when the price bounces slightly from the intraday low (56.83) or tests the 56.75 level.\n*   **Probability of Success:** 65% (based on the expectation of a slight bounce and time decay)\n*   **Risk/Reward Profile:** 1:2 (potential profit is twice the maximum risk) \u2013 This is conservative given the low volatility.\n\n**6. PREDICTION:**\n\n```\nPREDICTION OUTPUT:\ndirection: neutral\nmagnitude: 0.2%\ntimeframe: next_day\nconfidence: 70\nspecific_levels: [56.75, 56.83, 57.15]\nspread_recommendation: bull put spread\nstrike_recommendation: Short Put at 56.75, Long Put at 56.50 - capitalizing on time decay and a potential slight bounce.\ninvalidation: A break below 56.83 with significant volume would invalidate this prediction.\n```\n\n**7. MEMORY UPDATE:**\n\n```\nMEMORY UPDATE:\nreliability_update: {\n        \"pattern_type\": {\n            \"accuracy\": 60, \n            \"correct\": 0,\n            \"total\": 2\n        }\n   }\nvolatility_adjustment: decrease\nkey_level_update: [56.83 (intraday support), 57.15 (intraday resistance)]\nupdated_confidence: 75\n```\n"
    },
    {
      "ticker": "VGLT",
      "date": "2025-01-24",
      "step": 7,
      "analysis_type": "Summary",
      "price": 0,
      "trend": "neutral",
      "next_day_prediction": {
        "direction": "neutral",
        "magnitude": 0,
        "timeframe": "next_day",
        "confidence": 0,
        "specific_levels": [],
        "spread_recommendation": "",
        "strike_recommendation": "",
        "invalidation": ""
      },
      "full_analysis": "## VGLT Credit Spread Trading Strategy: 2025-01-24 - 2025-01-24 (3-Day Analysis)\n\n**Executive Summary:** Despite a 0% historical success rate with tested strategies over the past three days, the consistent neutral intraday analysis, coupled with a 60% confidence baseline neutral trend, suggests a range-bound trading environment for VGLT. Given the low volatility anchor of 1.0%, the strategy will focus on premium collection through Iron Condors, prioritizing high probability boundaries and tight risk management. The lack of defined support/resistance levels necessitates a conservative approach, focusing on recent price action and implied volatility.\n\n**1. TREND SYNTHESIS AND PATTERN IDENTIFICATION:**\n\n* **Consensus Direction:**  Strong consensus across all timeframes (intraday, daily, baseline) points to a neutral trend.\n* **Reliable Technical Patterns:**  Due to the limited data, no reliable patterns have emerged.  Price action has been largely sideways.  Monitoring for potential symmetrical triangles or range breakouts is recommended.\n* **Divergences:** No significant divergences between intraday and daily analysis. Both consistently indicate neutrality.\n* **Volume Profile Assessment:** Insufficient data to perform a meaningful volume profile assessment.  Future analysis should incorporate volume at price levels to identify potential support/resistance.\n\n**2. KEY LEVEL CONSOLIDATION:**\n\n* **Critical Levels:** The secret baseline provides no core support or resistance levels.  Analysis of the three days shows a narrow trading range.  We will define dynamic levels based on recent price action.\n* **Price Action Behavior:** Price has oscillated within a tight range, indicating a lack of strong directional conviction.\n* **Important Price Zones:**  The high and low of the three-day period (assume for example: High = $23.50, Low = $23.00) will serve as initial boundaries for spread strike selection.\n* **Probability Boundaries:**  Given the neutral trend, the highest probability is for continued sideways movement within the defined range.\n\n**3. VOLATILITY PROFILE:**\n\n* **Volatility Behavior:** The 1.0% volatility anchor suggests low implied volatility.  This favors premium selling strategies.\n* **IV vs HV:**  Without historical volatility data, a direct comparison is impossible.  However, the low anchor suggests IV is relatively low.\n* **Premium Collection Zones:**  Focus on collecting premium from options slightly out-of-the-money, capitalizing on the expectation of limited price movement.\n* **Risk Management:**  Tight stop-loss orders are crucial due to the potential for rapid price movement if the neutral expectation is incorrect. Position sizing will be conservative (1-2% of capital per trade).\n\n**4. OPTIMIZED SPREAD STRATEGY:**\n\n* **Appropriate Spread Type:** **Iron Condor**.  This strategy benefits from low volatility and a neutral outlook, maximizing premium collection while limiting risk.\n* **Strike Selection (Example - based on assumed High = $23.50, Low = $23.00, current price = $23.25):**\n    * **Sell 23.50 Call:**  Slightly out-of-the-money, capitalizing on limited upside potential.\n    * **Buy 23.75 Call:**  Protects against a significant bullish move.\n    * **Sell 23.00 Put:**  Slightly out-of-the-money, capitalizing on limited downside potential.\n    * **Buy 22.75 Put:**  Protects against a significant bearish move.\n* **Entry Timing:** Enter the trade when the premium collected is at least 0.10 per share (total premium of $100 for a 10-contract spread).\n* **Position Sizing:** 1 contract (representing 100 shares) to start, scaling up to a maximum of 2 contracts if the trade performs as expected.\n* **Invalidation Criteria:**  Price breaking above $23.75 or below $22.75.  This indicates a breakdown of the neutral expectation and requires immediate exit.\n\n**5. MULTI-TIMEFRAME FORECAST:**\n\n```\nFORECAST: NEXT DAY (1-2 Day Outlook)\ndirection: neutral\nmagnitude: 0.0% - 0.5%\nconfidence: 70%\nspread_recommendation: Iron Condor\nstrike_selection: Sell 23.50 Call, Buy 23.75 Call, Sell 23.00 Put, Buy 22.75 Put (adjust based on current price)\nkey_levels: $23.75 (resistance), $22.75 (support)\ninvalidation: Price above $23.75 or below $22.75\nrisk_reward: 1:2 (Potential profit of $100 vs. maximum loss of $50)\n```\n\n```\nFORECAST: NEXT WEEK (3-5 Day Outlook)\ndirection: neutral\nmagnitude: -0.5% - +0.5%\nconfidence: 60%\nspread_recommendation: Iron Condor\nstrike_selection: Sell 23.60 Call, Buy 23.85 Call, Sell 22.90 Put, Buy 22.65 Put (adjust based on current price) - widen strikes slightly to account for potential range expansion.\nkey_levels: $23.85 (resistance), $22.65 (support)\ninvalidation: Price above $23.85 or below $22.65\nrisk_reward: 1:2.5 (Potential profit of $125 vs. maximum loss of $50)\n```\n\n```\nFORECAST: NEXT MONTH (20-30 Day Outlook)\ndirection: neutral\nmagnitude: -1.0% - +1.0%\nconfidence: 60%\nspread_recommendation: Iron Condor\nstrike_selection: Sell 23.80 Call, Buy 24.05 Call, Sell 22.80 Put, Buy 22.55 Put (adjust based on current price) - further widen strikes to account for potential range expansion.\nkey_levels: $24.05 (resistance), $22.55 (support)\ninvalidation: Price above $24.05 or below $22.55\nrisk_reward: 1:3 (Potential profit of $150 vs. maximum loss of $50)\n```\n\n**Technical Indicators:**  Given the limited data, no indicators have proven reliable.  Future analysis should prioritize monitoring Moving Averages (20-day, 50-day) and RSI to identify potential trend shifts.\n\n**Important Disclaimer:** This strategy is based on limited historical data and a neutral baseline.  Market conditions can change rapidly.  Continuous monitoring and adjustment of the strategy are essential.  The risk/reward ratios are estimates and may vary depending on actual trade execution and market movements.  This is not financial advice.\n"
    },
    {
      "ticker": "VGLT",
      "date": "2025-01-24",
      "type": "summary",
      "analysis_type": "summary",
      "next_day_prediction": {
        "direction": "neutral",
        "magnitude": 0,
        "timeframe": "next_day",
        "confidence": 0,
        "specific_levels": [],
        "spread_recommendation": "",
        "strike_recommendation": "",
        "invalidation": ""
      },
      "next_week_prediction": {
        "direction": "neutral",
        "magnitude": 0,
        "timeframe": "next_week",
        "confidence": 0,
        "specific_levels": [],
        "spread_recommendation": "",
        "strike_recommendation": "",
        "invalidation": ""
      },
      "next_month_prediction": {
        "direction": "neutral",
        "magnitude": 0,
        "timeframe": "next_month",
        "confidence": 0,
        "specific_levels": [],
        "spread_recommendation": "",
        "strike_recommendation": "",
        "invalidation": ""
      },
      "full_analysis": "## VGLT Credit Spread Trading Strategy: 2025-01-24 - 2025-01-24 (3-Day Analysis)\n\n**Executive Summary:** Despite a 0% historical success rate with tested strategies, the consistent neutral intraday analysis, coupled with a 60% confidence baseline neutral trend, dictates a conservative, premium-selling strategy focused on defined-risk plays. Given the volatility anchor of 1.0%, we will prioritize Iron Condors, but with extremely tight strike selection and vigilant monitoring. The lack of identified support/resistance levels necessitates a focus on current price action and implied volatility. No reliable technical indicators were identified due to the limited data.\n\n**1. TREND SYNTHESIS AND PATTERN IDENTIFICATION:**\n\nThe analysis consistently points to a neutral trend across all intraday periods (70%, 75%, 70% confidence). This aligns with the 60% confidence baseline neutral trend. No discernible technical patterns emerged within the 3-day window. Volume profile assessment is impossible with only 3 days of data. The consistent neutrality suggests a range-bound market, ideal for premium collection strategies. Divergences are non-existent given the consistent neutral signals.\n\n**2. KEY LEVEL CONSOLIDATION:**\n\nThe analysis *failed to identify* any core support or resistance levels. This is a critical limitation. Therefore, strike selection will be based on current price action and implied volatility, rather than established levels. The most important price zone is the current trading range established over the 3-day period.  We will define boundaries based on the highest and lowest prices observed during this period.\n\n**3. VOLATILITY PROFILE:**\n\nThe volatility anchor is 1.0%, suggesting relatively low volatility.  We assume IV is currently near historical averages.  The goal is to collect premium in a range-bound market, capitalizing on time decay. Ideal premium collection zones are those where IV Rank is in the 40-60 percentile. Risk management will focus on minimizing delta exposure and maintaining a low breakeven point.  Position sizing will be conservative (1-2 contracts initially) due to the lack of defined levels and historical performance.\n\n**4. OPTIMIZED SPREAD STRATEGY:**\n\nGiven the neutral trend and low volatility, **Iron Condors** are the most appropriate strategy.  Bull Put Spreads and Bear Call Spreads have demonstrated a 0% win rate.  The strategy will focus on selling premiums with strikes positioned outside the recent 3-day trading range.\n\n* **Strike Selection:**  Based on the 3-day range (assume for example, VGLT trades between $27.00 and $27.50), we will select strikes 0.25 above and below the range.  This means selling a 27.25 Call and a 26.75 Put.\n* **Entry Timing:** Enter the Iron Condor at the market open, aiming for a credit of at least $0.10 per share ($10 per contract).\n* **Position Sizing:** Start with 1 contract.\n* **Risk Parameters:** Maximum loss is capped at the difference between the strike prices, less the premium received.  In this example, ($27.25 - $26.75) - $0.10 = $0.40 per share ($40 per contract).\n* **Invalidation Criteria:**  A breach of either the call or put strike price will trigger a close of the position.  Alternatively, a 20% increase in implied volatility will also trigger a close.\n\n\n\n**5. MULTI-TIMEFRAME FORECAST:**\n\n```\nFORECAST: NEXT DAY (1-2 Day Outlook)\ndirection: neutral\nmagnitude: 0.0% - 0.2%\nconfidence: 70\nspread_recommendation: Iron Condor\nstrike_selection: Sell 27.25 Call, Sell 26.75 Put (Target Credit: $0.10/share)\nkey_levels: 27.00 (potential support), 27.50 (potential resistance)\ninvalidation: Breach of 27.25 or 26.75. IV increase > 10%.\nrisk_reward: 1:2 (Potential profit $0.40, Max Loss $0.10) - *This is an optimistic estimate, actual R/R will depend on premium received.*\n```\n\n```\nFORECAST: NEXT WEEK (3-5 Day Outlook)\ndirection: neutral\nmagnitude: -0.5% - +0.5%\nconfidence: 60\nspread_recommendation: Iron Condor (Adjust strikes based on price movement)\nstrike_selection:  If VGLT remains within the 27.00-27.50 range, maintain strikes. If VGLT moves above 27.50, shift the call spread higher. If VGLT moves below 27.00, shift the put spread lower.\nkey_levels: 27.00, 27.50 (Monitor for breakouts)\ninvalidation: Breach of adjusted call or put strike. IV increase > 15%.\nrisk_reward: 1:1.5 (Potential profit $0.30, Max Loss $0.20) - *Adjusted based on potential strike shifts.*\n```\n\n```\nFORECAST: NEXT MONTH (20-30 Day Outlook)\ndirection: neutral\nmagnitude: -1.0% - +1.0%\nconfidence: 60\nspread_recommendation: Iron Condor (Continue adjusting strikes based on price movement)\nstrike_selection:  Continuously adjust strikes to maintain a 2-3% buffer outside the current trading range.\nkey_levels: Monitor for the establishment of new support and resistance levels.\ninvalidation:  Significant trend change (breakout above 28.00 or breakdown below 26.50). IV increase > 20%.\nrisk_reward: 1:1 (Potential profit $0.20, Max Loss $0.20) - *Longer timeframe requires more conservative profit targets.*\n```\n\n**Important Considerations:**\n\n* **Data Limitations:** This strategy is based on a very limited 3-day dataset.  Continuous monitoring and adjustment are crucial.\n* **Lack of Defined Levels:** The absence of established support and resistance levels increases risk.\n* **Historical Performance:** The 0% win rate for tested strategies is a significant concern. This strategy is a conservative attempt to mitigate risk in a neutral environment.\n* **Implied Volatility:** Closely monitor implied volatility. A spike in IV could quickly erode profits.\n* **Dynamic Adjustment:** Be prepared to adjust strike prices and position sizing based on price action and volatility changes.\n\n\n\n**Disclaimer:** This analysis is for informational purposes only and should not be considered financial advice. Trading involves risk, and you could lose money. Always consult with a qualified financial advisor before making any investment decisions."
    }
  ],
  "memory_context": {
    "ticker": "VGLT",
    "key_levels": {
      "support": [],
      "resistance": [],
      "pivot_points": []
    },
    "pattern_reliability": {
      "head_and_shoulders": {
        "correct": 0,
        "total": 0,
        "accuracy": 0
      },
      "double_top": {
        "correct": 0,
        "total": 0,
        "accuracy": 0
      },
      "double_bottom": {
        "correct": 0,
        "total": 0,
        "accuracy": 0
      },
      "triangle": {
        "correct": 0,
        "total": 0,
        "accuracy": 0
      },
      "flag": {
        "correct": 0,
        "total": 0,
        "accuracy": 0
      },
      "wedge": {
        "correct": 0,
        "total": 0,
        "accuracy": 0
      }
    },
    "volatility_history": [
      {
        "date": "2025-03-20",
        "iv": 0.5363107791993402,
        "hv": 0.42904862335947214,
        "adjustment": "no change"
      },
      {
        "date": "2025-03-21",
        "iv": 0.46054496659357075,
        "hv": 0.3684359732748566,
        "adjustment": "no change"
      },
      {
        "date": "2025-03-24",
        "iv": 0.45692390923702053,
        "hv": 0.3655391273896164,
        "adjustment": "no change"
      },
      0
    ],
    "spread_performance": {
      "bull_put": {
        "wins": 0,
        "total": 3,
        "win_rate": 0.0
      },
      "bear_call": {
        "wins": 0,
        "total": 0,
        "win_rate": 0
      },
      "iron_condor": {
        "wins": 1,
        "total": 1,
        "win_rate": 1.0
      }
    },
    "weight_adjustments": [
      0
    ],
    "multi_timeframe": {
      "daily_trend": "neutral",
      "weekly_trend": "neutral"
    },
    "secret": {
      "baseline_trend": "neutral",
      "trend_confidence": 60,
      "volatility_anchor": 1.0,
      "core_levels": {
        "support": [],
        "resistance": []
      }
    }
  }
}