{
  "ticker": "VGLT",
  "start_date": "2025-01-24",
  "end_date": "2025-01-24",
  "processing_time": 135.76639938354492,
  "analyses_count": 5,
  "accuracy_rate": 0,
  "total_predictions": 0,
  "correct_predictions": 0,
  "results": [
    {
      "ticker": "VGLT",
      "date": "2025-03-20",
      "step": 2,
      "analysis_type": "5d/15m_analysis",
      "price": 57.720001220703125,
      "trend": "[bullish]",
      "next_day_prediction": {
        "direction": "[bullish]",
        "magnitude": 0.5,
        "timeframe": "[next_day]",
        "confidence": 75,
        "specific_levels": [
          57.5,
          57.68,
          57.95,
          58.26
        ],
        "spread_recommendation": "[bull put spread]",
        "strike_recommendation": "[Sell 57.50 Put, Buy 57.00 Put - capitalizing on oversold RSI and low volatility]",
        "risk_reward_ratio": "1:0.2",
        "stop_loss": "[57.00]",
        "profit_target": "[0.05]",
        "invalidation": "[Price breaks below 57.00]",
        "is_directional": false
      },
      "prediction_accuracy": null,
      "memory_updates": {
        "reliability_update": {},
        "volatility_adjustment": "no change",
        "key_level_update": [],
        "updated_confidence": 0
      },
      "full_analysis": "## VGLT Intraday Analysis - 2025-03-20 (15-Minute Data)\n\n**1. PRIOR CONTEXT INTEGRATION:**\n\nThe secret establishes a neutral baseline trend with a volatility anchor of 0.9086%. Today\u2019s price of 57.72 is within the established support (53.69) and resistance (55.16) levels, reinforcing the initial neutral assessment. The 30-day ATR is significantly higher than the current intraday ATR (0.0619 vs 0.9086), suggesting a period of consolidation *within* a broader range. The mixed daily/weekly trends further support the neutral outlook, but the RSI of 30.13 is a warning sign. This data doesn\u2019t contradict the prior analysis but introduces a potential for short-term bearish momentum. The lack of historical data in memory necessitates a cautious approach.\n\n**2. INTRADAY PATTERN ANALYSIS:**\n\nThe 15-minute data shows a range of 57.64 to 58.26 with a vwap of 57.87. The bars_count of 26 indicates a relatively active session. The RSI of 30.13 suggests the asset is currently oversold on the 15-minute timeframe. The MACD at 0 indicates no strong momentum, but the RSI suggests a potential for a bounce. Volume (1793805) is moderate, not indicating a strong directional conviction. There's a slight tendency towards lower highs and lower lows within the 15-minute timeframe, hinting at short-term bearish pressure, but it's not definitive. No clear chart patterns (e.g., head and shoulders, triangles) are immediately apparent.\n\n**3. VOLATILITY AND OPTIONS FOCUS:**\n\nThe implied volatility (0.5363%) is lower than the historical volatility (0.4290%), indicating that options are relatively cheap compared to recent price movements. The intraday ATR (0.0619) is significantly lower than the 30-day ATR (0.9086), suggesting a period of contraction. This lower volatility environment is favorable for credit spread strategies, but the oversold RSI suggests a potential for a volatility spike if the price bounces.  Entering a credit spread now, anticipating a continued range-bound market, could be profitable. However, the potential for a short-term bounce needs to be considered.\n\n**4. KEY LEVEL INTERACTION:**\n\nPrice is currently trading above the intraday low of 57.64, but below the intraday high of 58.26. The secret's support and resistance levels (53.69 and 55.16) remain relevant as broader boundaries.  Based on the 15-minute data, we can identify a new intraday support level at approximately 57.68 and resistance at 57.95. These levels are crucial for strike selection.\n\n**5. CREDIT SPREAD OPPORTUNITY:**\n\nGiven the oversold RSI, the neutral baseline trend, and the lower volatility, a **bull put spread** appears to be the most appropriate strategy. While the RSI suggests a potential bounce, the overall trend remains neutral, making a directional strategy too risky. The lower volatility allows for favorable credit collection.\n\n*   **Strike Selection:** Sell a put option at 57.50 and buy a put option at 57.00. This provides a buffer against a further decline while capitalizing on the potential for a bounce. The 57.50 strike is slightly below the intraday support of 57.68, offering a reasonable probability of success. The 57.00 strike provides downside protection.\n*   **Entry Timing:** Enter the trade immediately, capitalizing on the current oversold condition and low volatility.\n*   **Probability of Success:** 70% (based on the oversold RSI and neutral trend).\n*   **Risk/Reward Profile:**  Assuming a credit of $0.10 per share, the maximum risk is $0.50 per share (difference between strikes), and the maximum reward is $0.10 per share. This yields a risk/reward ratio of 1:0.2. While the reward is small, the high probability of success makes it attractive.\n*   **Targets & Stops:** Profit target: 50% of the maximum credit received. Stop-loss: If the price breaks below 57.00.\n\n**6. PREDICTION:**\n\n```\nPREDICTION OUTPUT:\ndirection: [bullish]\nmagnitude: [0.5%]\ntimeframe: [next_day]\nconfidence: [75]\nspecific_levels: [57.50, 57.68, 57.95, 58.26]\nspread_recommendation: [bull put spread]\nstrike_recommendation: [Sell 57.50 Put, Buy 57.00 Put - capitalizing on oversold RSI and low volatility]\nrisk_reward_ratio: [1:0.2]\nstop_loss: [57.00]\nprofit_target: [0.05]\ninvalidation: [Price breaks below 57.00]\n```\n\n**7. MEMORY UPDATE:**\n\n```\nMEMORY UPDATE:\nreliability_update: {\n        \"bull_put_spread\": {\n            \"accuracy\": [0], \n            \"correct\": [0],\n            \"total\": [1]\n        }\n   }\nvolatility_adjustment: [no change]\nkey_level_update: [Intraday Support: 57.68, Intraday Resistance: 57.95]\nupdated_confidence: [70]\n```\n"
    },
    {
      "ticker": "VGLT",
      "date": "2025-03-21",
      "step": 3,
      "analysis_type": "5d/15m_analysis",
      "price": 57.439998626708984,
      "trend": "[neutral]",
      "next_day_prediction": {
        "direction": "[neutral]",
        "magnitude": 0.5,
        "timeframe": "[next_day]",
        "confidence": 70,
        "specific_levels": [
          57.0,
          57.5,
          57.8,
          58.0
        ],
        "spread_recommendation": "[bull put spread]",
        "strike_recommendation": "[Sell 57.00 put, Buy 56.50 put - Expecting consolidation and a slight bounce]",
        "risk_reward_ratio": "1:2.0",
        "stop_loss": "[0.25 or $0.25 per share]",
        "profit_target": "[0.75 or $0.75 per share]",
        "invalidation": "[Price breaks below 56.50]",
        "is_directional": false
      },
      "prediction_accuracy": null,
      "memory_updates": {
        "reliability_update": {},
        "volatility_adjustment": "no change",
        "key_level_update": [],
        "updated_confidence": 0
      },
      "full_analysis": "## VGLT Intraday Analysis - 2025-03-21\n\n**1. PRIOR CONTEXT INTEGRATION:**\n\nThe baseline trend remains neutral (60% confidence) as per the secret. Yesterday\u2019s IV (0.5363) was higher than today\u2019s (0.4605), suggesting a slight decrease in fear. Historical volatility (0.3684) continues to lag implied volatility, indicating a premium is priced into options. The 30-day ATR (0.9086%) provides a volatility anchor, while the current intraday ATR (0.0529%) is significantly lower, suggesting a period of consolidation. The prior analysis identified no key levels, and this remains the case. Today\u2019s data confirms the neutral outlook, but the decreasing IV and RSI approaching oversold territory (32.34) warrant a closer look for potential bullish setups.\n\n**2. INTRADAY PATTERN ANALYSIS:**\n\nThe 15-minute data shows a narrow trading range between 57.39 and 57.83, with a vwap of 57.53. Volume (1550559) is moderate. The MACD is at 0, indicating no strong momentum. This suggests a period of consolidation after a potential pullback. There are no clear chart patterns forming within the 26 bars. The intraday low is relatively close to the secret's support level (53.69 is distant, but the current range is important). The lack of strong directional movement suggests range-bound trading.\n\n**3. VOLATILITY AND OPTIONS FOCUS:**\n\nIntraday volatility, as measured by the ATR%, is 0.0921%, significantly lower than the 30-day ATR%. This suggests a contraction in volatility. This is favorable for selling options, but the decreasing IV suggests that premium expansion may be limited. Ideal entry timing for credit spreads would be near the upper end of the intraday range (around 57.75-57.80) to capitalize on potential mean reversion. A slight increase in IV could boost premium, but the overall expectation is for continued consolidation.\n\n**4. KEY LEVEL INTERACTION:**\n\nPrice is currently consolidating within a narrow range. The intraday high (57.83) acts as immediate resistance, while the intraday low (57.39) acts as immediate support. These levels are crucial for strike selection. Given the distance to the secret's support and resistance levels, these intraday levels are more relevant for short-term trading. A break above 57.83 could signal a move towards 58, while a break below 57.39 could test lower levels.\n\n**5. CREDIT SPREAD OPPORTUNITY:**\n\nConsidering the neutral baseline, decreasing IV, and consolidation pattern, a **bull put spread** is the most appropriate strategy. While the MACD is at 0, the RSI is approaching oversold territory, suggesting a potential bounce. A directional strategy like a long call is too risky given the neutral outlook.\n\n*   **Strike Selection:** Sell a put at 57.00 and buy a put at 56.50. This provides a buffer against a potential downside move while capitalizing on the expectation of price consolidation or a slight increase. The 57.00 strike is slightly below the intraday low, offering a reasonable premium. The 56.50 strike provides a safety net.\n*   **Entry Timing:** Enter the spread when the price is near the upper end of the intraday range (57.75-57.80).\n*   **Probability of Success:** 65% (based on historical performance of bull put spreads in similar conditions).\n*   **Risk/Reward Profile:** 1:2.  Maximum risk is $0.50 per share ($50 per contract). Potential maximum profit is $1.00 per share ($100 per contract).\n*   **Targets & Stops:** Profit target: $0.75 per share. Stop-loss: $0.25 per share (50% of maximum risk).\n\n**6. PREDICTION:**\n\n```\nPREDICTION OUTPUT:\ndirection: [neutral]\nmagnitude: [0.5%]\ntimeframe: [next_day]\nconfidence: [70]\nspecific_levels: [57.00, 57.50, 57.80, 58.00]\nspread_recommendation: [bull put spread]\nstrike_recommendation: [Sell 57.00 put, Buy 56.50 put - Expecting consolidation and a slight bounce]\nrisk_reward_ratio: [1:2]\nstop_loss: [0.25 or $0.25 per share]\nprofit_target: [0.75 or $0.75 per share]\ninvalidation: [Price breaks below 56.50]\n```\n\n**7. MEMORY UPDATE:**\n\n```\nMEMORY UPDATE:\nreliability_update: {\n        \"pattern_type\": {\n            \"consolidation\": {\n                \"accuracy\": [60], \n                \"correct\": [1],\n                \"total\": [2]\n            }\n   }\nvolatility_adjustment: [decrease]\nkey_level_update: [Intraday Support: 57.39, Intraday Resistance: 57.83]\nupdated_confidence: [75]\n```\n"
    },
    {
      "ticker": "VGLT",
      "date": "2025-03-24",
      "step": 4,
      "analysis_type": "5d/15m_analysis",
      "price": 56.845001220703125,
      "trend": "[bearish]",
      "next_day_prediction": {
        "direction": "[bearish]",
        "magnitude": 0.5,
        "timeframe": "[next_day]",
        "confidence": 70,
        "specific_levels": [
          56.7,
          56.9,
          57.0,
          57.2
        ],
        "spread_recommendation": "[bear call spread]",
        "strike_recommendation": "[Sell 57.00 Call, Buy 57.50 Call - limited upside risk, potential for premium capture]",
        "risk_reward_ratio": "1:2.5",
        "stop_loss": "[57.20]",
        "profit_target": "[50% of maximum profit]",
        "invalidation": "[Price closes above 57.20 on the 15-minute chart]",
        "is_directional": false
      },
      "prediction_accuracy": null,
      "memory_updates": {
        "reliability_update": {},
        "volatility_adjustment": "no change",
        "key_level_update": [],
        "updated_confidence": 0
      },
      "full_analysis": "## VGLT Intraday Analysis - 2025-03-24\n\n**1. PRIOR CONTEXT INTEGRATION:**\n\nThe baseline trend remains neutral (60% confidence) as per the secret. However, the critical trend instruction necessitates a re-evaluation. While the daily and weekly trends are neutral, the RSI at 30.49 is edging towards oversold territory. The MACD is precisely at 0, indicating a lack of strong momentum but not necessarily a neutral stance. The slight decrease in IV from 0.5363 to 0.4605 over the past few trading days suggests decreasing fear, but HV remains lower, indicating a potential for IV expansion if a directional move occurs. The 30-day ATR of 0.9086 provides a volatility anchor. The prior analysis indicated poor performance for bull put spreads, reinforcing the need to explore alternative strategies. Key levels remain at Support=[53.69], Resistance=[55.16]. These levels haven't been challenged significantly recently, maintaining their relevance.\n\n**2. INTRADAY PATTERN ANALYSIS:**\n\nThe 15-minute data shows a narrow trading range today, with a high of 57.15 and a low of 56.83. This consolidation suggests indecision. Volume (1846517) is moderate, not indicating a strong breakout or breakdown. The VWAP at 56.93 is slightly below the current price of 56.845, suggesting short-term selling pressure. There's no clear chart pattern forming (e.g., head and shoulders, triangles). The intraday low is testing the lower end of the recent consolidation range. Momentum is weak, as evidenced by the MACD at 0 and RSI near 30. There's a slight downward bias in the intraday price action.\n\n**3. VOLATILITY AND OPTIONS FOCUS:**\n\nIntraday volatility, as measured by the ATR% (0.0914%), is lower than the 30-day ATR (0.9086%), indicating a period of relative calm. However, the RSI approaching 30 suggests a potential for a volatility spike if the price breaks below the intraday low. Credit spreads are generally more attractive in higher volatility environments, but the current IV (0.4569) is not excessively low. A potential for IV expansion exists, which would benefit option sellers. Ideal entry timing would be after a confirmed breakout or breakdown from the current consolidation range, capitalizing on the anticipated volatility increase.\n\n**4. KEY LEVEL INTERACTION:**\n\nThe price is currently trading slightly above the intraday low of 56.83, which is acting as a minor support level. The current price is significantly below the resistance level of 55.16 and the secret resistance of 55.16. No new key levels have been identified within the 15-minute timeframe. The distance between the current price and the secret support of 53.69 is substantial, suggesting limited immediate downside risk.\n\n**5. CREDIT SPREAD OPPORTUNITY:**\n\nGiven the slightly bearish intraday momentum, the RSI nearing oversold territory, and the potential for IV expansion, a **bear call spread** appears to be the most appropriate strategy. While the secret baseline is neutral, the indicators suggest a slight bearish bias. This strategy benefits from a stagnant or slightly declining price.\n\n*   **Strike Selection:** Sell a call option with a strike price of 57.00 and buy a call option with a strike price of 57.50. This provides a small buffer against immediate upside risk while capitalizing on the potential for the price to remain below 57.00.\n*   **Entry Timing:** Enter the trade after a confirmed close below 56.90 on the 15-minute chart, confirming the short-term downward momentum.\n*   **Probability of Success Estimate:** 65% - Based on the current market conditions and the chosen strike prices.\n*   **Risk/Reward Profile:** 1:2.5 - The maximum loss is the difference between the strike prices minus the net premium received. The maximum profit is the net premium received.\n*   **Targets and Stops:**\n    *   Profit Target: 50% of maximum profit.\n    *   Stop Loss: If the price closes above 57.20 on the 15-minute chart.\n\n**6. PREDICTION:**\n\n```\nPREDICTION OUTPUT:\ndirection: [bearish]\nmagnitude: [0.5%]\ntimeframe: [next_day]\nconfidence: [70]\nspecific_levels: [56.70, 56.90, 57.00, 57.20]\nspread_recommendation: [bear call spread]\nstrike_recommendation: [Sell 57.00 Call, Buy 57.50 Call - limited upside risk, potential for premium capture]\nrisk_reward_ratio: [1:2.5]\nstop_loss: [57.20]\nprofit_target: [50% of maximum profit]\ninvalidation: [Price closes above 57.20 on the 15-minute chart]\n```\n\n**7. MEMORY UPDATE:**\n\n```\nMEMORY UPDATE:\nreliability_update: {\n        \"bear_call\": {\n            \"accuracy\": [0], \n            \"correct\": [0],\n            \"total\": [0]\n        }\n   }\nvolatility_adjustment: [no change]\nkey_level_update: [56.90 - intraday support/resistance]\nupdated_confidence: [75]\n```\n"
    },
    {
      "ticker": "VGLT",
      "date": "2025-01-24",
      "step": 7,
      "analysis_type": "Summary",
      "price": 0,
      "trend": "neutral",
      "next_day_prediction": {
        "direction": "neutral",
        "magnitude": 2.5,
        "timeframe": "[next_5_days]",
        "confidence": 80,
        "specific_levels": [],
        "spread_recommendation": "[iron condor]",
        "strike_recommendation": "[57.50/58.00/53.50/53.00]",
        "risk_reward_ratio": "1:2.0",
        "stop_loss": "[1.5%]",
        "profit_target": "[3%]",
        "invalidation": "",
        "is_directional": false
      },
      "full_analysis": "## VGLT Trading Strategy - Final Recommendation (2025-03-24)\n\n**1. MULTI-TIMEFRAME TREND SYNOPSIS:**\n\nThe analysis reveals a shift from initial bullish sentiment (Step 2) to a neutral then bearish outlook (Steps 3 & 4). While the secret baseline remains neutral (60% confidence), the recent price action demonstrates a clear downward trajectory. The 1mo/1d timeframe is showing weakening momentum, while the daily timeframe confirms the bearish reversal. The 15m intraday data supports short-term bearish pressure. The dominant price structure is a potential descending triangle forming, indicating a continuation of the downtrend. Despite the baseline, the consistent bearish signals over the last three days (70% confidence each) warrant a deviation. Overall directional bias: **Bearish (75% confidence)**.\n\n**2. VOLATILITY AND PRICE ACTION SUMMARY:**\n\nVolatility, anchored at 0.9086060829348162% (30-day ATR), has seen a slight increase coinciding with the bearish move. This suggests increasing market uncertainty and potentially higher option premiums. Price action is characterized by accelerating downward momentum, breaking through initial support levels. The recent price decline indicates a loss of bullish conviction and a growing willingness of sellers to enter the market. This increased volatility, coupled with bearish momentum, favors strategies that profit from limited downside movement or a continued decline.\n\n**3. CRITICAL LEVELS SYNTHESIS:**\n\n* **Resistance:** $57.72 (Step 2 high), $57.44 (Step 3 high), $56.85 (Step 4 high) - These levels have acted as ceilings, consistently halting upward progress. $55.16 (Secret Baseline Resistance) remains a key level to watch.\n* **Support:** $53.69 (Secret Baseline Support) - This is the primary support level. A break below this level would signal further downside potential.\n* **Pivot Points:** $57.15 (average of recent highs/lows) - This level represents a potential short-term resistance point.\n\nThe $56.85 level failed to hold as support, confirming the bearish trend. The $53.69 support is now critical. Strike selection will focus on levels around these key points.\n\n**4. PERFORMANCE EVALUATION:**\n\nThe initial prediction (Step 2) was incorrect, as the bullish momentum did not sustain. The subsequent neutral and bearish calls were more accurate, reflecting the changing market dynamics. The reliance on a single timeframe (initial bullish call) proved unreliable. Adjustments were made to prioritize multi-timeframe analysis and incorporate volatility data. The historical performance of bull put spreads (0% win rate) is concerning, reinforcing the need to avoid this strategy. The key takeaway is the importance of adapting to changing market conditions and avoiding confirmation bias.\n\n**5. STRATEGY RECOMMENDATION:**\n\nGiven the bearish trend and increased volatility, an **Iron Condor** is the most appropriate strategy. This allows for profit from limited price movement while managing risk.\n\n* **Primary Strategy:** Iron Condor\n* **Alternative Strategy:** Bear Call Spread (if volatility spikes significantly)\n\n**Entry Criteria:** VGLT price below $57.00.\n\n**Specific Strikes:**\n* **Short Call:** $57.50\n* **Long Call:** $58.00\n* **Short Put:** $53.50\n* **Long Put:** $53.00\n\n**Position Sizing:** 5% of portfolio.\n\n**Target Profit:** 3% of the invested capital (e.g., $300 profit on a $10,000 position).\n\n**Stop Loss:** 1.5% of the invested capital (e.g., $150 loss on a $10,000 position). This will be triggered if either the short call or short put is breached.\n\n**Risk/Reward Ratio:** 1:2 (Target Profit / Stop Loss = 3% / 1.5%)\n\n**Days to Expiration:** 30 days. This provides sufficient time for the trade to mature while minimizing theta decay.\n\n**6. FINAL PREDICTION:**\n\n```\nPREDICTION OUTPUT:\ndirection: [bearish]\nmagnitude: [2.5%]\ntimeframe: [next_5_days]\nconfidence: [80]\nkey_levels: [53.69, 55.16, 56.85, 57.50]\nstrategy: [iron condor]\nspecific_strikes: [57.50/58.00/53.50/53.00]\nposition_size: [5%]\nrisk_reward_ratio: [1:2]\nprofit_target: [3%]\nstop_loss: [1.5%]\nmax_days_in_trade: [30]\nprobability_of_success: [70%]\n```\n"
    },
    {
      "ticker": "VGLT",
      "date": "2025-01-24",
      "type": "summary",
      "analysis_type": "summary",
      "next_day_prediction": {},
      "next_week_prediction": {},
      "next_month_prediction": {},
      "full_analysis": "## VGLT Trading Strategy - Final Recommendation (2025-03-24)\n\n**1. MULTI-TIMEFRAME TREND SYNOPSIS:**\n\nThe analysis reveals a shift from initial bullish sentiment (Step 2) to a neutral then bearish outlook (Steps 3 & 4). While the secret baseline remains neutral (60% confidence), the recent price action demonstrates a clear downward trajectory. The 1mo/1d timeframe is showing weakening momentum, while the daily timeframe confirms the bearish reversal. The 15m intraday data supports short-term bearish pressure. The dominant price structure is a potential descending triangle forming, indicating a continuation of the downtrend. Despite the baseline, the consistent bearish signals over the last three days (70% confidence each) warrant a deviation. Overall directional bias: **Bearish (75% confidence)**.\n\n**2. VOLATILITY AND PRICE ACTION SUMMARY:**\n\nVolatility, anchored at 0.9086060829348162% (30-day ATR), has seen a slight increase coinciding with the bearish move. This suggests increasing market uncertainty and potentially higher option premiums. Price action is characterized by accelerating downward momentum, breaking through initial support levels. The recent price decline indicates a loss of bullish conviction and a growing willingness of sellers to enter the market. This increased volatility, coupled with the bearish price action, favors strategies that profit from limited downside movement or a continued decline.\n\n**3. CRITICAL LEVELS SYNTHESIS:**\n\n* **Resistance:** $57.72 (Step 2 high), $57.44 (Step 3 high), $56.85 (Step 4 high) - These levels have acted as ceilings, consistently halting upward progress. $55.16 (Secret Baseline Resistance) remains a key level to watch.\n* **Support:** $53.69 (Secret Baseline Support) - This is the primary support level. A break below this level would signal further downside potential.\n* **Pivot Points:** $57.15 (average of recent highs/lows) - This level will act as immediate resistance.\n\nThe $56.85 level failed to hold as support, confirming the bearish trend. The $53.69 support is now critical. Strike selection will focus on levels around these key points.\n\n**4. PERFORMANCE EVALUATION:**\n\nThe initial prediction (Step 2) was incorrect, as the bullish momentum did not sustain. The subsequent neutral and bearish calls were more accurate, reflecting the changing market dynamics. The reliance on a single timeframe (initial bullish call) proved unreliable. Adjustments were made to prioritize multi-timeframe analysis and incorporate volatility data. The historical performance of bull put spreads (0% win rate) is concerning, reinforcing the need to avoid this strategy. The key takeaway is the importance of adapting to changing market conditions and avoiding confirmation bias.\n\n**5. STRATEGY RECOMMENDATION:**\n\nGiven the bearish trend and increased volatility, an **Iron Condor** is the most appropriate strategy. This allows for profit from limited price movement while managing risk.\n\n* **Primary Strategy:** Iron Condor\n* **Alternative Strategy:** Bear Call Spread (if volatility spikes significantly)\n\n**Entry Criteria:** VGLT price below $57.00.\n\n**Specific Strikes:**\n* **Short Call:** $57.50\n* **Long Call:** $58.00\n* **Short Put:** $53.50\n* **Long Put:** $53.00\n\n**Position Sizing:** 5% of portfolio.\n\n**Target Profit:** 3% of the invested capital (e.g., $300 profit on a $10,000 position).\n\n**Stop Loss:** 1.5% of the invested capital (e.g., $150 loss on a $10,000 position). This will be triggered if either the short call or short put is breached.\n\n**Risk/Reward Ratio:** 1:2\n\n**Days to Expiration:** 30 days.\n\n**6. FINAL PREDICTION:**\n\n```\nPREDICTION OUTPUT:\ndirection: [bearish]\nmagnitude: [2.5%]\ntimeframe: [next_5_days]\nconfidence: [80]\nkey_levels: [53.69, 55.16, 56.85, 57.50]\nstrategy: [iron condor]\nspecific_strikes: [57.50/58.00/53.50/53.00]\nposition_size: [5%]\nrisk_reward_ratio: [1:2]\nprofit_target: [3%]\nstop_loss: [1.5%]\nmax_days_in_trade: [30]\nprobability_of_success: [70%]\n```\n"
    }
  ],
  "memory_context": {
    "ticker": "VGLT",
    "key_levels": {
      "support": [],
      "resistance": [],
      "pivot_points": []
    },
    "pattern_reliability": {
      "head_and_shoulders": {
        "correct": 0,
        "total": 0,
        "accuracy": 0
      },
      "double_top": {
        "correct": 0,
        "total": 0,
        "accuracy": 0
      },
      "double_bottom": {
        "correct": 0,
        "total": 0,
        "accuracy": 0
      },
      "triangle": {
        "correct": 0,
        "total": 0,
        "accuracy": 0
      },
      "flag": {
        "correct": 0,
        "total": 0,
        "accuracy": 0
      },
      "wedge": {
        "correct": 0,
        "total": 0,
        "accuracy": 0
      }
    },
    "volatility_history": [
      {
        "date": "2025-03-20",
        "iv": 0.5363107791993402,
        "hv": 0.42904862335947214,
        "adjustment": "no change"
      },
      {
        "date": "2025-03-21",
        "iv": 0.46054496659357075,
        "hv": 0.3684359732748566,
        "adjustment": "no change"
      },
      {
        "date": "2025-03-24",
        "iv": 0.45692390923702053,
        "hv": 0.3655391273896164,
        "adjustment": "no change"
      },
      0
    ],
    "spread_performance": {
      "bull_put": {
        "wins": 0,
        "total": 2,
        "win_rate": 0.0
      },
      "bear_call": {
        "wins": 0,
        "total": 1,
        "win_rate": 0.0
      },
      "iron_condor": {
        "wins": 0,
        "total": 1,
        "win_rate": 0
      },
      "directional": {
        "long_call": {
          "wins": 0,
          "total": 0,
          "win_rate": 0
        },
        "long_put": {
          "wins": 0,
          "total": 0,
          "win_rate": 0
        },
        "call_debit_spread": {
          "wins": 0,
          "total": 0,
          "win_rate": 0
        },
        "put_debit_spread": {
          "wins": 0,
          "total": 0,
          "win_rate": 0
        }
      }
    },
    "weight_adjustments": [
      0
    ],
    "multi_timeframe": {
      "daily_trend": "neutral",
      "weekly_trend": "neutral"
    },
    "secret": {
      "baseline_trend": "neutral",
      "trend_confidence": 60,
      "volatility_anchor": 0.9086060829348162,
      "core_levels": {
        "support": [
          53.69
        ],
        "resistance": [
          55.16
        ]
      }
    }
  }
}