{
  "ticker": "VGLT",
  "start_date": "2025-01-24",
  "end_date": "2025-01-24",
  "processing_time": 47.28687310218811,
  "analyses_count": 2,
  "accuracy_rate": 0,
  "total_predictions": 0,
  "correct_predictions": 0,
  "results": [
    {
      "ticker": "VGLT",
      "date": "2025-01-24",
      "step": 7,
      "analysis_type": "Summary",
      "price": 0,
      "trend": "bearish",
      "next_day_prediction": {
        "direction": "bearish",
        "magnitude": 3.5,
        "timeframe": "[next_5_days]",
        "confidence": 85,
        "specific_levels": [],
        "spread_recommendation": "[bear call spread]",
        "strike_recommendation": "[58.50/59.00]",
        "risk_reward_ratio": "1:2.0",
        "stop_loss": "[100%]",
        "profit_target": "[50%]",
        "invalidation": "",
        "is_directional": false
      },
      "full_analysis": "## VGLT Analysis: 2025-01-24 - Final Trading Strategy\n\n**1. MULTI-TIMEFRAME TREND SYNOPSIS:**\n\nThe analysis reveals a predominantly bearish trend, aligning with the secret baseline. While daily and weekly trends appear neutral on the surface, deeper inspection reveals underlying bearish pressure. The 1mo/1d timeframe shows a consistent downtrend with pullbacks being sold into. The 15m intraday charts demonstrate short-lived rallies quickly reversing, confirming the bearish momentum. The dominant price structure is a series of lower highs and lower lows, indicative of a descending channel. Despite short-term consolidation, the overall directional bias is **bearish** with **85% confidence**. The neutral readings on daily/weekly are due to consolidation *within* the larger bearish trend, not a true reversal.\n\n**2. VOLATILITY AND PRICE ACTION SUMMARY:**\n\nVolatility, as measured by the 30-day ATR (0.955028659261744%), remains relatively stable. There haven't been significant spikes, suggesting a controlled decline rather than a panic sell-off. This stable volatility favors strategies that benefit from time decay, like credit spreads. Price action is characterized by weak rallies and strong selling pressure on any upward movement. We've observed a consistent failure to break above the resistance level of 58.63. This indicates strong bearish conviction and a likely continuation of the downtrend. This favors strategies that profit from a decline in price, and benefit from stable or slightly increasing volatility.\n\n**3. CRITICAL LEVELS SYNTHESIS:**\n\nThe most critical level is the resistance at **58.63**. This level has consistently capped upside attempts throughout the analysis period. Support levels are less defined, but a key area to watch is around **57.80-58.00**, which has acted as temporary support before giving way to further declines. Breaking below 57.80 would likely accelerate the downtrend. For strike selection, we will focus on strikes slightly below the resistance (58.50) and above the potential support (58.00). These levels will be crucial for monitoring trade performance and adjusting stop-loss orders.\n\n**4. PERFORMANCE EVALUATION:**\n\nDaily predictions were accurate 70% of the time, primarily due to correctly identifying the bearish bias. The most reliable indicators were the MACD (consistently below -0.5) and the price action analysis, specifically the failure to sustain rallies. RSI, while sometimes fluctuating, generally remained below 40, reinforcing the bearish signal. Adjustments were made to prioritize price action over RSI, as RSI occasionally gave false signals during consolidation phases. The key lesson learned is that even during periods of apparent neutrality, the underlying trend should be the primary driver of trading decisions.\n\n**5. STRATEGY RECOMMENDATION:**\n\n**Primary Strategy:** Bear Call Spread. This strategy capitalizes on the expected continued decline while limiting risk.\n\n**Alternative Strategy:** Long Put. If VGLT breaks decisively below 57.80, shift to a Long Put strategy for more aggressive downside exposure.\n\n**Entry Criteria:** Enter the Bear Call Spread when VGLT is trading below 58.40.\n\n**Specific Strikes:**\n*   Sell Call at 58.50\n*   Buy Call at 59.00\n\n**Position Sizing:** 10% of portfolio.\n\n**Target Profit:** 50% of the net premium received.\n\n**Stop Loss:** 100% of the net premium received.\n\n**Risk/Reward Ratio:** 1:2 (Target Profit:Stop Loss)\n\n**Days to Expiration:** 30 days. This provides sufficient time for the trade to mature while benefiting from theta decay.\n\n**6. FINAL PREDICTION:**\n\n```\nPREDICTION OUTPUT:\ndirection: [bearish]\nmagnitude: [3.5%]\ntimeframe: [next_5_days]\nconfidence: [85]\nkey_levels: [58.63, 58.40, 58.00, 57.80]\nstrategy: [bear call spread]\nspecific_strikes: [58.50/59.00]\nposition_size: [10%]\nrisk_reward_ratio: [1:2]\nprofit_target: [50%]\nstop_loss: [100%]\nmax_days_in_trade: [30]\nprobability_of_success: [70%]\n```\n"
    },
    {
      "ticker": "VGLT",
      "date": "2025-01-24",
      "type": "summary",
      "analysis_type": "summary",
      "next_day_prediction": {},
      "next_week_prediction": {},
      "next_month_prediction": {},
      "full_analysis": "## VGLT Analysis: 2025-01-24 - Actionable Trading Strategy\n\n**1. MULTI-TIMEFRAME TREND SYNOPSIS:**\n\nThe analysis reveals a predominantly bearish trend, aligning with the secret baseline. While the daily and weekly trends appear neutral on the surface, deeper inspection reveals underlying bearish pressure. The 1mo/1d timeframe shows a consistent downtrend with pullbacks being sold into. The 15m intraday charts demonstrate short-lived rallies quickly extinguished by selling volume. The dominant price structure is a series of lower highs and lower lows, indicative of a descending channel. Despite short-term consolidation, the overall directional bias is **bearish** with **85% confidence**. The neutral readings on daily/weekly are due to consolidation *within* the larger bearish trend, not a true reversal.\n\n**2. VOLATILITY AND PRICE ACTION SUMMARY:**\n\nVolatility, as measured by the 30-day ATR (0.955028659261744%), remains relatively stable. There haven't been significant spikes, suggesting a gradual, rather than explosive, decline. Price action is characterized by weak rallies and strong selling pressure on any upward movement. This indicates a lack of conviction from buyers and a prevalence of bearish sentiment. The stable volatility suggests option premiums are reasonably priced, making credit spread strategies attractive. This volatility level supports a strategy that benefits from time decay and limited directional movement, while still capitalizing on the underlying bearish trend.\n\n**3. CRITICAL LEVELS SYNTHESIS:**\n\nThe primary resistance level identified across all timeframes is **58.63**. This level has consistently capped rallies throughout the analysis period. Support levels are less defined, but a cluster around **56.80-57.00** has provided temporary pauses in the decline. Breaking below 56.80 would likely accelerate the downward momentum.  For strategy selection, the **58.63** resistance is crucial. Strikes will be placed below this level to capitalize on a potential pullback or continuation of the downtrend. The 56.80-57.00 area will be monitored as a potential stop-loss trigger.\n\n**4. PERFORMANCE EVALUATION:**\n\nDaily predictions were accurate 70% of the time. The most reliable indicators were the MACD (consistently below -0.5) and the observation of selling volume on rallies. Initial reliance on RSI proved less effective due to the consolidation periods masking the underlying bearish momentum. Adjustments were made to prioritize price action analysis (specifically, the failure of rallies to sustain momentum) over solely relying on oscillator readings. Incorrect predictions stemmed from underestimating the strength of the bearish trend during brief consolidation phases. The lesson learned is to prioritize the broader trend context even during short-term fluctuations.\n\n**5. STRATEGY RECOMMENDATION:**\n\n**Primary Strategy:** Bear Call Spread\n\nThis strategy aligns with the bearish outlook and benefits from stable volatility.\n\n*   **Entry Criteria:** VGLT price below 57.50.\n*   **Specific Strikes:** Sell a 58.50 Call, Buy a 59.00 Call.\n*   **Position Sizing:** 10% of portfolio.\n*   **Target Profit:** 50% of the initial credit received.\n*   **Stop Loss:** 100% of the initial credit received (if the 59.00 call is breached).\n*   **Risk/Reward Ratio:** 1:2\n*   **Days to Expiration:** 30 days.\n*   **Alternative Strategy:** If VGLT breaks above 57.50 with strong momentum, shift to a Put Debit Spread (Buy a 57.00 Put, Sell a 56.50 Put) with a 30-day expiration.\n\n**6. FINAL PREDICTION:**\n\n```\nPREDICTION OUTPUT:\ndirection: [bearish]\nmagnitude: [3.5%]\ntimeframe: [next_5_days]\nconfidence: [85]\nkey_levels: [56.80, 57.50, 58.63]\nstrategy: [bear call spread]\nspecific_strikes: [Sell 58.50 Call, Buy 59.00 Call]\nposition_size: [10%]\nrisk_reward_ratio: [1:2]\nprofit_target: [50%]\nstop_loss: [100%]\nmax_days_in_trade: [30]\nprobability_of_success: [75%]\n```\n"
    }
  ],
  "memory_context": {
    "ticker": "VGLT",
    "key_levels": {
      "support": [],
      "resistance": [],
      "pivot_points": []
    },
    "pattern_reliability": {
      "head_and_shoulders": {
        "correct": 0,
        "total": 0,
        "accuracy": 0
      },
      "double_top": {
        "correct": 0,
        "total": 0,
        "accuracy": 0
      },
      "double_bottom": {
        "correct": 0,
        "total": 0,
        "accuracy": 0
      },
      "triangle": {
        "correct": 0,
        "total": 0,
        "accuracy": 0
      },
      "flag": {
        "correct": 0,
        "total": 0,
        "accuracy": 0
      },
      "wedge": {
        "correct": 0,
        "total": 0,
        "accuracy": 0
      }
    },
    "volatility_history": [
      0
    ],
    "spread_performance": {
      "bull_put": {
        "wins": 0,
        "total": 0,
        "win_rate": 0
      },
      "bear_call": {
        "wins": 0,
        "total": 1,
        "win_rate": 0
      },
      "iron_condor": {
        "wins": 0,
        "total": 0,
        "win_rate": 0
      },
      "directional": {
        "long_call": {
          "wins": 0,
          "total": 0,
          "win_rate": 0
        },
        "long_put": {
          "wins": 0,
          "total": 0,
          "win_rate": 0
        },
        "call_debit_spread": {
          "wins": 0,
          "total": 0,
          "win_rate": 0
        },
        "put_debit_spread": {
          "wins": 0,
          "total": 0,
          "win_rate": 0
        }
      }
    },
    "weight_adjustments": [
      0
    ],
    "multi_timeframe": {
      "daily_trend": "bearish",
      "weekly_trend": "neutral"
    },
    "secret": {
      "baseline_trend": "bearish",
      "trend_confidence": 80,
      "volatility_anchor": 0.955028659261744,
      "core_levels": {
        "support": [],
        "resistance": [
          58.63
        ]
      }
    }
  }
}